,body,subreddit
605,How is Re:Zero not an Action/Adventure anime?,anime
641,what are the chances of morikawa x eita lol?,anime
1253,'The quiet dangerous one that was two steps away from shooting up the whole place' even tho I loved everyone and just wanted headpats and hugs.,anime
1991,Speaking of oregairu did that love triangle (square?) Get resolved.,anime
2262,can't wait to see the background art! and the animation for the big fight scene with the guy who's super evil.,anime
2491,The rains of Tokyo?,anime
2556,Please let there be a sadistic maid (**Blend S** has converted me into a masochist),anime
2636,I love how their ad waiting screen is literally the series ending surprise fight scene ,anime
3025,K-On,anime
3461,That wasn\u2019t nearly as bad as the time Goku died. ,anime
3879,Not sure if it's a bad or a good thing that I've only seen two of these. [Either way looking forward to listening to it!](http://31.media.tumblr.com/25153bbf754f9519fcffb5cf0b76cfde/tumblr_mj2ji2Eaqt1r922azo1_500.gif),anime
3990,Makes me curious then if ena was just testing the waters in regard to how natsume feelings for eita.,anime
4101,Oh sweet lord make me strong enough not to go have the cringiest experience of my awkward life,anime
4120,A lot of people in the sub speak English only as a second language so why bother using the translated title since it's not even translated to your native language?,anime
4293,Both of Nichijou's OPs are amazing full length. Also sakamoto's character song (the cat sings jazz!!),anime
4440,Castlevania was pretty damn good.,anime
4464,[removed],anime
4482,Aria \n\nI switched to the manga after watching the first couple episodes of Aria the Animation and never finished the anime  ,anime
4746,You forgot: 3) Bonus points if there's sexual stuff in the previously mentioned ideas or bullshit.,anime
5395,Shit what? I LOVE Austrians. But only of the skiing variety,anime
5627,So Komiya is gonna end up with double second place?,anime
5902,[deleted],anime
6750,"Toradora sold me when [Toradora](/s \""Taiga pulls out the wooden sword after school. The fight between her and Class Pres was absolutely incredible. I loved how Pres basically hit rock bottom and was like \""I'm leaving for America tomorrow I don't give a fuck anymore.\""\"")",anime
6888,Kiznavier is rarely taked about here but it did have one scene that was great: [I couldn't find an English subbed version but still](https://www.youtube.com/watch?v=D-mhTrFV8yg),anime
6932,You're welcome.,anime
8170,I remember Kiddy Grade being a big deal and was surprised people didn't know it before realizing it's 15 years old. One of those weird moments like when I was standing in line at AX (that's not weird) and realized the person I was talking to in line didn't know Haruhi because they were 4 when it came out.,anime
8328,Pilot suits https://youtu.be/A0WLvdCp66o The second best reason to watch mecha anime. ,anime
8671,[I mean yeah](https://twitter.com/kirarafantasia/status/936188558360109057)   \n\nBut if you don't know moon runes you won't make sense of it.       \n[](#teehee),anime
8874,This dub is actually one of the good ones so it's definitely worth watching if anything.,anime
9192,its worth watching. Author of gantz wrote this if that means anything.,anime
10454,Haha that's brilliant. Don't have the drive to get into paradox games but always fun reading about them.\n\n[F](#toradorasalute),anime
10469,My complaints have been fulfilled! A video less then 15+ minutes. Good video overall and distill what can make a good fantasy world. ,anime
11030,Then you have no basis to judge the show,anime
11477,Ah. I mainly want to know when and where the livestream is going to be. I'm tempted to watch it myself. x3,anime
11489,I was weeping at that point,anime
11767,II have to give my vote with all my heart to sweetness and lightning. It is so cute. So heartwarming. So comfy. It's just amazing.   \n[](#comfy),anime
12198,"[](/s \""Nah neither of those were in the movie. Sasuke did talk to her a couple of times but it was nothing special\"")\n\nWhich episode is the coronation? Episode 500? I might just watch that then.",anime
12454,Read it again. I'm not saying they should've stopped shooting. I'm saying they should've come up with a better plan than what they did.,anime
12520,[](#salutegeo),anime
12806,Hi new FTF!\n\n[](#loliwave)\n\nAny anime Youtubers worth watching?  I stopped watching Mother's Basement due to disagreements... ,anime
12943,This season good memeface shows are Mahoujin Guru Guru and Ballroom e Youkoso.\nBut my favorite is probably Saotome Ranma.,anime
12956,Hallo new FTF.\n\nWhat are your ~~anime related~~ winter plans?,anime
13304,What a crying shame. You can always get the same experience by mashing your face into the keyboard for 30 minuets then looping the resultant shit at 50x speed.,anime
13486,OHAIO FTF! I LOVE YOU ALL!!!\n\n[So I was talking about a thing earlier and here it is](https://docs.google.com/forms/d/1axyXoj-tZ7YmRi-fOBogucT57DTrwcsPQoXniwAaZIU)\n\nBasically pick for which story idea you'd like to see me write and post onto FTF\n\n[](#urarahype)\n\nNow I have 21k words left to go and 8 hours to do it. It's time to really churn it out!,anime
13555,I love how much attention they paid to the background. I loved everything to the random guy closing his car door to \u201cHEY WHATS GOING ON OU-\u201c *camera cuts*. It\u2019s amazing how the comedy doesn\u2019t rely on exaggerated expressions but with the little moments here and there. Of course Kyon\u2019s snarky ass comments makes everything better.,anime
14064,The long awaited Morikawa x Eita meeting/talk.\n\nReally curious how they will play this out.,anime
14798,Is this actually [GwtB](http://www.blastwave-comic.com/): The Anime?,anime
15274,Can't remember what Ep.4 was but yeah 8 was fantastic storytelling. Great it's managed to be more than most people expected. ,anime
15869,I tried the quickdraw. Lol you are quick.\n\nBTW why did you stop watching MB? If you stop watching due to disagreements you will have to skip almost all 'editorial' style anime youtubers.,anime
16069,Serious note you might want to check out anime conventions in your area. There are a few around this area that do a maid cafe at the con that I've seen before. Also I went to the one at anime expo this year and it was way more fun than I expected it to be.,anime
16464,[I just wanted to brag **about my title.**](#whisperwhisper),anime
16542,It's not.,anime
17031,Read this. \nhttps://myanimelist.net/forum/?topicid=1093209\n\nJust watch it for what it is.,anime
17049,Lol I actually was stunned that even you know who's anus was defenseless against Shiro. ,anime
17088,#Whose Line is it Anime for December will be posted in 35 Minutes!\n\nPosting slightly early due to work out around the same time.,anime
17253,[deleted],anime
17552,Whenever any anime comes into a anime I can\u2019t help but think they gonna die.... elfin lied taught me that (brutally). Also am I the only one rooting for hiro? Moral aside I can\u2019t help but enjoy his screen time. ,anime
17683,I watch Digibro and Gigguk and that's about it.,anime
17902,[&gt;subtle](https://youtu.be/RVAhW4ToLFI),anime
18589,Hi new FTF!!\n\n[](#urarahype)\n\n[](#loliwave)\n\nHow's everyone day/week been?,anime
18722,I didn\u2019t either until one of the toradora threads broke it down. Especially Ami\u2019s comment right after implying there might be something more. So subtle I personally missed it.,anime
18756,Gundams been doing it a fair amount recently and if unicorn and origin are anything to go by you get some extremely impressive results.,anime
19246,[](#bearhug)\n\nEnjoy your day!,anime
20285,I like [Prof Otaku](https://www.youtube.com/user/ProfessorOtakuD2) though that is mainly because he talks about old robot shows. Though I do think his history of mecha is worth watching even if you don't care about mecha as it gives a nice overview of the industry a a whole.\n\n[Also just this animated clip of the AWO podcast on repeat forever.](https://youtu.be/1Ol7TDmq_-k),anime
21065,I'd definitely suggest a second watch because that's very similar to how I felt when I watched it/dropped it during my first watch.\n\nI hope you if you rewatch it that you get the same amount of enjoyment that I did though!!,anime
22102,**What have y'all listened to?**\n\nhow u doin\n\nThis week I listened to:\n\n* [Momma](https://www.youtube.com/watch?v=6W6K_U1ApPg) by Kendrick Lamar\n* [I'm not racist](https://www.youtube.com/watch?v=43gm3CJePn0) by Joyner Lucas\n* [Zen](https://www.youtube.com/watch?v=lDL1tFsSeWI) by DJ Krush,anime
22443,"[Konohana Kitan](/s \""the story about the old lady and her dead baby. with the spirit of the doll helping her find peace before passing over.\"")",anime
22712,"Or [manga](/s \""seeing a childhood friend bagged and tossed aside so quickly\"")",anime
23568,Crikey I've said it a few times over the past month but once again good luck with your writing. Some fun ideas there. Gotta have a velentines day section in your gay CGDCT story. ,anime
23875,See you later,anime
23976,I just looked it up and Crispin Freeman plays the guy in the middle. So I think you're right. It's his inner monologue while watching the movie.,anime
24081,I'd watch an anime where PAN is the name of the game,anime
24243,This show still makes me think of an old Go Nagai series.,anime
24381,I'm also trying to get into anime. Cowboy Bebop is great. Attack on Titan was also very good. I recently picked up Eureka Seven as it's currently on sale through Itunes. Afro Samurai looks great and I watched the first episode last night. I've watched the first few of One Punch Man and need to finish it. \n\nHope you find a few you like and let me know your recommendations. ,anime
24692,Oh... yeah that was a pretty heavy one too. ,anime
24853,Did you not watch the end of the most recent episode?,anime
25028,[You got it!](#kannathumbs),anime
26162,[So are we alone?](#shirayukieavesdrop),anime
26651,I've never actually noticed Gintama having any particularly bad fans. ,anime
26752,"The pistols Mikuru was using were BB gun replicas of the real life Desert Eagle. The version shown is intended to show the Desert Eagle with the less common 10\"" barrel as opposed to the typical 6\"" barrel.",anime
26846,Monster Musume became a 10 for me when I realized it had monstergirls.,anime
27511,Is someone being unwelcoming?\n\n\n[](#modabuse),anime
27967,next year :learn russian !!\n,anime
28214,[deleted],anime
28316,[Yes!](#concealedexcitement)\n\nWhat's in store for today?,anime
28697,[MFW I saw some weird shit today](https://imgur.com/a/dnp04),anime
28761,Artist of the Fanart you posted is tokyo_(great_akuta) or Yurukage from the circle GREAT\u82a5 (Great Akuta).\n\nPixiv (NSFW): https://www.pixiv.net/member.php?id=393047\n\nBlod (NSFW): http://acta.sblo.jp/\n\nSadly he has deleted that artwork from his Pixiv/Blog.\n\n,anime
29146,It's definitely weird but really fun to look back on after seeing the whole series.,anime
29512,Kyon is my spirit animal.,anime
30069,Good luck!,anime
30091,The last few days I haven't wanted to get out from under the covers in the morning.  It's too cozy!\n\n&gt; no one told the weather last week that it's december\n\nOh man I heard.  Thankfully I was in the mountains up north for the holiday. So I avoided that nightmare.,anime
30407,I wonder if I be unwelcoming enough if it turns around and becomes welcoming again? I'll call it the Tamaki maneuver! ,anime
30742,That's a big plan!\n\nGood luck!,anime
30905,[deleted],anime
30908,Yeah it's a shame what Kishimoto has done to these characters. Feels like a part of my childhood is being stomped on.,anime
31309,I don't really like that... electronic? background sound that starts after the TV size ends.,anime
32184,**\u30b4^\u30b4^\u30b4^\u30b4**,anime
32636,[melechesch cover of gyroscope by tea party](https://www.youtube.com/watch?v=jZprzPj7CkU)\n\n[Rockafeller skank by fatboy slim](https://www.youtube.com/watch?v=FMrIy9zm7QY)\n\nI've been really getting into metal over the past couple of months,anime
33091,[deleted],anime
33213,[**Are the normies gone?**](#shirayukieavesdrop),anime
33348,May I have the link too? ,anime
33847,Can I also get the link?\n,anime
33855,Yeah the dub is really great. I always like to alternate between dub/sub on rewatches.,anime
33897,&gt;They typically call it an Action game.....people will forever categorize it as a Japanese game.\n\nWhich is it? Cause it is defined as an RPG,anime
34835,One of I think two Kyoani pantyshots *ever*. Quite the important milestone clearly.,anime
35123,Not since you're here.,anime
35208,Music!\n\nOnly a couple albums left to reach Bjork's debut and thus album 750!\n\n[Ministry](https://www.youtube.com/watch?v=GXCh9OhDiCI) ding a ling..\n\n[Pantera](https://www.youtube.com/watch?v=7QcMhOFAVzE)  being.. not nice\n\n[Alice in Chains](https://www.youtube.com/watch?v=Nco_kh8xJDs) into the flood\n\n[Nick Cave](https://www.youtube.com/watch?v=AoFxUJtSp4g)\n\n[Suede](https://www.youtube.com/watch?v=i7mEB2wnDLQ) \n\n[Paul Weller](https://www.youtube.com/watch?v=BeiB9x5XT_0) \n\n[Smashing Pumpkins](https://www.youtube.com/watch?v=xmUZ6nCFNoU) Today is the greatest day I've ever known!\n\n[The auteurs](https://www.youtube.com/watch?v=A8YChq-qIvk) parking cars..\n\n[Liz Phair](https://www.youtube.com/watch?v=3DFpJBEKugY)\n\n[Nirvana](https://www.youtube.com/watch?v=3rS6mZUo3fg)\n\n[Jamiroquai](https://www.youtube.com/watch?v=eo7iwlMFPrM) feat. a Digeridoo!\n\n[Pet Shop Boys](https://www.youtube.com/watch?v=gn-ofIAbv-w) will go where they can be what they want\n\nAlso started that series that seems to mix the 100 year war with space and classical music so have some..\n\n[Beethoven](https://www.youtube.com/watch?v=KjMd0cjaRaI). This one has Peanuts!\n\n[Nielsen](https://www.youtube.com/watch?v=niF6Y7ZNqys)\n\n[Mahler](https://www.youtube.com/watch?v=BFY7_Tx98G8)\n\n,anime
35222,The Soul Calibur 6 rumors has me getting back into creating SC5 characters. I had some real fun with its character creation. Some characters included:\n\n- Black*Star (as Maxi)\n\n- Erza Scarlet (as Siegfried)\n\n- Patrick Star (as Devil Jin)\n\n- Astrid from HTTYD (as Astaroth)\n\nand so much more. SC6 needs to be real...,anime
35350,I used over 400 quartz for Scathach and only got 2 4 stars so there's that...  \nI wish I had better luck with my 5 star CEs too :(.,anime
35706,Thanks!,anime
36453,I thought you meant Revy from Black Lagoon at first ,anime
36468,Amcient Magus Bride ,anime
36590,&gt; for whatever reason\n\nLike her brother being a massive siscon?,anime
36765,There are actually moments where you can see some of the actors trying to read lines which is really funny that they put that detail in.,anime
36775,The breaking of bones isn't a constant pain. I broke my elbow pretty badly and it  gets numb and swells up. There's no pain at all after a few hours. Made in Abyss also showed that numbness that sets in after the break. There's also videos on Reddit of people who get all their fingers chopped off from one hand. The reaction was very nonchalant. ,anime
36804,Okay? It's a Japanese action role playing game. Done.  ,anime
37112,I've been watching with the sound off and it's been great! The voice actor does am amazing job of taking direction. The director who told the voice actor to do that should be fired. ,anime
37388,[New FTF!!](https://i.imgur.com/bjVBzdQ.gifv),anime
37808,Sena Kashiwazaki,anime
38082,Yeah the dub is really good. Some other notables are Koizumi being Lelouch and Kyon being Winston in overwatch.,anime
38989,I can already hear my neighbors complaining that I'm keeping them up at 2AM in the morning with my incoherent screaming of the lyrics,anime
39195,"Worst of all are all those rabbit Jewelpet fans.\n\n[](#konhug \""I wonder if there's more than one on /r/anime. I'm both ashamed and proud of that pun btw\"")",anime
39678,Your waifu,anime
39965,LMAO THIS ANIME,anime
40745,This episode is so fun to rewatch when you have all the context available. I was legit smiling through the entirety of it.,anime
41886,Karen is perfection\n\ndesu,anime
42552,Made in abyss is probably the one you cant remember. Has been very popular. \nNew Game! has the same feel as Blend S imo.,anime
42589,"It's great because as a newcomer you're like \""wtf\"" throughout but as a rewatcher you're like \""wtf how did I not realize this.\""",anime
42890,Ya'll are Gems to me :3,anime
43111,[deleted],anime
44555,Family is starting to set up the tree so they went full world christmas music binge..\n\n[Spain](https://www.youtube.com/watch?v=QNP1feE010w)\n\n[Germany](https://www.youtube.com/watch?v=NVmBU1XXfsM)\n\n[Latin America](https://www.youtube.com/watch?v=lwZf0qc9EGI)\n\n[Mexico](https://www.youtube.com/watch?v=av_4BMOSCSE)\n\nand I just needed to share the pain..\n,anime
46559,Delet this.,anime
46863,Can't wait until season 2,anime
48201,Thanks darling.,anime
48498,Houseki no Kuni is my favorite show since 2014.\n\n,anime
48922,Happy Birthday Karen! Stay kawaii\n\n[](#woo),anime
48952,That might just be crazy enough to work! ,anime
49076,I like to bring my anime too.  Love waiting until the season is over and binge watch it in a week.,anime
49135,[](#eyythisguy)\n\nare you not watching this show Caco?,anime
49550,Only the first episode was subbed and that was back in 2011. You can find it on the seven seas.,anime
50057,Actually they've already made a dub and Kyle voices in it too. They were tweeting about their recording being done a while ago.,anime
50916,Coming in ~3 years before developing [wholesome panty shot technology](https://i.imgur.com/cO4s8Ql.gif),anime
50948,&gt;You know almost exactly what she's going to be like in those few seconds of screen time.\r\rAn enthusiastic female Hitler with no sense of shame.,anime
51224,PM me too thanks!,anime
52747,My resolution is to forget my resolution within the first two weeks.,anime
52844,luv u 2,anime
53102,Gunbuster and Diebuster are by the same studio.,anime
53297,Yeah I don't think you understand how huge Amazon is. They'll get those shows regardless of what you say.,anime
54114,-Spice and Wolf\n\n-Zetsuen no Tempest\n\n-The iDOLMASTER\n\n-Hibike Euphonium\n\nBelieve me if you have some sense of taste you will find her.,anime
54734,yea,anime
55847,[deleted],anime
56226,Gonna try again to be in FTF a little more this week. Too much going on IRL to stay well-caught-up with the pace in the thread...,anime
56642,kakashi saying that his exam is challenging got me in a jimmy,anime
56719,There is no chance it's getting an anime another season?,anime
57220,Actually I've got something I've been meaning to ask you; how do you keep focused and motivated to write for such long periods of time? Yeah I don't do creative writing purely academic non-fiction but I imagine there must be some overlap in things that can help you knuckle down. ,anime
57541,he needs a flat hat and a cane. Then he'll finish it.,anime
58002,That one reading teacher from assassination classroom,anime
58057,I don't know who that is...,anime
59262,***WHO*  ARE  YOU**\n\n**ARE**   YOU   WHO\n\n**YOU**  WHO   ARE,anime
59463,He's a manga reader.,anime
59940,Perhaps a Hokie Cyclist?  \n  \n[](#yuishrug),anime
60423,For an actual carol it has to be silent night.\n\nThat's kinda boring though. In keeping with the party spirit I say we forget carols and just sing jingle bells. ,anime
60456,Kyon would be the guy who'd give the best commentary on a series rewatch. The way he responds to weird or ridiculous events is golden.,anime
60478,Or they're a teenage girl.,anime
60560,* [Xanthochroid -  In Putris Stagnum](https://www.youtube.com/watch?v=5a24y83_mcU)\n* [Carach Angren -  Bitte t\u00f6tet mich](https://www.youtube.com/watch?v=7ayqdMiOv38),anime
60826,And now begins the long wait for *The Redemption Story*.,anime
60928,&gt;it would be better for her to somehow crack it.\n\nIt would be even better if her father was some kind of genius programmer.,anime
61049,[deleted],anime
61335,The Anime version of 12 days of Christmas\n,anime
61534,What the mods secretly want from Santa for Christmas\n,anime
61708,Hilariously specific situations Net Neutrality will hurt anime fans.\n,anime
61907,Political issues that the mods *would allow*\n,anime
62207,"What the \""Weeb Christmas Tree\"" has on it\n",anime
62424,"Less preferred threads than \""I just watched...\"" threads.\n",anime
62587,How the [Christmas Truce](https://en.wikipedia.org/wiki/Christmas_truce) be done along anime fans.,anime
62603,He's talking about the encore marathon,anime
62622,[removed],anime
62647,\nThe Sparknotes version of an anime's story,anime
62730,Things more unpredictable than Juuni Taisen,anime
62828,yeah watching that already,anime
63466,Good taste.,anime
63577,[Karen Desu!](http://25.media.tumblr.com/685d0424b8c81d28bb148b370e89f927/tumblr_mqd1b7zVLO1qelac3o1_250.gif),anime
63804,Busy busy! Hope the rest of the computer stuff goes smoothly. New chair sounds great at least. \n\nWhat're you cooking with the zucchini? ,anime
64078,I keep meaning to!\n\nI just...don't get around to it.\n\nI've been playing a lot of hearthstone and Odyssey and Etrian Odyssey 5 and tonight I was gonna start Kampfer rewatch but instead I'm over here making memes!\n\n[](#panic),anime
64530,Hope things quiet down for you soon! You just go at your own pace we're always here.\n\n[](#konhug),anime
64570,Man there's so much I would love to say about this episode but it's too early. \n\nThis is actually a story in the books too which makes it even funnier. It's been about a year since I read it unfortunately so I don't quite remember how it was but I remember it being similarly weird.,anime
65118,[removed],anime
65216,If I do disappear for good you seem to know me well enough to take my place.,anime
65985,[deleted],anime
66209,something so known I could only find covers on You Tube\n\n[Judy and Mary - Christmas](https://www.youtube.com/watch?v=hCx0rp-O0Dc)\n\nor an actual christmas carol\n\n[Tomoeda Shougakkou - Maria no KomoriUya] (https://www.youtube.com/watch?v=qJS1_BIDBOc),anime
66304,North Korea about to nuke Japan.,anime
66306,https://i.imgur.com/NAy2LHw.jpg,anime
66675,"\""Am I the only one...\""",anime
66787,Wrath is pretty good aswell. I love his entrance fighting the tanks and bragging how he enters from the front,anime
66842,Easy. [Seinaru Hi no Inori.](https://www.youtube.com/watch?v=UkVOFaTn0HU),anime
67145,did someone say.... Christmas [Carol????](https://streamable.com/vr3m1)\n\nBut also [Cristmas Eve by Yamashita Tatsurou](https://www.youtube.com/watch?v=nGcm-q6sfs8) of course.,anime
67228,Just Because!'s airtime,anime
67481,anything dying isn't really too big a deal anymore.,anime
67500,So like.  Anyone know if CR takes action against sharing your account?    \nMight be needing to cancel mine and I only have a handful of passes so I dunno if that will last. ..   \n\nI doubt CR will give a month free if I talk to them so canceling may be only option and would still like to avoid the seas for most of my stuff.    \nAt least until I can see how finances go going into the new year ; &lt;,anime
67924,But that deflation though,anime
68079,Now you've got me curious! Care to elaborate?,anime
68166,And Mikuru was voiced by Stephanie Sheh who also did Yui from K-On. I can't hear Mikuru in the dub without hearing Yui.,anime
68233,* [MY Mai TONIGHT](https://my.mixtape.moe/bwysjt.mp3) from Love Live! Sunshine!!\n* [MIRACLE WAVE](https://my.mixtape.moe/vjllpl.mp3) from Love Live! Sunshine!!\n* [Yuuki wa Doko ni? Kimi no Mune ni!](https://my.mixtape.moe/eeolqy.mp3) from Love Live! Sunshine!!\n* [Mirai no Bokura wa Shitteru yo](https://www.youtube.com/watch?v=T-CSBhjA1t8) from Love Live! Sunshine!!\n\nYeah...I've kinda been on an Aqours kick,anime
68833,Have you finished tsuki? ,anime
69357,&gt; Vita Sexualis) \n\nWhat's this?,anime
69980,Tell that to Isshiki and his naked apron,anime
70286,The amount of emotion portrayed through the visuals alone just seals the deal SO PERFECTLY!,anime
70561,[deleted],anime
70669,"\""What's your super duper unpopular opinion?\""",anime
70888,And that's why I love her. ,anime
71016,North Korea about to nuke ~~Japan~~ Kyoto,anime
71232,You should! We were just talking about how their is a strange overlap between Symphogear and Houseki no Kuni (and Flip Flappers) in terms of fans. People who like one seem to like the others. I think you'd like it!,anime
72297,"\""Should you watch this show\"" Youtube links",anime
73212,Think of it less as confusion and more as a mystery. Who are all these people? Why are they making a movie? DID THAT CAT JUST TALK? \n\nIt's the fun that comes from broadcast order. \n\n[](#garlock),anime
73453,What my SO wants for lunch,anime
73756,So what anime series do you think he\u2019d be good at commenting on? ,anime
73928,"\""Why isn't (insert anime) more talked about? It so underrated argh!\""",anime
74642,Redditors who very likely lie about their favourites.,anime
75057,??? What is the best way to chop video btw?\n\nI've been lazy and stupid just re-encoding in Handbrake,anime
75065,I finished Aria the Origination... I think I need a hug now\n\n[](#akkotears),anime
75307,Sees mal rank. Ranked top 50.,anime
75385,You're welcome. I hope you enjoy them! :) ,anime
75526,Aww I see geoff is the EA of anime youtube.,anime
76379,[Jingle Bells](https://www.youtube.com/watch?v=ZptwSOMKyYY),anime
76533,Anime with lolis won't be available for streaming anymore.,anime
76884,One of these shows just doesn't belong.,anime
77273,***hugs***,anime
77335,I will pay good money to see /u/millenniumking go door to door singing Genocide tbh,anime
78038,Is that last bit an exaggeration?,anime
78380,[nano wishes you a MERRY FUCKIN' CHRISTMAS](https://www.youtube.com/watch?v=ehyj_DfU9Zw),anime
78756,Things /r/anime hates more than KyoAni.,anime
79133,Bonus points if it's an opinion that a lot of people agrees with.,anime
