,body,subreddit
1991519,I\u2019m assuming that they don\u2019t want to reveal too much of the later episodes considering how short Yuusha no Shou is. Hopefully more is added as we go on. ,anime
1992128,Is English a second language for you. I noticed some common grammar mistakes that I can correct for you if you'd like.,anime
1993434,So did you make it just because you wanted to?,anime
1993786,I can\u2019t think of a way it wouldn\u2019t be. ,anime
1994366,Code Geass but I will be starting it soon. Then I will have marked off the top 10,anime
1997374,I am not native english so you're correct. Keep in mind that I wasn't focused on it when I wrote it and just wrote them as fast as I could so my grammar is pretty much garbage.,anime
1997908,Damian's hair makes him look like a balding old guy lol,anime
1997920,Still waiting for a song in the 1st CM to be released...,anime
1999169,Damn this Net Neutrality vote is pretty sad. Any anime pics to cheer people up?,anime
1999851,"Yea know this episode made me wonder...what is it about this world that every \""country\"" is a giant walled in chunk of civilization in the middle of endless countryside?",anime
2000448,The novels are pretty solid though\n,anime
2001216,Now I understand why the Godzilla Movies are split up into these Eras...,anime
2001605,[deleted],anime
2002173,I know there isn't but a really want there to be  a PHD in Traponomics being offered at Anime U.,anime
2002789,[Praise her](https://i.imgur.com/o84HyVH.jpg),anime
2003358,http://www.redditanimelist.net/index.php?sort=amount&amp;order=desc&amp;time=All&amp;seasonal=False,anime
2004011,Stranger Things is getting a new season woot! Also [this](https://www.reddit.com/r/vermont/comments/7gvujt/this_is_senator_bernie_sanders_he_has_not_sold/?ref=share&amp;ref_source=link) post from r/vermont about Bernie is ~~hot on reddit~~ trending. I guess I like VT a little more now :D ,anime
2004449,I umm...haven't watched End of Evangelion....\n\n\n[](#fingertwirl)\n\n\nMaybe I should...,anime
2005418,I had my first fender bender yesterday. I was trying to get into a tight parking space and accidentally bumped into the bumper of the car parked next to the space. I feel like absolute shit about it. ,anime
2005446,yuuna: i'm gonna refuse to talk to anyone and pretend everything is fine so they don't worry\n\neveryone: don't refuse to talk to anyone and pretend everything is fine so we don't worry\n\nyuuna: toO LaTE,anime
2005586,An hour?!?!\n\nthats like 3 episodes,anime
2007595,Are the Amazon subs for YuYuYu this week as bad as last? Do I need to do better than Horrible subs?,anime
2009603,"Disappointed that Ti's wish wasn't \""I wish to blow shit up\"". \n\nAlthouzgh what she wrote was almost as good. She would make a good PR person.",anime
2010109,Awaken my masters! ,anime
2010225,[Here!](https://imgur.com/VUEy5fI),anime
2011598,This is amazing,anime
2012158,In another world with my batphone,anime
2012874,They are aesthetically pleasing. I enjoy them. They remind me of my favorite series. I don't generally have an interest in decorations outside of anime art o3o.\n\nI also like my beach queens because\n\n[Dat Body](#gintamathispleasesme)\n\nAt the end of the day you spend money on what keeps you alive and what makes you happy. Those make me happy.,anime
2013853,I'd watch out for them changing details like they did in S1.,anime
2014703,I'd put another two-way blue arrow between Haruto and Izumi. Those guys are bros.,anime
2014729,To mark my territory and show my appreciation the franchises I love. Also the articulated ones are just fun to play around with and simulate poses from the series itself.,anime
2014747,Someone's procrastinating on a final project/paper,anime
2014881,Spoonies? Gigguk I think you've just lost your right to call yourself British right there.,anime
2015501,Figure collecting helped with my depression. \n\nPlus they're small little works of art and look fantastic. ,anime
2015738,[](#k-on-hug),anime
2015857,[**Thank You!**](#awe),anime
2016018,I'm missing LiLac(IRL TOO). :(,anime
2016316,Sekko Boys was a masterpiece and you know it,anime
2016696,yes,anime
2017016,THANK YOUUUU,anime
2017946,[deleted],anime
2019147,https://i.imgur.com/2rqdTmF.gif,anime
2019370,They didn't really leave anything to be explored for a Season 3. They wrapped everything up.,anime
2020398,r/cummingonfigurines,anime
2020836,Oh that's a low mean value ,anime
2021068, I think it's half and half.,anime
2022184,Nice. Congrats on finishing.,anime
2022274,[Here's another I particularly like](https://imgur.com/Ga5bfGx),anime
2022628,[Allow me to share this with you as well](https://www.youtube.com/watch?v=g7RZboi5wDk),anime
2022727,[Youtube mirror](https://www.youtube.com/watch?v=zJTdQTuEp6g),anime
2023607,[](#salutegeo),anime
2023965,That bowing scene lol and that head pat. I never expected a romance involving adults around their 30's and MMOs could be so cute and sweet.\n\nAnyone know how the well the Japanese are receiving the show? ,anime
2025058,Don't question it. Just accept it.,anime
2025713,Elaborate.,anime
2026072,I want to know what happens! I'll still watch it if could but wouldn't mind being spoiled ,anime
2027046,????????????,anime
2027723,I think Tony Stark has made his armor emp proof by now.,anime
2028928,Clearly there\u2019s a thick frosting of self-delusion on the basic NEET cake. And Sakura\u2019s having none of it (which is to say he\u2019s having all of it).,anime
2029341,This is the most ~~glorious~~ Gloriana gif in all of the internet,anime
2029971,Not really a plot hole if you have even the most miniscule understanding of the characters and their motivations.,anime
2030040,That thumbnail is magic alright,anime
2030489,I think my boss is being screwed by a supplier and keeps buying stuff from him because theyre friends. I got quotes for stuff from other suppliers today and the products they quoted me for are a lot cheaper and much better quality. Now I have to tell him that his m8 is a dirtball. yayyy\n\n[](#taigasigh),anime
2031891,Who's the blondie in the red jacket?,anime
2032004,Yeah on Sunday we'll be on the 4th listed episode.,anime
2032069,I need to get better at writing jokes...,anime
2032301,Dude that the best part of Eva....,anime
2032768,Man when that show ends I'mma be sad. I'm rewatching it. I made it up to episode 702 before I decided to rewatch. I'm at episode 186. Honestly I think it might be better the 2nd time around.,anime
2032868,Interesting seeing this view. I\u2019m the exact opposite though. I like buying blu rays and never buy figures. ,anime
2033683,fullmetal alchemist: brotherhood,anime
2034291,&gt; Nobody wants to hear that. I feel for you Sakurai..\n\nProblem isn't what she said but what someone with self-esteem issues interprets into it.  \nSource wa ore &gt;.&lt;,anime
2034422,I too am a Ritsu Fan,anime
2034509,No Gyo? Aww,anime
2035259,Is this show any good ? Getting Tsuki ga Kirei vibes from it and was wondering if it was anything like it ?,anime
2035278,It\u2019s certainly a change ha ha ,anime
2035814,Love that show. I'd be in.,anime
2037753,Hinata and Kageyama,anime
2038222,Isn't that the teacher from Oregairu (My Teen Romantic Comedy SNAFU)?,anime
2038755,She's my favorite female character.\n\nI've got entirely too much fanart of her.,anime
2039247,It really isn't. you'll hopefully understand what i mean after watching it.,anime
2039266,Kowai best boy.     \nHe's basically like an adult Tomoda.,anime
2039305,Oh god this guy is the only horror author I scared of. \ud83d\ude31,anime
2039549,You. I like your way of thinking.,anime
2040936,could you clarify?,anime
2041190,It turned out I actually knew the person who's car I bumped. It was like a slight indent. Doesn't stop me from savagely beating myself up about it.,anime
2041242,Guts's sword is still stupidly bigger than everyone else's.,anime
2041396,[I love pizza butt!](https://youtu.be/cCC6834cg7Y),anime
2041432,it makes me sad that you have to explain this. 3-gatsu has fairly straightforward themes that are difficult to misinterpret unless you literally judge the anime by it's description/game genre tag and dismiss it entirely.,anime
2041467,Hell yeah. ,anime
2041615,I'm mostly concerned that there's going to be a pivot and the people are going to have a deadly reminder of what it's like to be ruled over...,anime
2041866,It was a pain in the ass to read at the speed in which it was appearing and disappearing on the screen though. But thats a minor problem,anime
2042178, I recommend these. Most of them are comedy.\nHaiyore Nyaruko san( both 1st season and 2nd season which is haiyore nyaruko san F)\nNoucome is pretty funny too.\nKonosuba (both season) pretty popular comedy series.\nGabriel drop out is enjoyable as well. Tons of laugh with this.\nDunno if you into cute all girls anime or not but I'll just put it out here. New game (both season)\nThat might be not enough for you. And I assume you want some laughs so that's why I got you this list. ,anime
2043138,Happy because next week we will have the ending THAT WE NEED AND DESERVES.\n\nBut sad because will be last episode. ;-;\n\nWhy keep living after next week?,anime
2043164,I adore that show.,anime
2043747,Not weeby enough?,anime
2044228,I want it trap gay?,anime
2044434,i mean we rarely ever see men in the shower in anime so i was down to let Sakurai get his shower screen time but net juu caught me off guard with that,anime
2044653,Her and Mio are my favorites ,anime
2047181,"I'd say [meta](/s \""Shamanic Princess\"") ventures into psychological horror.",anime
2047835,"yea I get that this one was fun and over the top but people read way too much into it. I always see people say it inspired them but the only real message is \""do your best/keep trying\"" so its not THAT novel. It's a fun crazy adventure but that's about it.",anime
2048169,Sworn enemies,anime
2049857,Definitely riot ,anime
2050145,I'm confused. Since when do Toonami EVER get the rights for any anime?,anime
2050787,I'm with you on Kokoro Connect. It had so much potential but just kind of squandered it. The one girl (I forget her name but the ponytail one) was really irritating too.,anime
2051953,Hunter X Hunter or Gintama.,anime
2052425,As others said Elias is not human so he pretty much do a shit for protecting a 15 years old girl.\n\n&gt;sound just like some experiment\n\nThat the point tho. which I find it pretty much realistic that Elias only brought Chise cause he want to experiment as first. There's no way you will spent 5 million on something that wouldn't benefit you. However I will said what make their relationship good is pretty much their development and contrast between each other.,anime
2053892,It does have an overall narrative but it only really develops it in the last half of the second cour. Most of the earlier episodes build the characters personalities but thats about it.,anime
2054480,Then Gappy comes along and ruins it with his girlfriend. ,anime
2055024,the problem is for some of us we've already exhausted that option as well (as far as anything I've been interested in anyways). 5-15 years back,anime
2055306,It's ephebophilia because Chise is 16...,anime
2055970,Big fat bookwalker commercial disguised as a discussion of an anime,anime
2057247,Wut?? \u2686 _ \u2686,anime
2058812,"I actually do see mouseover and caption text from my phone. I just can't tell what the image is.\n\nI can type the images I have memorized too!\n\n[](#garlock \""See? It works just fine.\"")",anime
2060175,Time to call my congressperson.,anime
2062088,there is an anime xmen series. and maybe avengers as well. ,anime
2062887,&gt; * Ao no Exorcist - 8/10\n&gt; * Btooom! - 9/10\n&gt; * Drifters - 8/10\n&gt; * Gate - 9/10\n&gt; * Keijo!!!!!!!! - 9/10\n&gt; * Koutetsujou no Kabaneri - 8/10\n&gt; * Mayoiga - 8/10\n&gt; * Mirai Nikki - 8/10\n&gt; * Monster Musume - 8/10\n&gt; * Nanatsu no Taizai - 8/10\n&gt; * Re:Creators - 10/10\n&gt; * Tokyo Ghoul \u221aA - 8/10\n&gt; \n&gt; &gt; it just seemed too r/im14andthisisdeep for me to enjoy it\n\nSure lol. Doesn't seem like it was the anime for you to begin with.,anime
2064702,Ophu,anime
2065440,Be the change you want to see in the world!,anime
2065736,Yeah but some people are nuts.,anime
2067127,[deleted],anime
2068792,Princess Principal\n\nStories told out of chronological order just aren't that fun for me.,anime
2068914,I've even seen people in mainland China dress in Gothic lolita getups and sailor-style school uniforms. It's definitely popular.,anime
2069975,I didn't know that. I thought all it did was take the average because of that pengu meme. Thanks for sharing.,anime
2070165,**NOBODY DID ANYTHING WRONG**,anime
2071316,I remember reading this manga. It was hilarious. ,anime
2071909,Fantajy.. Cute is justice!,anime
2077196,Holy shit yes! When I finish what I'm currently reading I'm going to start it again from the beginning. It's been years since so I'm sure I forgot most of it. Can't wait.,anime
2077966,What is the appeal of watching it like this rather than just streaming on pretty much any anime site?,anime
2078950,I have one for /u/MillenniumKing and /u/ValiantSerpant [as](https://imgur.com/a/IxNr9) [well](https://i.imgur.com/Tiw3jOX.png),anime
2079140,[AHHHHHHHHHHHHH!](https://youtu.be/HjR3vYSBkL4?t=11s)\n\nNINJA BATMAN!  **NINJA BATMAN!**,anime
2080377,I was hoping that they would go for it again after the dogs interrupted them. I was pretty sure that the brother or the main guy saved her once she mentioned not knowing who they were. I knew instantly that the brother died saving her when he was cleaning the camera and that her mom mentioned meeting the person who saved her. Was kinda disappointed to be honest because it just seems way to serendipitous. I would have preferred the love just blossoming naturally without some randomly specific event needed to push them. ,anime
2082348,So is this time travel? Or another world? I'm confused,anime
2082703,Did you watch the after-credits scene? ,anime
2083574,Yes.,anime
2084399,[deleted],anime
2084524,I mean that would be future diary but it sucks.,anime
2085924,I can only level her to 60 because Caesar is too fat and ate all my damn infinity gears.\n\n[](#sadholo),anime
2085976,Santa Alter is adorable omfg\n\n[](#utahapraises),anime
2085985,Natsume is the definition of basic \n\nWhy do basic girls always win ,anime
2088196,Finally realising I should have made a MAL account and put all my anime there rather than having like 20 tabs on mobile and most saved as comments on Reddit \nFML,anime
2089230,[\u30fd(\u2018 \u2207\u2018 )\u30ce] (https://www.youtube.com/watch?v=zqIeclCU0Zg),anime
2089396,Sweet merciful zombie jesus that looks gorgeous.,anime
2090445,If both eyes work normally it doesn't make a lick of difference and I often catch myself and others switching from one eye to the other for no real reason.\n\nIn your example I'd always focus on the correctly working eye as it might feel like you're not looking at him directly if you're focusing the other eye.,anime
2090564,[deleted],anime
2090655,Maybe check out [Love Tyrant](https://myanimelist.net/anime/32262/Renai_Boukun?q=renai).,anime
2091389,[removed],anime
2091447,Mick Jagger is my favorite anime character,anime
2092654,[](#thumbs-up),anime
2092695,&gt;  Do I need to do better than Horrible subs\n\n*is there better* for the show already?,anime
2093190,I think I mostly stare at people's foreheads when looking at them and other than that I try to assess their facial expressions. Though the odd thing about that is that I never know if my interpretation of them is correct or not. I feel uncomfortable holding eye contact with people.,anime
2094354,[](#uwaa),anime
2096004,I've been waiting 17 years for this. It looks so good! The voice acting is exactly the same... how the hell did they even pull this off?!\n\nMy inner pre-teen is squealing. I'm so fucking excited! ,anime
2096542,Sword Art Online is a bad show.,anime
2096601,Ping Pong the Animation is a good anime.,anime
2096748,[deleted],anime
2097948,Is that a mother fuckin' jojo's reference?,anime
2099343,Mahiro and Yoshino - Blast of Tempest\n\nKaneki and Hide - Tokyo Ghoul\n\nGon and Killua - HxH,anime
2100642,I like anime and cute anime girls.,anime
2101885,[deleted],anime
2102031,[removed],anime
2102854,Legend of the Galactic Heroes is indeed kinda good.,anime
2102898,[deleted],anime
2103100,[removed],anime
2103695,is it made in Autodesk Maya?,anime
2104781,Try Fullmetal Alchemist:Brotherhood and Code Geass.If you want something like OPM watch Mob psycho 100(done by the same creator),anime
2105027,XD,anime
2105210,tfw best jojo bromance won't be animated for years ;-;,anime
2106763,[That can't be the same Diner girl.](https://i.imgur.com/YOtF9kd.png) Is she like a Nurse Joy character where there are plenty of her working for their organization? ,anime
2106933,Shorter ones: Psycho-Pass. Made in Abyss. Madoka Magica.\n\nLonger ones: Fullmetal Alchemist. Code Geass. My Hero Academia. Hunter X Hunter. Attack on Titan.,anime
2107102,When you click something and end up [on this MAL page (NSFW)](https://myanimelist.net/anime/36755/Juvenile_Pornography_The_Animation) that's how you end up getting arrested.,anime
2107114,Who knew a robot and two girls talking about the meaning of life for 23 minutes and then murdering another robot could be this neat to watch,anime
2107885,The abuse of greatness is when it disjoins remorse from power.,anime
2108119,Hikaru by Komeshiro Kasu according to SauceNao. Have fun. c:,anime
2108523,FMAB is amazing,anime
2108533,Are those better than death note and opm?,anime
2109038,I re-watched as soon as the clear card manga was released. I definitely wasn't prepared for all of the feels from movie 2. Oh man. It was like I was a kid all over again.\n\nNothing can throw me off this fucking hype train! ,anime
2110074,highschool DxD\n\nHundred\n\nIs it wrong to pic up girls in a dungeon\n\nthe Asterisk war\n\nDate a live\n\nkill la kill,anime
2111537,I think nostalgia might have a lot to do with it like most things but since I watched it recently for the first time about a month ago it just never lived up to the hype,anime
2111832,Thanks for the LPT!,anime
2112099,X4ZYF56SPL3\n\nNMGHDDDY7HY\n\nTYMCXB85Q5T\n\nHZZ8PGMDPLA\n\nFJ9SUX6UZCC\n\nAJ9JSDBZYGD\n\nNJF4PYHJYX3\n\nGH4RGUEEUR6\n\nZ7QVDNQYRGV\n\nPNR3RJ6TDQ4\n\n6LGP6RKSJJ3\n\nWNMT7F7QKXS\n\n;) Tell me what you'll watch!,anime
2112529,Watch the movies to find out. It would be major spoilers.,anime
2113787,Fair enough. ,anime
2113925,not op but the first half of the show felt dragged out and the characters weren't very interesting (except cat girl and tall lady),anime
2114377,Thumbnail used A T T R A C T. I'ts super effective.,anime
2114769,Definetely! I am crossing my fingers for a second season but expecting an OVA etc (to avoid disappointment). \nHave you read the manga? The art is fantastic and really immersive. After watching S1 I read every available chapter in one sitting. ,anime
2115398,That mural painting of the heroes in the OP. Nope. Nope. All of my nope. You're missing a member. Nope.,anime
2115723,Why does Block Blockade Battlefront have such a ridiculous English title?,anime
2115896,I felt like the fanservice was a bit too much starting from the conversation between ren and eri over the phone. I get that there's nothing much to show but they literally just kept going over her panties and thighs :/,anime
2116044,you can only find out yourself,anime
2116411,\n\n[Dear God](#osomatsurage),anime
2116778,I'M GOING TO DESTROY THE TAISHA,anime
2118504,Where's the turnip option?,anime
2118648,We have better Dragon Ball voices overall than the Japanese.,anime
2119205,I think the only reason I didn't finish it was because I was watching at 1 am and I had to wake up early the next day!,anime
2120251,I'm assuming your boss completely 100% owns your company with no other stakeholders?\n\nOtherwise this sounds like corruption...,anime
2121556,Let's just hope that they'll do the OP in S3.,anime
2123171,broken comment face is deffo cute.,anime
2123528,[When your game goes P2W you just can't not meme](https://i.imgur.com/CktfgVA.png),anime
2124180,He's a manager in the company but he's not really knowledgeable on what products are better quality so idk,anime
2124831,with all the T&amp;A removed ,anime
2124841,Sunakawa is the best bro of all time,anime
2125350,At least not lolis,anime
2125404,Miyazaki is an absolute master of his craft.,anime
2125467,He is the perfect wingman. ,anime
2125739,Pic?,anime
2126424,Also Enel,anime
2126902,I wish there were more!!! ,anime
2127003,"In the manga there was a detail that the anime didn't include. Ruth in Hebrew means \""friend\"". Ulysse/Ruth was a bit salty that he got a name that is commonly used for females and Chise sorta just chuckled it off.",anime
2127722,Oh god. It's Kita Kita Oyaji... he's everywhere.,anime
2127871,CC is rather attractive.,anime
2129030,Probably never. Not for the next 5-10 years at least.,anime
2129972,Actually I think he has hair\nhttps://vignette.wikia.nocookie.net/onepiece/images/0/05/Enel_Without_Bandana.png/revision/latest/scale-to-width-down/180?cb=20070318111238,anime
2130231,You are most definitely not the only one.Its a very popular and highly regarded show in the community.There is a website called MyAnimeList where you can track and score the anime you have watched.It's second season is currently the 17th highest rated anime in the website with 497.630 user submitted votes.So I'd say its pretty popular..\n\n\n\nCode Geass S2 MAL Link:https://myanimelist.net/anime/2904/Code_Geass__Hangyaku_no_Lelouch_R2\n\n\n\nTop Rated Anime According to MAL Users:https://myanimelist.net/topanime.php,anime
2130402,[deleted],anime
2130612,[deleted],anime
2131814,the question is why do people by paintings to put up around the house? Why buy posters? Why decorate the house? same reasons,anime
2132163,[deleted],anime
2132571,When Nissin Noodles shuts down.,anime
2132920,Symphogear G wasn't all *that* better than GX.,anime
2134647,I think you forgot to link an image?,anime
2134684,You should actually post a picture with the question.,anime
2134737,Why do BD and DVD cases with the clips still exist? Might have to buy some empty cases without the clips to replace them. Or just rip them off.,anime
2135699,Dang. I guess I'll rewatch it dubbed now.,anime
2135814,[deleted],anime
2135909,2 series out of how many years? One hit wonder doesn't have to literally mean only one. OLM seems to have stuck to just a couple series out of at least a couple decades. I don't think people care or know about most of the other titles they might have. ,anime
2136196,Probably my favourite episode so far. Just great stuff from start to end,anime
2136380,GTA with cheat codes and jetpack,anime
2136449,Romanian Bob Ross Santa best guy.,anime
2137441,[deleted],anime
2140619,Even anime characters are telling you to read the goddamn manga.,anime
2143231,JoJo is too flamboyant for my tastes.\nI'm more of a Hokuto No Ken aka Fist of The North Star Fan..  Not saying the series is bad or anything just not my cup of tea. ,anime
2143925,Oh he is? Where is he? I couldn't see him\n\nEdit: Found him. Makes sense now.,anime
2144068,I\u2019ve been waiting for a day when we get to see a horror anime done right! Hopefully this will do the job!,anime
2144937,When he finishes Tokyo Ghoul,anime
2145022,KonosuBATMAN! ,anime
2145281,Definitely a nurse joy,anime
2146932,I don't know about that. Tanaka has said that Ohta is his ideal wife and that he wouldn't mind giving his life to Ohta. That's pretty romantic.,anime
2149093,"Boku dake ga Inai Machi (Erased)\n\nTsuki ga Kirei\n\nKokoro Connect\n\nOne Punch Man\n\nNo Game No Life\n\nClannad\n\nShigatsu wa Kimi no Uso (winner of the \""most overrated anime I have ever watched\"" award)\n\nKill la Kill",anime
2149191,No one has any information on when it will continue. It's just very likely that it will someday because of the earning potential.,anime
2150862,Zero no Tsukaima would be my best pick here,anime
2152729,[Or **Both**](#yuishrug),anime
2153077,Anyone else notice the change in Kino's hair color? I like this color much more.,anime
2153339,I don't see how cards being free is a problem. ELI5?,anime
2154048,Thanks,anime
2154228,Sorry I should be clearer. He became friendly with a supplier and the supplier has given him good deals in the past. All im saying is that there are better deals that what this guy is selling. ,anime
2154245,[I agree.](https://i.imgur.com/WfA6Sai.jpg) (NSFW),anime
2154603,Agreed and it was simply way too depressing for me to enjoy it.,anime
2154707,Why would you play the sequel first before the first game? D:,anime
2156780,Saw the url and clicked off before it loaded,anime
2157942,id say maybe a minimum 10 years.,anime
2159438,&gt; because it makes it sound just like some experiment.\n\nNot like this was almost explicitly stated in an episode or anything.,anime
2159858,Can\u2019t even call that thing a sword. Should be in the \u201chunk of raw iron\u201d picture.,anime
2160720,"I always feel bad for the titles on my PTW list. Sometimes ill start watching something and then remember \""oh i said id watch x anime next. oh well\""",anime
2161162,The miko doesn't count because she isn't a member of the combat team. She couldn't fight.,anime
2162816,According to MAL top 10 i havent seen:\n\nDeath Note\n\nAoT\n\nCode Geass\n\nSteins Gate\n\nMirai Nikki,anime
2162825,Thats awesome \n\n[](#fistbump),anime
2163313,Gundam Unicorn has a fantastic soundtrack.\n,anime
2164865,have you watched mirai nikki?,anime
2165050,Good plan son.\n\nYou've dodged jail this time. [Click here](https://www.google.co.uk/search?ei=vawhWtqhDoPUkwXBk5eYAw&amp;q=where+can+I+buy+drugs+and+prostitutes%3F&amp;oq=where+can+I+buy+drugs+and+prostitutes%3F&amp;gs_l=psy-ab.3...11073.11073.0.11267.1.1.0.0.0.0.122.122.0j1.1.0....0...1c.1.64.psy-ab..0.0.0....0.4lek_HIYtK0) to claim your prize.,anime
