,body,subreddit
1138865,what about This Stand-alone part? Do i really have to watch that part? \n,anime
1139113,"Bl titles you don't want to know. I'll give you some innocent titles though. \n\nJunjou Romantica\nSekaiichi Hatsukoi\nLove Stage \nSuper Lovers\nHitorijime My Hero (recently)\n\n\n\n\nLooking at non bl? \n\nI guess \n\n\nMonster Musume (Dropped)\nNeedless (I left immediately.)\nLoveless (I was trapped in this one. Like those abused animal commercials. \ud83c\udfb6 \""In the arms of an angel...\"" \ud83c\udfb6 - Sarah McLachlan)",anime
1139589,No MAL = No suggestions,anime
1140109,well.. no one can see your list soooo,anime
1140750,its shit i think,anime
1141698,Haibane Renmei,anime
1142873,*wakes up*\n\nlet me check FTF\n\n&gt; Aoi: gonna be going to bed in a few.\n\n[](#makicry)\n\nsleep well Aoi!!!,anime
1143542,then i dont have to watch it? okay ,anime
1144134,I'd also like to forget Darker Than Black s2 and just never watch it again.,anime
1145256,"&gt; The stand alone series can all be watched whenever you want to.\n\nThey all take place in alternate universes (A.U.) and are all not connected to any other Gundam series. Each of them is completely \""stand alone\""\n\n\n------\n\n\n**U.C. Gundam release watch order:**\n\n1. [Mobile Suit Gundam](https://myanimelist.net/anime/80)\n2. [Mobile Suit Zeta Gundam](https://myanimelist.net/anime/85)\n3. [Mobile Suit Gundam ZZ](https://myanimelist.net/anime/86)\n4. [Mobile Suit Gundam: Char's Counterattack](https://myanimelist.net/anime/87)\n5. [Mobile Suit Gundam 0080: War In The Pocket](https://myanimelist.net/anime/82)\n6. [Mobile Suit Gundam F91](https://myanimelist.net/anime/88)\n7. [Mobile Suit Gundam 0083: Stardust Memory](https://myanimelist.net/anime/84)\n8. [Mobile Suit Victory Gundam](https://myanimelist.net/anime/89)\n9. [Mobile Suit Gundam: The 08th MS Team](https://myanimelist.net/anime/81)\n10. [Mobile Suit Gundam Unicorn](https://myanimelist.net/anime/6336)\n11. [Mobile Suit Gundam The Origin](https://myanimelist.net/anime/10937) [ongoing]\n12. [Mobile Suit Gundam Thunderbolt](https://myanimelist.net/anime/31973)\n13. [Mobile Suit Gundam Twilight AXIS](https://myanimelist.net/anime/35224)",anime
1146368,Please have a cuter sounding Sakura than the Animax dub and the 4kids dub. PLEASE!,anime
1146848,anime was a mistake,anime
1147061,I\u2019m sorry to hear that:( my condolences ,anime
1149006,[](#makicry)    \n\nI'm sorry !  \nwe're on opposite schedules almost!   \nWill be waking up   [***early***](#aliens)     \nSo I'll be back **soonish!**,anime
1149418,You can watch them at any point in the future if you feel like it.\n\n[Gundam 00](https://myanimelist.net/anime/2581) is a good one I'd highly suggest.,anime
1150615,okay then this is it :D \n,anime
1150970,I think we have a new contender for weirdest idol anime lol,anime
1152759,okay mate ;)  \nI will watch right now :x ,anime
1153345,I watched all of Nisemonogatari in the middle of the living room.,anime
1154002,[deleted],anime
1156772,"&gt; Is that a real gun!?!\n\nThey are pellet guns\n\nJapan isn't (wasn't?) as strict about toy guns looking like the real thing. So it's much easier to get \""toy\"" guns looking like the real deal.",anime
1156781,wahahaha the crushing loneliness of living by yourself finally pays off. VICTORY IS MINE!,anime
1156866,Oh wow.. theres Chinese in Reddit too? :D,anime
1157298,Holy shit that scene makes me tear up every time I see it. ,anime
1157737,Watching anime. ,anime
1158402,She's a teenaged girl and that's her dad. \n\nPeople of all ages can be shitty to each other sometimes without it being about hate. May as well say Inuyashiki hates her since *he hasn't talked to her in years* and spends more time with a random neighborhood kid than either one of his own. ,anime
1159679,Calm down on the gobbling,anime
1160337,*mind blown*,anime
1160514,You should set up a [MAL](https://myanimelist.net). : \\^),anime
1161745,Marty is hiding? Super Secret Spy Marty?\n\nI'm waking up. Gotta get ready for work in a bit. Just checking out FTF right now.,anime
1162259,Brutal.,anime
1162807,Myself after too much vodka.,anime
1163309,&gt; Metropolis Part 2 \n\n[](#nichijouthumbs),anime
1163989,so are you the supplier or the receiver xD,anime
1164530,Lol Vegeta is so mad to be there\n\nAre there no bald One Piece characters??,anime
1166127,Thats a different anime but a good one,anime
1166434,Now they just need to get Mark Hamill for the dub...,anime
1166655,more framerate = more rendering -&gt; cost more time and money\n\nother than that i think they try to simulate feel of 2d animation which also has low framerate \n\n,anime
1167602,*SONO CHI NO SADAMEEE*\n\n**JOOOOOOOOOOOOOOOOJOOH**,anime
1167947,The fuck was that sinopsis hahahaha,anime
1167953,I never want to hear you say,anime
1169206,* Kiss x Sis\n* Kodomo no Jikan\n* Shinmai Maou no Testament\n* Yosuga no Sora\n\nAll of these are proper risk makers!,anime
1169685,[deleted],anime
1169698,I'm in Canada so might be a little different. I'm in the 11th grade right now. ,anime
1170052,Two were not enough.,anime
1170815,Cozy bed! Learn in bed! Don't get out!\n\n[](#saehug),anime
1171983,Higurashi.\n\nI'd love to watch it with the luxury of trying to solve the mystery again.,anime
1173340,I hope the cgi doesn\u2019t catfish like another show did recently... otherwise this looks really interesting ,anime
1173874,Best anime pet - GO!\n,anime
1174046,HAWLEE SHITTO,anime
1175658,bout damn time for batman to be a ninja. He's mastered all kinds of martial arts but we do see him make use of [ninjutsu](https://en.wikipedia.org/wiki/Ninjutsu) very often: throwing batarang (shuriken) and stealth and wearing black.,anime
1175781,[deleted],anime
1176675,Ain't she young tho? Like early 20s young?,anime
1177628,omae wa already fapped to,anime
1177659,[deleted],anime
1178348,The muscle and sword ones are fucking bonkers.\n\nGut's mile long slong covers like half the screen.,anime
1178453,Is if full batshit crazy?\n\nOr there is drama on it?,anime
1179274,because you don't drink or because you've been going down the pub for the last two years anyway?,anime
1179751,Euler form &gt;&gt;&gt;&gt;&gt;&gt; polar form,anime
1179981,*N i c e*,anime
1180534,Be MILD and ignore them\n\nBe SPICY and lend a hand,anime
1180899,"Darkness's VA going above and beyond by making her moans sound like \""boobs\"" xD\n\n",anime
1181036,Nani-the fuck? Isekai Batman??,anime
1181620,Hi dude could you please send me the link as well,anime
1182717,[guess someone made well use of this meme](https://i.pinimg.com/originals/24/5a/42/245a42a6fa50028f969fb79e7658ad63.jpg),anime
1182982,I think One Punch Man + Boku No Hero Academia or Hunter x Hunter + Fullmetal Alchemist Brotherhood are two I'd love to see fused together.,anime
1183213,Watching Houseki no Kuni after the hype on /r/anime.,anime
1183687,A screenshot of Mikuru in the bunnysuit with a gun and Nagato in her wizard getup on an old King of Fighters forum got me to pick up the anime in 2006. So I guess its a good way to start an anime? ,anime
1183778,Holy shit that's cute,anime
1183799,&gt;I'm not even at my 20th\n\nWhat are you doing lmao,anime
1184028,Yeah I was looking forward to having Harley back in BTAS style but it was a let down. I hope the animated series on DC's streaming platform ends up better. Being an adult action comedy could go either way.,anime
1184615,Most definitely this. I will not rate something a ten until it finishes. ,anime
1184759,Since you said you like comedy then Saiki Kusuo Psi-Nan is a definite must watch. It's also getting a S2 next month.,anime
1185691,"He was at least better than the \""evil producer\"" in Cinderella Girls.",anime
1186043,Inko-chan.,anime
1186141,I have changed all profile pics... I think.,anime
1187198,The part where they shot them is even wrong .. There is no way that this will ever happen in Japan or the US in this day and age.. I did expect them to die in an accident by the police. Not straight up executed like we did ..,anime
1187455,Ranma 1/2...,anime
1187787,Okuyasu,anime
1188042,Mari besto grill. &gt;:(\nBut Hanako is fine too.,anime
1188632,Actual perfection.,anime
1189006,Fate by Kokia\n,anime
1189530,Trigger doesn't actually own Ninja Slayer but yes.,anime
1190341,This is so dumb. . . I love it,anime
1190359,hwat?,anime
1190507,There's Don Chinjao. But that's the only one that comes to mind,anime
1190996,You posted this twice babe xxx,anime
1191230,I heard/watched TRUE perform this live at AFA over last weekend and it was a stunning performance for a stunning track. Really looking forward to it the full track being out!,anime
1191309,Robin's hair style destroyed me.,anime
1191399,This reminded me to pick up The Batman Who Laughs tie-in for Metal. Fuck I can\u2019t wait.,anime
1191538,Right yes! I knew it was a JoJo character. Thanks ,anime
1193485,[](#salute)\n\nI expect to hear great things when you return! ,anime
1193964,&gt;best girl Sanageyama\n\nthe only true answer ,anime
1193970,hai to natsu no grimgar was terrible,anime
1196652,Jesus Christ this sounds like the most depressing anime ever.,anime
1199961,[Keep Going. You're good](https://youtu.be/aoxF29RI2Bs?t=7),anime
1200713,Nani the fuck today,anime
1201253,Because said site is also known for having poor ratings for anything older then ten years or so that wasn't monumental.,anime
1201777,That was Bat-Shit crazy. I'm excited.\n\nHopefully it's finally something DC that isn't total ass.,anime
1202427,This person knows what\u2019s up.,anime
1202548,And [Batou](https://en.wikipedia.org/wiki/Batou)!,anime
1203550,[deleted],anime
1203582,*Lowers Pitchfork*,anime
1204120,God damnit Japan...,anime
1204221,Best girl Saya being the same is all that matters.,anime
1204891,[removed],anime
1205845,Sao,anime
1208556,ewww,anime
1208644,**B** **R** **U** **C** **E** **S** **A** **M** **A**,anime
1209502,[](#crumblingdespair)\n\n[](#kms)\n\nI'll think about this more at work. Oh and I finished Episode 7.,anime
1209869,"&gt;Izumi says Komiya is a nuisance\n\nThat might change. His expression after the non-confession was more \""Oh\"" than surprise or disgust. He may have just started to realize how *He* felt too.",anime
1210189,...is that a guy with scrotum wings in the upper left corner of the last picture!?,anime
1210583,It's really only good in being a parody of bad anime.,anime
1210714,[This slightly NSFW one.](https://i.imgur.com/JtOj0dP.png),anime
1210861,Oh good call. Also just remembered Mr 1 and Ohm,anime
1211258,"hmmm of the last four things on \""My Last List Updates\"" - three have been drops.",anime
1213741,TIL Izanagi and Izanami are making a Batman anime.,anime
1214151,Oh mai gah! https://www.youtube.com/watch?v=nlLhw1mtCFA,anime
1215345,First time watcher who knows the big twist but has never actually watched the series. Could anyone tell me in what order is this series in most...less than legal sites?,anime
1215533,Maoyuu maou yuusha is the same story(roughly) with the same VA's as well\n\nit's basically the same as S&amp;W but just not as good.\n\na character like horo is so hard to come by though :(,anime
1216678,Watching someone for an hour.. I wouldn't call that cute. ,anime
1217084,"Started watching [Mikakunin de Shinkoukei](https://myanimelist.net/anime/20541/Mikakunin_de_Shinkoukei) and already on the 3rd episode but I think I'm going to drop it. [Spoilers](/s \""Using arranged marriage as an attempt at romance doesn't sit well with me plus the comedy is kind of...meh...\"")",anime
1218107,this anime is gonna be hilarious! and quite fun to watch.,anime
1218763,After the apartment raid I'm surprised the police didn't bring heavier artillery. Granted that just may be my American bias since maybe it's unusual in other countries for police to have access to military grade weapons. ,anime
1219691,Ballroom dancing in the cantina!      \n,anime
1220962,desu,anime
1221427,You\u2019re that ninja,anime
1222903,He should have given you a 10 just like the score of the show,anime
1223798,I'd go with Big Order and Hand Shakers,anime
1224240,Euraka seven?,anime
1225160,I don't know how to feel about this show. Part of me liked it but then I think about how dumb it was. ,anime
1225708,I see it the opposite way. She's not bothered or dared to show interest in boys because of all her responsibilities. Embracing a relationship now is part of how she can assert control over her life and take care of her own needs.,anime
1226776,I mean for the twitch stream there are still ad breaks you just don't see the ads.,anime
1226849,[15 Step by Radiohead has a official anime music video.](https://www.youtube.com/watch?v=xpqk9MD6vLM)\n\nFunnily enough it is not the first time a Radiohead song is related to anime.,anime
1227403,Added.,anime
1229797,Eww.,anime
1230548,I didn't like The Irregular at Magic Highschool. The story was just kind of meh and the main character was just some emotionless husk that was overpowered as hell,anime
1231339,Japanese voice-cast:\n\n* Koichi Yamadera as Batman \n\n* Wataru Takagi as Joker\n\n*  Kugimiya Rie as Harlequin\n\n*  Jiraiya's voice actor as Alfred,anime
1233238,CARD GAMES ON MOTORCYCLEEEES,anime
1233520,can you please send me the link? thank you so much in advance :),anime
1233572,Would've been nice qq,anime
1235087,This sound more like the plot of a Hentai Manga I would read...,anime
1235123,You got Apachai in History's Strongest Disciple Kenichi,anime
1237020,Shinkai movies and KyoAni works,anime
1237197,Every day we step further from god's light,anime
1237508,Your Name (Kimi no na wa) is probably an obvious one.\n\nRedline was a good one for the herbal viewing.,anime
1238223,can I have the link too :D!,anime
1238806,[Akage no Anne](https://imgur.com/a/iNPXh),anime
1241253,"\""Younger sister anime with incest\"" genre now meets a serious contender to being the thrashiest one ever.",anime
1241659,Penguindrum,anime
1241731,didn't remember sakura voice to be so high pitch and annoying ;_;\n\nCan't wait for Tomoyo dresses &lt;3&lt;3,anime
1243576,Sakamoto.,anime
1244428,Nice thanks for the suggestion I'll watch it in the next couple nights,anime
1244542,This will be larger than life,anime
1245100,Is this for a film or a series?,anime
1246421,The CG reminded me of Fire Emblem's animated cutscenes,anime
1246497,Do we know if it's a film or a series yet?,anime
1248341,I try to clean my bathroom like Aoyama. Couldn't even get close to what he can do to a school bathroom.,anime
1250803,\u201cGod was found with multiple stab wounds and blunt force trauma at the back of his head.\u201d,anime
1250836,I want it that way,anime
1251236,Literally ,anime
1252156,Surprisingly it actually works,anime
1252693,or arrested,anime
1252863,[take](https://www.youtube.com/watch?v=6Y3OtzPl50M)\n[your](https://www.youtube.com/watch?v=T-jJatQfpm0)\n[pick](http://thehypedgeek.com/wp-content/uploads/2015/09/CrestoftheStarLafiel.jpg),anime
1253083,[English subbed version](https://www.youtube.com/watch?v=sjJnUjTXTlo),anime
1253690,I don't think I ever skipped Ergo Proxy's ED.,anime
1254620,Have we got any info on whether this is a series or a film yet?,anime
1255952,If just watched the Batman Ninja trailer and I think it\u2019s going to be pretty good. What do you think?,anime
1257359,So is it gay if we fap to the eventual rule 34 material,anime
1257851,so... from now on we can say that batman is anime character? ,anime
1262015,[removed],anime
1263683,So... Did you read OP's comment about the *Back*story?,anime
1263826,APA APA APA APACHAI PUNCHHHH,anime
1267473,[Amedio!](https://i.pinimg.com/736x/d1/2f/1b/d12f1b622c4363f7e521a3f06a290b5b--mondo-series.jpg),anime
1267510,[deleted],anime
1267694,I'm not sure I could handle an animated drr drr,anime
1267767,so uhh... why are you on this sub?,anime
1267886,LOL I love how Thailand's reputation for sex change and medical tourism extends to Japan as well.,anime
1268733,Dattebayo,anime
1269485,"Can we now play \""Name the character/anime\""?",anime
1271174,I watched it with some friends and I lost it,anime
1272460,You when I try to take a screenshot it's blacked out wth,anime
1273112,Actually it's more like the lack of any shows on said streaming sites.\n \nCrunchyroll over here has only  like 6 shows currently simulcasting .,anime
1274327,just looked at a few Shinkai movies. Art looks amazing thank you ,anime
1275246,Same. Thats why I'm also rewatching the episode before the discussion. This is also my first watch along thing,anime
1275433,I thought it was announced as a sequel but that trailer definitely looks like a reboot :(,anime
1276093,Is It Wrong To Pick Up Robins In A Circus?,anime
1276130,&gt; yikes\n\nYou're on the wrong website,anime
1277272,The teacher really knows how to cockblock.\n\nI can understand Saori's jealously and it's one that is hard to deal with not only because he likes someone else but she has to deal with his dysphoria as well. \n\nThe manga sounds great so if I have time I'll definitely go and check it out.,anime
1277591,~~MV6XU957N6K~~,anime
1280388,This submission has been removed.\n\n- Threads consisting of a direct question may be removed once a proper answer has been provided. This is not a violation of subreddit rules; it's subreddit clean-up.\n\n\n\n---\n^(Have a question or think this removal was an error?) **[^(Message the mods.)](http://www.reddit.com/message/compose?to=%2Fr%2Fanime)**  \n^(Don't know the rules? Read them )**[^(here)](/r/anime/wiki/rules)**^.,anime
1280425,[Angel's Egg](https://myanimelist.net/anime/885),anime
1280692,&gt; BACK STREET'S ~~BACK~~ TRAP\n\n#ALRIGHT\n\n,anime
1281861,Yes.,anime
1282176,Pretty awesome. The trailer already shows that the creators have a soul for Batman given the way certain characters like Red Hood were translated into the new setting. \n\nI always wanted something like that since [Batman of Shanhai](https://www.youtube.com/watch?v=dA6KPuUGQz4),anime
1282958,[deleted],anime
1283171,God I hope we get some nice Dickbutt fanservice.,anime
1283215,I wouldn't mind Bayonetta 2...,anime
1284826,&gt; MV6XU957N6K\n\nThank you kindly!,anime
1285270,Seems to be a movie from what I can tell,anime
1287153,Woo house renovations are done!!!! Finally i can catch up on my animee,anime
1287998,"[Premiere spoilers](/s \""It was used as an insert song during the premiere of episode 2 in Kyoto and fit nicely to end the episode.\"") I can't wait to see the actual ending animation.",anime
1290482,[deleted],anime
1290696,One week later.....\n\n[](#dontdometh),anime
1291055,I got my 4th 2030 from the ticket reset.,anime
1291635,Nina Tucker,anime
1291888,[deleted],anime
1292665,Anime Connoisseur ? ,anime
1293334,Now I have to check it out.,anime
1293445,As a self proclaimed connoisseur of anime how do you feel about ecchi shows like To Love-Ru,anime
1293724,That tag could be used on a bunch of people here.,anime
1294956,[](#toradorasalute)\n\n[you can do it!](#faito),anime
1297592,"[Kill la Kill spoilers] (/s \""Blumenkranz playing so early for Ryuko is some very nice and subtle foreshadowing\"")",anime
1297816,So the theme of the drawings are\n1st = Bald character\n2nd = Black haired female MC (not sure)\n3nd = Uniform\n4th = Muscle\n5th = *CLANG*\n6th = Big brother,anime
1297880,Looks [the same.](https://i.imgur.com/Gx2TfPI.jpg) (lower quality was just me taking the screenshot badly) \n\nThank you so much for letting me know there's settings though. Never even thought to check.,anime
1298057,Bill Burr,anime
1298652,[Teasing is great!](https://myanimelist.net/manga/78537/Karakai_Jouzu_no_Takagi-san),anime
1299901,Da phuk?,anime
1300645,6th is the brothers category,anime
1302944,[deleted],anime
1303571,That would be sweet!! I never got a chance to play those games on the Wii U!,anime
1303810,It's... not a trap???,anime
1306977,Definately smash. So my smash friends can actually bring a decent setup to use easier.,anime
1307881,&gt;7\n\nTop 10 anime plot twists\n\n~~I'm not the one downvoting this time btw :P~~,anime
1308726,Searched Gamers up and I love the art style of this anime. Will give it a shot. Thanks!\n\nEdit: The guy's voice is awkwardly high,anime
1310894,What does that mean?,anime
1311728,Do *you* wanna be pushed around by Nico?,anime
1311757,Hopefully it\u2019s not transphobic as fuck though and I\u2019m worried it will be. ,anime
1311782,It's an incredibly underrated show.,anime
1312165,Kitamura Eri wasn't in Kokoro Connect though,anime
1312280,Excuses excuses. ,anime
1312305,Extract them?,anime
1312669,Hunter X Hunter 100 percent,anime
1312711,[deleted],anime
1313609,what even,anime
1314262,It's still H2O so it's basically the same thing... it just went through a *P H A S E - C H A N G E ! ! ! !*\n\n[](#schemingsaten),anime
1315370,&gt;I'm ready for the doujinshi.\n\nMy body is ready :P,anime
1315749,Well for my 300th I want something really good but so far Iv been searching haven't found many I was thinking guilty crown but some of my friend and some review said it wasn't that good so il leave that for say 310 so any suggestions would be good il put up a list of what iv watched shortly ,anime
1316069,I was not.,anime
1316263,Well.\n\nThats something I guess.,anime
1317363,Ehh... it partly looks pained and I couldn't help but feel sorry for her. :(,anime
1318633,Ayy 2 new characters. I am torqued.,anime
1319054,#ZA WARULDO,anime
1321318,"[Gundam X](/s \""Garrod blowing up the Colony Laser\"")",anime
1321560,Here you go I was using iPhone note but after an update they made it so it automatically add the numbers and you can't copy those so it only numbered till about 150 I think ,anime
1322445,I guess torrenting to extract the subs would be redundant.,anime
1324857,What the fuck is happening?!  I love this!,anime
1326504,This is what we all came to the comment section for.\n\n,anime
1326966,the 3d... doesn't look that terrible\nit still turns me off too much though :c,anime
1327304,Madoka X Symphogear,anime
1327532,It easy just remember sleep is for the weak ,anime
1327663,madoka is visually stunning.,anime
1329428,True lul,anime
1329533,I thought I was crazy and it was just because I've been watching metric fucktons of JoJo recently (read: it's one of two non-Pokemon anime I've watched in the past 12 months),anime
1330298,Gunbuster is a must watch!,anime
1330781,Fascinating episode. \n\nWe get to learn so much more about the city. \n\nThe music was also on point. \n\nPotatoes in the pool!\n\nThis show continues to surprise and makes me think. \n\nIt's both comforting and yet ominous at different times. ,anime
1331711,SONO CHI NO KIOKU,anime
1331923,2D is drawn in a way which takes the framerate into account. It's easier for them to add effects from frame to frame to make things looks smoother. 3D on the order hand is rendered by software which makes it a whole lot harder to add extra effects? I don't know. I'm talking out of my ass. It made more sense in my head.,anime
1332035,And we're getting a second dose of her in this season's Houseki no Kuni. ,anime
1336144,Made in Abyss. Found it boring.,anime
1336160,watching Hunter x Hunter must be torture for you eh?,anime
1337289,For the best quality you gotta buy the actual BDs.,anime
1337806,Nanoha?,anime
1337829,&gt;Most overrated character?\n\nLelouch and Araragi,anime
1340084,[deleted],anime
1342957,watched it cos of doujinshis too. it was worth it.,anime
1343940,Toradora\n\nKill la kill\n\nGurren lagann\n\nYour name.\n\nThese are the ones that I really wish I could do it for. Especially kill la kill cause I got bored half way through and continued it like a year later. It lost something in the cut.,anime
1346607,but why,anime
1346743,I'm guessing that kid is another psychic?,anime
1347067,what,anime
1350517,I want smash and mario maker on switch!,anime
1351682,&gt;this time\n\n#***E X P O S E D*** ^^^^^^^/s,anime
1352864,[removed],anime
1354065,Corpse Party. Its literally like a Western slasher film with all the classic tropes. Its only 4 episodes as well!,anime
1360287,savage.,anime
1361823,&gt; problematic \n\nWat? ,anime
1363650,It's almost as if it's a ridiculous comedy that isn't meant to be the slightest bit realistic...,anime
1365480,The movie was better\n\nhttp://m.imdb.com/title/tt1189073/,anime
1365731,[1:02 of the ED be like](https://www.youtube.com/watch?v=RkZkekS8NQU),anime
1369381,I haven't run out of my internet quota that fast in a while but yeah... That's enough internet for one day.,anime
1371099,Koi to Uso,anime
1372002,Mario maker!! God I spent so much time o\nWatching Mario Maker streaming. Game was crazy fun! That's another one they should bring over. They carried it over to the 3ds. Why not here?,anime
1374663,It'd be a 10/10 if a time-machine carrying truck did him in.,anime
1376077,don't forget medical tourism and the grossest hookers,anime
1377512,[Merry chirstmasu](https://www.youtube.com/watch?v=KKzr-49c1KA),anime
1378458,o h s h i t,anime
1378658,[Welcome to the team](https://i.imgur.com/0ATCy1c.png),anime
1378693,which show?,anime
1379395,fuck i got bamboozled,anime
1381829,Inb4 someone is going to comment all their names,anime
1382713,[deleted],anime
1383378,I agree 100%,anime
1383742,/r/nanitf,anime
1384367,Would they have to make another adapter to let people use GameCube controllers? Buying a ton of pro controllers is expensive too!,anime
1384480,Lmao begets has a receding hairline,anime
1384621,At least we still have Pochi.,anime
1384638,It's a [Valvrave meme](https://i.imgur.com/1iBm8p9.jpg).,anime
1384807,[Snowfield](https://www.youtube.com/watch?v=o6BgI6IVnQU)\n\nEven if there is no snow in Hamburg. ,anime
1385229,Made in Abyss made me start reading manga. \nRN I'm reading Sankarea because the bittersweetness of the plot hit me real hard in the feels,anime
