,body,subreddit
8,Please watch BOTH sides,Music
1123,Im only 23 and this makes me feel old.....,Music
3357,[deleted],Music
3659,Did did did did you see the frightened ones?,Music
3887,It's all good. They got darker and became Devil Driver!,Music
4070,This masterpiece \n\nhttps://youtu.be/14gtauBh9FQ,Music
4273,Touch me by Anusface ,Music
6408,[removed],Music
6919,it's pretty clear the song isn't written from his point of view though. Lupe is just the narrator,Music
7837,See You Again by Wiz Khalifa. Makes me think about Paul Walker every time. Feelsbad,Music
8200,[deleted],Music
9020,Beautiful and underrated. Deeply underrated. ,Music
9027,I didn't fully appreciate the movie until I was a bit older. ,Music
9276,neither is the wall though,Music
10056,You may be forgetting interstellar overdrive on piper at the gates of dawn.,Music
10720,Agreed. ,Music
11265,[Bedouin covered this song and its exquisite](https://www.youtube.com/watch?v=d8vetnC1jYo),Music
11481,NHL '95 is a cult favorite of hockey fans.  EA knocked it out of the park back in the day.,Music
13406,Great album although I think his other works are better,Music
13445,Dude 5/9/77 is one of the greatest audience recordings ever.,Music
14568,Same here. I don't know if anything will top my love for Relient K's Mmhmm.,Music
15145,Ha... I was just thinking the same thing. Oakland 5/9/77 is one of he best AUDs of all time. ,Music
15188,It's alright. I've still listened to it a bunch but it doesn't hold a candle to most other Pink Floyd albums. Astronomy Domine rocks though.,Music
16651,Hey this is what Pink Floyd and Princess Diana have in common!!!\n\nTheir last greatest hit!!!! ,Music
16695,I started singing the wall during my cousins baptism when I was five. Stopped the whole procedure and stole the show!,Music
17041,Be sure to listen to the 8-Track version of Animals as both Pigs are 1 track and features a guitar solo by Snowy White that merges the 2 together. ,Music
17100,That's a weird way to spell Brain Damage.,Music
17660,High-Dive. ,Music
18551,Thank you. I needed this. ,Music
18839,Isn't that weird I thought of the lyrics to Dogs after it was mentioned? Huh.,Music
21932,*Animals* and *Wish You Were Here* are the other two.,Music
22402,[removed],Music
22746,[deleted],Music
23171,[Song For Josh - Frank Turner.](https://www.youtube.com/watch?v=0LQVMRoglIo) The start of the video gives context for the song and a bit about why he wrote it.,Music
24842,[deleted],Music
24923,That was fucking incredible,Music
25829,Is it just one person?,Music
26137,Correction:  genre is Christian rock.,Music
26313,I put this album somewhere in the top three albums for me. Most of the time it's at #1 but on some days I feel like putting Wish You Were Here or Led Zeppelin IV up there. Either way this album is very unique and makes me wish there were more concept albums like this one (not necessarily about isolation).,Music
26390,Young lust is my absolute favorite. Aboslute banger a millisecond in.,Music
27012,Which disc is filler??,Music
28825,One of the golden greats of the times.....,Music
29393,Lol I thought it was band for the past 7-8 years. ,Music
29761,Don\u2019t leave us hangin man!,Music
29797,Lol maybe you\u2019re right and I read too much into it. Whatever. PF and TI are both amazing!!,Music
29846,I can\u2019t wait to get this on vinyl.,Music
29974,[deleted],Music
31376,This is actually pretty awesome\n,Music
32634,Because they were all good?  Any my tastes are pretty varied. At least until Tim lambesis was busted trying to hire a hit man to take out his wife. \n\n\nI\u2019ve Never heard of them. ,Music
32677,You have absolutely no idea how jealous I am.\nI saw fan footage the following day and just knew that not being there would be something I'd regret for the rest of my life - despite not really knowing that the gig was happening beforehand. ,Music
33009,Tears in Heaven.. ,Music
33976,Go ahead and shit on him!,Music
34215,Build that wall!,Music
36083,My favorite is Obscured by Clouds. Love it ,Music
36189,&gt; TI and PF are both amazing\n\nFTFY :P\n,Music
37657,Piper at the Gates of Dawn was Pink Floyd's best.....Animals is boring,Music
37832,You skipped alot,Music
37900,[deleted],Music
37962,This makes me so sad.,Music
38710,I GOT A LITTLE BLACK BOOK WIT\u2019 ME POEMS INNIT!\n\n\n\n^i\u2019ve ^got ^a ^little ^black ^book\n\n^with ^my ^poems ^in ^it\n,Music
39019,imho Animals is one of the best PF albums. My personal favorite.,Music
40753,Animals sucks ass. I love the wall but their best work was Momentary Lapse of Reason and The Division Bell,Music
41256,Fly to ^fly ^to ^^fly ^^to ^^^fly ^^^to,Music
41695,RIP.  You\u2019re the man Chris,Music
41740,yes,Music
42169,I\u2019ll admit it\u2019s the best. But it is not my favorite,Music
42641,Because when you block everyone out with a wall the worms can still crawl up through the ground.,Music
42892,I have to listen to this at least once a week. I\u2019ve been a Floyd fan for 30 years and this album speaks to me for some reason. ,Music
43038,I hated the wall until I was on LSD and listened to it in a dark room in it's entirety. Not until then did I realize what a masterpiece that album was,Music
43536,Born-Again Metal,Music
43857,What shall we use\n\nTo fill the empty spaces\n\nWhere we used to talk?\n\nHow shall I fill\n\nThe final places?\n\nHow should I complete the wall,Music
43879,I didn't like it. This is just one of those things that might sound cool on paper but it's horrible in practice. ,Music
44500,[deleted],Music
45431,!Remindme 12 years\n\nFor the karma!,Music
45595,God bless Pink Floyd ,Music
46790,[deleted],Music
47271,This is gnarly.  Gojira is definitely one of the best metal bands out there right now.,Music
47747,Am I the only one that liked The Final Cut?\n\n\n,Music
47969,SURPRISE SURPRISE SURPRISE,Music
49807,Ohhhh you\u2019re the guy who\u2019s bought one of those players!,Music
55639,This guy's either a troll or too young to be on Reddit,Music
55712,I used to listen to this song on repeat while I skated and the vibe itself always pushed me to skate harder. Also made me want to date a girl that also skated but im living in a fantasy land in that part.,Music
56126,and Don\u2019t Leave Me Now. i get goose bumps every time,Music
56342,Which is not comparable to the masterpiece that is Dark Side of the Moon.\n\n,Music
56605,I'm 37 and have listened to pink Floyd for 30 years. It was one of the first albums I ever heard. Loved it through every year of my life and have all their albums to listen to on my way to work. The wall is my favourite by far.\n\nIn the flesh\n\nRun like hell\n\nVera\n\nMother\n\nOutside the wall\n\nOne of my turns.. \n\nIt's amazing right through.,Music
56912,The first time I watched The Wall I had eaten a fair amount of Lsd. Interesting experience to say the least. ,Music
58919,I've gotten some bad news for you sunshine. Pink isn't well they stayed back at the hotel.. And they sent us a long as a surrogate band...its time to find out where you fans really stand.,Music
59560,"The \""Live at Pompeii\"" version of this song is even better.",Music
59712,"\""Christian rock\"" is really hard for me to accept as a genre when that includes everything from Switchfoot to Underoath (and even further extremes). I think of \""Christian\"" as a tag that should be added to a genre label more than its own genre.",Music
59750,it\u2019s on the re release of the final cut! was soooo happy when i learned this because i effing love that song. goose bumps every time.,Music
61478,Here's a treat for you:\n\nhttps://www.youtube.com/watch?v=FM0Pl80Zf00\n\nOne of Bowie's last live appearances (and Rick's too...),Music
62493,Please teachers leave those kids alone....,Music
63485,What an awful way to word this ,Music
65452,Cassie is the reason my cat is named that. I love that song!,Music
67654,This is it.  No better soundtrack song exists.  ,Music
68190,hey hey ,Music
68425,What's the other one?,Music
68594,This is the first post like this that\u2019s actually made me feel younger. I thought the Wall was a lot older than that. I\u2019m 35. ,Music
69262,AUS :),Music
70153,IF THEY'D LET ME HAVE MY WAY I COULD'VE FLAYED HIM INTO SHAPE,Music
71176,Will be dancing to those at my wedding.,Music
72324,[removed],Music
72714,[deleted],Music
72956,Can't listen to that crap and not think of cky2k \n\n Edited: removed link forgot how nsfw that video is\n,Music
74063,"And Roger is even more of a shit bird than he was when he wrote it. Been listening to \""More\""... Pre Bono style Roger Waters music... Flame away reddit! ",Music
74556,It sounds like an album made by a people who had really grown to dislike each other and recorded all their pieces separately. ,Music
74576,In the flesh rocks,Music
75268,[Do you hear dogs](https://www.youtube.com/watch?v=qYQ-g99V_cQ)?,Music
76839,[deleted],Music
78247,THE CROWD WILL PLAINLY SHOW THE PRISONER WHO STANDS BEFORE YOU ,Music
79035,[deleted],Music
81570,\n\nMother do you think they'll drop the bomb?\u00a0\nMother do you think they'll like this song?\u00a0\nMother do you think they'll try to break my balls?\nMother should I build the wall?\nMother should I run for president?\nMother should I trust the government?\nMother will they put me in the firing line?\nMother am I really dying?\n\n,Music
83039,38 years later and Rogers Waters still has his head up his ass. ,Music
83247,Were you sentenced to be exposed before your peers?,Music
83843,Please REALLY try to listen to and feel this piece.,Music
86580,You should check out r/tipofmytongue.,Music
88279,[removed],Music
90219,[Here's the original](https://youtu.be/gloq3_fFErY),Music
90547,I will say my unpopular opinion. This is the most overated album of all time and I find thst frustrating. Just my opinion of course. But I get angry when I talk about it and just dont mkst of the time. ,Music
90745,Such an incredible album ,Music
91048,Incontrovertible,Music
91157,I was asking about a song while playing in end of the video 3:50 ,Music
91210,So record companies freak out when people download an MP3 but it's ok for them to not even pay the artists that make the product... Got it.  ,Music
94834,Honestly one of my favourite songs by Frank. So much true emotion comes through in his voice. ,Music
94982,I was in college at the time and ran out and bought this on day one. Then the radio got a hold of it and overplayed it to the point that I didn't go back to my copy for quite a while.,Music
95374,[deleted],Music
100176,[The Smiths - I Know It's Over](https://www.youtube.com/watch?v=_zX_ORazRNU),Music
100582,When I was first staring out playing guitar I joined a school of rock at the local performing arts high school. I was 13 at the time and crazy into classic rock. They were doing the wall. There were lots of kids from 12-16 all playing different instruments so I only played on one song. That was goodbye blue sky. It turned out to be one of my favorite songs and really helped me get better as I had to play with another older guitarist who was leaps and bounds better than me. I'm always happy to see people acknowledge that song. ,Music
101666,Especially since it was recorded only 30 years after the biggest war in history. ,Music
102040,Still waiting for a Blu-ray version of the movie ,Music
105979,Nothing makes me happier than a whole thread full of Pink Floyd comment chains where people actually GET THE WORDS RIGHT,Music
107517,[removed],Music
109831,I sentence you to be exPOSED before YOUR peers...\n\n***TEAR DOWN THE FUCKING WALL!!!***,Music
110767,[deleted],Music
111379,Listening to The Trial right now because it's been stuck in my head for the past few days. Such a great song and album.,Music
111518,Someone else feels this way? Compared to Animals and Wish You Were Here this is 50 percent pop music. If I never hear Brick in the Wall again I'll be OK.,Music
112347,Still an insufferable douche. ,Music
113162,[removed],Music
113231,Meddle is great.\n\nHave you seen Live At Pompeii? Incredible version of Echoes there. Love that movie.,Music
113595,Oh fucking thank you I'm not alone ,Music
114055,One of the few celebrity deaths I cried over.  ,Music
114388,[removed],Music
115280,Every 100th pressing of The Wall should have a recut version of the Trial that abruptly ends during The Trial like that.,Music
116352,*isn't this where we...*,Music
118205,Roger cut them into little pieces.,Music
119424,That's it?! ,Music
120617,I was curious if anyone else was my age on here. Thanks!  At least we don\u2019t have to feel old as shit alone. 9th Grade when it came out and one of my first albums.,Music
120975,Interesting anniversary to make a statement about.,Music
121177,anyone know if the singer has done anymore screaming? I love her voice when she does that but I looked a while ago and couldn't find any others.,Music
121351,"Well sure. Who can forget \""Sailing\""? Truly the pinnacle of popular music. \n\nsmh",Music
121749,SILENCE pig man.,Music
122490,Love this song. A great send off to one of my favorite albums. ,Music
122513,Yep. Goddamn I can't remember the name of the other track I have ,Music
123357,Well lots of people like Sailing so...,Music
123840,Now that's echoing in my head. I hear the bass drum between each STONE as well *poom* *poom* and the synth. Mechanical dogs barking.\n\nIt's a masterpiece. A masterpiece god damnit! COME ON FIGHT ME!!!,Music
124928,Disk?,Music
126277,Wanna take a bath?,Music
127377,Radiohead- Let Down \nAlfred Schnittke - Collected Songs where every verse is filled with grief ,Music
128793,I admire him for sure.,Music
130290,I became a big Nothing More fan a couple years ago after hearing a few of their songs on Octane. I got to see them live in Knoxville back in September and they put on a great show! ,Music
130369,Thanks I\u2019ll check it out ,Music
131595,[removed],Music
131726,Listen to The Wall again today...got it.  ,Music
132099,!Remindme 11 years and 364 days\n\nThis is my birthright,Music
132155,Poor geald. 1 like=1 house 4 geald the moose,Music
132492,Everything Pink Floyd did is holy and divine.,Music
132635,They didn't eat their meat. ,Music
132697,I have 6 beers left and can join you two,Music
133472,Betamax is still better.,Music
133893,Sisyphus ,Music
133976,Hell yeah. And STOP.,Music
135193,It was actually one of the first songs I learned how to play! It's really simple and fun. ,Music
135544,Roger took this line to heart too much. He didn't spit *in* the fan but rather *on* the fan.,Music
135869,Pro's and Con's of Hitchhiking is the sequel to The Wall,Music
136223,Wow. Can't believe music is 38 now.. ,Music
136654,It's the only album that SIR Bob Geldof was on that was worth a crap.,Music
136893,What about the wall part 2?\n\nThat shit made the disco charts iirc,Music
138364,That was his last resort,Music
138622,I used to think this too but I came around to this album and it\u2019s one of my favorites now. Don\u2019t give up on it,Music
138755,It's a shame that Vera doesn't get more praise. It's a short song but there's something really magical about it.,Music
141252,That's a weird way to spell Time! ,Music
141523,I love the rhythm of The trial. ,Music
142198,Hello?? Are you feeling okay?,Music
142520,Wait no,Music
142714,Where the hell are you Simon?,Music
143367,Yesterday by Atmosphere. The ending gets me every time. ,Music
144764,... we came in? ,Music
144857,Don\u2019t forget Underoath! ,Music
146585,Listening to The Wall from beginning to end for the first time was my awakening.\n\nIt's comforting to know I'm in good company.,Music
146741,Thank you for sharing this fantastic piece of music.,Music
146883,I know my haiku's are freaking intense\nbut even the words I made up to sound French\ndon't express my feelings for your toilet parts,Music
147304,"I guess you could say that \""the Wall\"" is about to hit \""the Wall\"".",Music
148248,what you guys think? ,Music
149077,Momma loves her baby...,Music
150101,Kamasi Washington - Truth\nSpoon - Hot Thoughts ,Music
150454,Damn watersheep,Music
150484,FEELINGS...of an almost ....human ...nature. ,Music
150871,D-d-d-did you every wonder why we had to run for shelter when the promise of brave new world unfurled beneath a clear blue sky?,Music
151084,And there it is. Thanks... I needed to be remided that I'm an old fart. I was in highschool when this riped through the music scene.,Music
151745,Great scene. Sad we can never see these on DVD with the original music.,Music
152323,favorite album of all time. absolute brilliance top to bottom. gods among men. ,Music
153242,So how could they have any pudding?,Music
153282,I prefer the version of Run Like Hell on here to the original. Gotta have Roger's velociraptor screeches and his spiel at the beginning.,Music
153708,Got all the way down here wondering if anyone else loved Goodbye Blue Sky. I\u2019m in tears absolutely every time I get to it.,Music
155706,I love it too. I especially love the childrens choir singing softly in the background,Music
156200,Had the wall on cassette tape in my car for a couple of decades until the sun eventually warped the crap out of it.,Music
156347,That live album is so fab.,Music
156945,I prefer the wall actually. Don\u2019t kill me,Music
157275,You don\u2019t get your royalties if you don\u2019t eat your meat!,Music
159074,My favorite album of all time.,Music
160477,\ud83d\ude02\ud83d\ude02\ud83d\ude02\ud83d\ude02\ud83d\ude02,Music
162390,FYI at the end when it loops back he says\n\nIsn't this where we | came in?,Music
163255,You should share this on r/MetalPlaylists!,Music
164337,Senior year in HS. Great memories but this isn't even their best album,Music
164381,The last lines which fade out at the end \u201cIsn\u2019t this where\u2026\u201d are possibly the most depressing part of the whole album. With the opening lines of \u201cIn the Flesh?\u201d they form the complete sentence \u201cIsn\u2019t this where we came in?\u201d. It completes the cyclical nature of the Wall as an endless circle of building and pulling down the wall. The implication being that the whole brutal terrifying process of the Wall is about to start again.,Music
167196,"\""Pig stain on your fat chin\"" one of my favorite Floyd lines.",Music
167337,"\""Is this where we came in?\""",Music
169537,"One of my favorite lyrics is \""Everybody else is just greeeeeen!\""",Music
171538,Gives me a flashback to the most depressing end to a certain Stephen King book. The cycle of futility...,Music
171686,Meh. You have an opinion. That's fine.,Music
174979,[deleted],Music
176187,Jon Paul Jones and John Bonham would like a word. But seriously Gilmour and Wright were absolutely amazing together,Music
176540,Awwwwshiiiiii,Music
177386,Best guitarist at phrasing of all time. ,Music
178518,[deleted],Music
179460,"Mean time in 1989...\n \""The took down the wall !!! let's go and make a show in Berlin !! \""",Music
180714,That electronic oinking was mind blowing on acid way back when.,Music
180863,This was one of the first albums I remember listening to front to back. Saw the movie when I was like 10 and contemplated life for a while ,Music
181198,Does anybody else feel the way I do?,Music
181423,I\u2019m older than this?! For some reason I thought it was from the 60s.  ,Music
182997,Eat your heart out Berlin,Music
183871,I remember when I first realised the end of the album just rolls over into the beginning of the album. ,Music
184759,[Life In Vain - Daniel Johnston](https://youtu.be/JkczI1-be1k),Music
186137,This is how I feel about Meddle. It\u2019s hard to go wrong with Pink Floyd,Music
186862,[removed],Music
188133,Nothing wrong there.,Music
188165,I\u2019m mighty tighty whitey and I\u2019m smuggling plums. ,Music
188658,Just saw this while listening to it \u00af\\\\____(\u30c4)____/\u00af,Music
189486,It's a very beautiful reflection on the temporary nature of life.,Music
190700,Trump's border wall inspiration\ud83d\udc4c,Music
190980,Im surprised Nobody Home isnt getting more love,Music
191666,Get off the stage Ralphie,Music
191944,Sorry if mine is one of anger ,Music
192058,Reddit do you think they'll drop the bomb?  Reddit do you think they'll like this song?  Reddit do you think they'll try to break my balls? Reddit should I build the wall? Reddit should I run for president? Reddit should I trust the government? Reddit will they put me in the firing line? Reddit am I really dying?\n\n\n\n\n\n\n\n(was that funny),Music
193784,[deleted],Music
197176,My favorite album of all time and that includes Hanson's *Middle of Nowhere*.  The show must go onnnnnnn...,Music
198127,One of my favorite albums ever. But I\u2019m only 22 so things could change...but I am very attached to Pink Floyd. My dad is a huge fan. ,Music
200036,Couldn\u2019t have put it better myself.,Music
200157,[Keaton Henson - Small Hands](https://youtu.be/9EN9MIa3Kyc) \n\nMaybe?,Music
200209,I've got my little black book with me Poems in!,Music
200289,I am so old,Music
201085,I might know what I'm trying to say?  You sure as fuck don't have a way with words either smart guy.,Music
202155,...in the suitcase on the left you'll find my favorite axe...,Music
202313,This will not do...,Music
203464,Did you ever find out? ,Music
206129,But my hands were tied. The bleeding hearts and artists let him GET AWAY WITH MURDER! Let me hammer him today.,Music
210213,Not yet,Music
210351,For the youngsters. ,Music
210395,Same. DSotM just doesn't do it for me the same as the Wall does.,Music
210531,.,Music
210751,Isn't this...where we came in?,Music
212291,That's crazy.  I randomly thew that record on today.,Music
213040,I fucking love em both,Music
213638,Had an incredible experience listening to this album while tripping with a friend. A fantastic piece of psychedelic rock.,Music
214576,Great album,Music
216364,I agree.,Music
217960,I like all the attempts Leo Morachioli's tried with different songs. I hope a lot of the downvotes are specifically because of the Toto cover.,Music
218089,I'm not sure about creed but Flyleaf actually had christian radio airplay.\n\nhttps://www.youtube.com/watch?v=u729Gm7awKE\n\nAs did POD pretty sure.\n\n,Music
218589,You must can\u2019t count,Music
219163,Yup. Me too at the PFA in Reading Pennsylvania.,Music
220928, One of my friends did this thing where she watched it maybe 20 times in a couple days.\n\nShe really loved it.,Music
221587,I guessed a pornographic ice skating show.,Music
222051,Let us know what you think!,Music
222415,[deleted],Music
223016,\u00af\\_(\u30c4)_/\u00af,Music
223488,Uh....\nPretty sure you're in the minority in that opinion.,Music
223953,*Pet Sematary*?  Maybe not.\n\nBut that damn ending still gives me chills to this day.,Music
225503,I feel no shame in saying that many of Pink Floyd's lyrics are still mysterious to me.  ,Music
227084,I did something really simmilar my first time really listening to the whole album. Being high as fuck makes the first few experiences of that album blend like fucking gold,Music
228035,[deleted],Music
228073,\u00af\\_(\u30c4)_/\u00af ... Idk WTF is happening....oh well it my Bday !!,Music
228922,So many good memories of running from the cops to this tune in GTA Vice City. ,Music
230925,Mmm yes,Music
231295,96 Quite Bitter Beings has a damn good riff,Music
232095,Wow. That guy died today.\nhttps://www.nytimes.com/2017/11/30/obituaries/jim-nabors-87-tvs-gomer-pyle-is-dead.html,Music
232439,Oh you know what I've heard a song by this group. ,Music
233089,The producer's school?,Music
233589,ITT: I found my people. ,Music
236353,"[spoiler](/s\""The Dark Tower\"")",Music
237992,Hello fellow Jesus freak,Music
238775,I didn't realize this was a Prince song. Pretty neat.,Music
238914,You need to add two \\\\ for the first arm.\n\nI had an example of it but its hard to show without it doing its thing and removing the slash.,Music
239144,"\""Surprise surprise surprise\""\nJim Nabors RIP in *There's still nobody home*",Music
239657,Yeah that\u2019s really what I should have said ,Music
240245,Fully Alive is great. Flyleaf really helps pump me uo. ,Music
241171,Everyone has their own opinions,Music
245891,[removed],Music
246305,Am I the only one who thinks: couldn't it wait another 2 years?,Music
246617,Bet he would have paid $500 to avoid the kiss,Music
247158,r/thathappened\n\n\n\nYou did forget the part where your friend gave you a 100 dollar bill though,Music
250429,[deleted],Music
252199,Abbey Road and OK Computer are amazing. I consider Dsotm and abbey road the two best albums of all time,Music
254335,God this song is still so good.,Music
255816,Fucking Showbread! I still love that band. I haven't heard anyone else ever talk about them. They had some great songs though. ,Music
256585,Hahaha. Keep listening brother!,Music
256723,You\u2019re in for a treat.  Amazing album.,Music
259403,Why not just listen on youtube/download it? I'm sure if you're in a relatively large city you can find it at any decent music store,Music
260735,I saw them live on their Anorexia Nervosa tour and holy shit it was a great show.  It was the only time I ever got to see them and they were insane. ,Music
260825,Yes.,Music
262046,Its like they had an idea for the first three album. Then took away meat around the bone for each album until there was just the bone left. As I said this is just my opinion. But I said that many people hate it XD sorry. And it really make me feel like they are,Music
262894,"That reminds me of Gilmour talking about fans that shout \""Play Money!\"" cause they just want something to \""shake their ass to\"".",Music
263324,Not to say it's not a good album. I can't name an album I totally dislike by Pink Floyd. It's just not as good to me. ,Music
265428,Has anybody ever sync'd The Wall with Alice in Wonderland? Much better than Dark Side and Wizard of Oz in my opinion. ,Music
267825,Roger leave them kids alone.,Music
271372,Thats a weird way to spell Us and Them,Music
271537,...we came in.,Music
274934,I can\u2019t do such a thing,Music
