,body,subreddit
275558,Isn\u2019t this where?...,Music
275828,MacDonald was the better singer but they made better music pre-Michael,Music
276551,Agreed. I actually prefer it over the studio album.,Music
277253,That's a weird way to spell Us and Them,Music
277619,Omg. Me toooo. Throwback!,Music
278334,And the worms ate into his brain.,Music
279096,"Rap music doesn't always suck. Trap is garbage though. So is \""cloud rap\""",Music
279388,It really is. I had an assignment in my high school theater class to perform a song as a short one act play. I chose The Trial. ,Music
285127,I shit you not. I was listening to this album while browsing and saw this. Awesome ,Music
288045,People keep commenting this haha. I\u2019m glad everyone likes it as much as I do,Music
293165,I get chills every time I hear that line. ,Music
293275,/u/Andreadenubila coincidence ,Music
294769,Build it,Music
295781,Couldn\u2019t agree more with you.  \u201cAre there any weak people into the audience tonight?\u201d in that shrilling voice.  \u201cPut your hands together.  Let\u2019s all have a clap!\u201d  Chills thinking about it... ,Music
296277,My inner emo kid is coming back out.,Music
296351,Time to check this out. Been on a real Fliyd binge since I saw Rogers a month or two ago. Thanks!,Music
296721,Probably not ,Music
297709,Watching RW perform The Trial on The Wall Live a few years back was a freaking treat.  Bucket list level.  \n  \nHad to go [watch it](https://youtu.be/4__9p4KP6DM) again!,Music
298063,[10538 Overture](https://m.youtube.com/watch?v=zAYOAHz-N08),Music
300238,I consider myself a huge fan of Pink Floyd and I've never understood the praise for The Wall meanwhile I think Animals is among the greatest albums ever recorded. That album is just perfect front to back. Dogs gives me chills every time I listen to it. ,Music
307074,THEY MUST HAVE TAKEN MY MAAARBLES AWAYYY,Music
307279,The sheet music is an awfully nice touch!,Music
309206,Beautiful! ,Music
309927,u/zegaritz IS CRAAAAZYYY. TOYS IN THE ATTIC HE IS CRAAAZZZZYYYY. ,Music
309936,[removed],Music
311176,FYI they also have done this since the 80\u2019s in Pittsburgh. It\u2019s now at the science center every midnight Friday and Saturday. Well worth it.,Music
311308,What are u wearing ?,Music
313309,Wow. What a voice. He did justice to Prince's original song with this cover. Sadly they're both gone now.,Music
314041,Or it's just a general caricature of a big Hollywood honcho. Weinstein wasn't even a big deal until the mid 80's,Music
317146,Yeah that meddle release is my second favorite right behind animals.  ,Music
317683,You're thinking of Empty Spaces. And that's one of the secret messages.  \n\nI won't tell Old Pink on ya,Music
321515,IT CAME OUT OF YOUR BODY,Music
330657,\u00af\\\\_(\u30c4)_/\u00af.... Boom!!! Thanks Bro!!!,Music
331218,Definitely. Plus I think the back and forth with him and David sounds more aggressive live; to the great benefit of the material.,Music
331732,"Ebay has one \""buy-now\"" used for like 13 but the rest on there are pretty expensive.  As someone who bought it about 10 years ago I had no idea it had actual value.  Never been able to get that into it myself other than one time when I was really fucked up.",Music
332548,LAET MI HAMMIR HEEM TODAIE,Music
332863,Is that a compliment? coz I'm already smiling with happiness all over it!,Music
333227,Worst album they ever made.,Music
339170,First time I heard this song: https://www.youtube.com/watch?v=fEz68OKTp1M,Music
339425,That would be painful. Thankfully no,Music
342936,I was drunk the first time I saw the movie. Almost made sense to me.,Music
343364,[deleted],Music
344691,Please watch BOTH sides.,Music
345874,It reminds me of the Trial scene from the video game Chrono Trigger.,Music
346027,Who would dare to underrate the trial?,Music
347522,what's significant about 38 years? Are we just gonna upvote this wikipedia article once every year now?,Music
348056,Whenever I listen to any part of the wall when my dad comes in he says this line,Music
348076,[removed],Music
349160,this is great.\n\nlike totally more than 2000 plays but this play list needs some Dino jr.,Music
350502,Lou Reed - Metal Machine Music\n,Music
353010,I first heard this song from the TV Series Symbiotic Titan. It's pretty catchy.,Music
353154,One of my hardest trips on acid was to dark side. It's cliche but it made for a wild trip,Music
353189,:/ https://www.reuters.com/article/us-people-dmx/rapper-dmx-pleads-guilty-to-u-s-tax-fraud-charge-idUSKBN1DU32J,Music
355427,shyt gave me chills,Music
356427,[removed],Music
356719,[deleted],Music
357324,Stumbled upon this WHILE listening to the album. Thank you Pink Floyd for all you done.,Music
360860,How can you have any pudding if you don't eat your meat? ,Music
361552,Greatest music album ever,Music
362961,What a beautiful face I found in this place that is circling all around the sun!,Music
363395,That's my favorite too! So awesome.,Music
363927,You! Yes you! Stand still laddie!,Music
365155,[deleted],Music
366010,[deleted],Music
366737,That's a weird way to spell Money!,Music
368830,"I thought this was going to be a remix of Smashing pumpkins \""perfect\"" lol",Music
370743,"Generally it's a little too \""Broadway\"" for me. But the message is so powerful and the chants of \""TEAR DOWN THE WALL\"" hit home every time. ",Music
373253,They didn\u2019t pay attention ,Music
377981,On a serious note.  I love that bass line in the intro.  I mean bass line for the entire song is awesome but the intro line get's me going. ,Music
378468,A lot of people do stuff like that,Music
380110,I remember hearing this when I would be playing NBA Live 07,Music
380466,/r/totallynotrobots,Music
380826,Lioooool so early 90s. Katy was a decade to late for this style she really is a loser huh,Music
381843,!remindme 729 days,Music
382916,"I really enjoy playing the song \""is there anybody out there\"" on guitar. ",Music
383791,/r/titlegore,Music
388417,Why did we have to run for shelter when the promise of a brave new world unfurled beneath the clear blue sky. ,Music
388643,Yeah tell that to Jimi lel,Music
391411,I can almost see a former prostitute struggling with herself in a mirror in her cover...it takes a whole different perspective than the police's. I love it. ,Music
392647,Chad pissing on his grave gets me every time.,Music
392841,Isn't this where we came in?,Music
393343,"&gt; Banging your heart against some ~~bad~~ mad bugger's Wall\n\nftfy\n\n\n\""is this where. . . \""",Music
393526,mama huevoooo,Music
393684,Isn\u2019t this album the #1 album sold by a long shot?,Music
394619,40 years is cooler and 30 and even 20 I'd say wait for it. Trust me 39 will be just as non exciting ,Music
396763,"Plus it has \""What Shall We Do Now\"" which is an awesome fucking song that isn't even on the regular album. ",Music
397960,i have the berlin concert on dvd. it is incredible. building the wall in the background. and all the acting while singing.... crazy!!!!!!,Music
400210,You - yes you!  Stand still laddy!,Music
400470,If you should go skating...,Music
400653,the wall is a pink floyd album. is there a movie about it too? im a few generations late,Music
401638,I prefer Ricky,Music
402982,"\""The Show Must Go On\"" also gets an extra verse and a richer sound--I used to think of it as one of the short \""filler\"" songs on the album until I heard it live.\n\nAnother Brick in the Wall Part 2 also gets a nice synth solo.",Music
402997,WAS CAUGHT RED-HANDED SHOWING FEELINGS. ,Music
403278,[removed],Music
403590,Praise the boy...,Music
403978,Wish I could re-live the first time I watched [this scene in the movie](https://www.youtube.com/watch?v=E_5DRKZI1Ow) *The Wall* without knowing the song even existed.,Music
404725,[removed],Music
405102,I actually saw CKY so long ago that All American Rejects opened for them!,Music
405184,I can't watch this... ,Music
405799,She said?,Music
407056,SO YA,Music
407169,"\""If you should go skating\non the thin ice of modern life\ndragging behind you the silent reproach\nof a million tear-stained eyes\ndon't be surprised when a crack in the ice\nappears under your feet\""\n\nW O K E",Music
407673,[deleted],Music
408372,Psh 'Nu-metal',Music
408673,Gilmour's outro solo in Pigs (Three Different Ones) is vicious.,Music
409147,Hahaha....chard you are,Music
412519,The Wizard of Oz motion picture soundtrack?,Music
419110,And all the other songs that make it a fucking masterpiece. ,Music
420226,Another brick in the wall part 2 is disco ,Music
420228,Last year it turned 37.,Music
420456,I wish I could be there. Sounds great.,Music
421729,Leather Tuscadero,Music
422724,Fuck. Cmon son. ,Music
423987,Yesssss the other pink floyd fans I know think I'm weird for having that as one of my favorites. ,Music
424227,Ayyyyy,Music
424359,Animals is easily my favorite PF album.  It is truly a tragedy that it doesn\u2019t get remembered in the same light as dark side or the wall. ,Music
424501,r/gatekeeping is thataway,Music
425980,[removed],Music
426324,True. At the time I was super intimidated because I was literally just starting. Like j had a guitar for three month before and I wasn't getting any better. That helped a lot. And also playing everything by led Zeppelin shortly after. And then the best was getting into phish and jam bands and jamming with people or a looper pedal for hours everyday. That was my biggest help. ,Music
426631,How slipknot and this be the same genre?,Music
427639,But I feel like you've discovered music through thc alone,Music
428427,One of my turns is one of my favorite songs ever,Music
428932,Best Romantic UNPLUGGED JUKEBOX 2017 | Best Bollywood Romantic Songs,Music
429731,And as relevant today as it was then. Eerily so.,Music
431280,[Something's Rattling](https://www.youtube.com/watch?v=8-3_a24I3PY) by Benjamin Gibbard.,Music
433446,"I thought *\""X is gonna give it to ya\""*?",Music
435261,[deleted],Music
438448,Bro that is a full brain reboot right there. That album is a trip even when sober. ,Music
438812,like the skin of a dying man\n\n,Music
441541,They originally wanted to have The Beach Boys sing all the harmonies and backing vocals!!,Music
448134,So crazy. Such a timeless album. I'll never forget taking a walk when I was under stress at 15 or 16 years old. Walking through the cold and blasting this album on the IPod when it first came out. ,Music
448683,my mother loves this album. It was hilarious in my small 10K pop hometown to see this 55 year old woman cruising through town blasting this out of her car. I installed the stereo in her car as a present and trust me it got LOUD! everybody in town cracked up at the sight.\n\nWe just had her over on thanksgiving so I was able to play the new movie version of it on the new 55 incher for her.\n\n/ she also loved AC/DC's Dirty Deeds which was even a funnier sight.\n\n// my experience with The Wall was dropping some Mr. Sunshine and watching the movie at the drive in as part of all night movies.,Music
451447,Rael Imperial Aerosol Kid!,Music
454530,Lanaaaaaaaaaaaaaaaaa!,Music
455599,[removed],Music
460210,Morning Dee? That song is depressing as hell. \n\nThe National does a great cover of it FWIW,Music
463088,TIL l am older than The Wall.,Music
469579,Mother am I really dying is from the movie. \n\nAlbum Lyric is \u2018is it just a waste of time?\u2019,Music
470906,Good to see another fan here with that reference.\n\nWere you a Jennifer fan or Bailey fan?,Music
470943,Fun fact: That is actually Jeff Porcaro from Toto drumming on Mother\n\nEdit: Why on God\u2019s green earth did this get downvoted?,Music
472816,Lana... Lana... LAAAAANAAAAAAAAAA\nWHAT?!\nDanger zone...,Music
474075,There is a movie that is basically a two hour long music video. It came out at the same time as the album. It's good and trippy as hell.,Music
478420,Whaaaaaaaaat?? There are other Hornets on this site? Tha fuk? ,Music
480499,Roger sent them back to their mothers in cardboard boxes,Music
483418,I cri ever tim I hear the Sheep outro,Music
484499,[deleted],Music
485424,LAANAAA,Music
485920,My parents went to college with them and would carpool back home. Great bunch of guys. Loved growing up listening to their music.,Music
485990,I\u2019m only a little sorry then. I\ufe0f only liked Hero.,Music
486007,Absolutely!,Music
490675,Haha what year did you graduate?,Music
490808,I love this album so much I directed a live theatrical adaptation of it this past spring!\n\nhttps://vimeo.com/239606538/baeefba7f4,Music
491446,I saw a Floyd laser show there while tripping on acid during my college days. It was amazing until the fire alarm went off. Talk about a buzz kill.,Music
494480,https://blackmalachite.bandcamp.com/track/chill-to-the-marrow-single,Music
501966,Not even X can give it to the IRS,Music
504646,The guitar work in Young Lust is amazing. I love this album ,Music
505850,Recomend skipping the first 10 sec.,Music
506446,Animals is their best album,Music
506944,Red Flag Day omg,Music
507791,It has a great outro riff and theme-wise it ends on a pretty hopefull note which I always thought was uncommon of Pink Floyd albums ,Music
507853,"Hmm not sure anyone said anything about \""owning\"" it. It's been around since the days of Bill Shakespeare. \n\n[Polysyllable rhyming](https://en.wikipedia.org/wiki/Multisyllabic_rhymes)\n\n[feminine rhyming](https://en.wikipedia.org/wiki/Feminine_rhyme)",Music
507867,Atom Heart Mother and Piper are Pink Floyds best albums,Music
513825,All in all we're all... ah never mind. I gotta get back to work. ,Music
515121,[removed],Music
518296,I love when this song comes on my shuffle,Music
522670,It's way too fucking real\n\nI was just starting to get it out of my head and this post just brought it all back and wrecked me again,Music
523708,I\u2019m almost as old as The Wall. Never knew.,Music
524261,[removed],Music
525127,I'm so sorry.,Music
526254,Mother did it need to be so... high?,Music
527211,Thou shalt not worship false Billy Idols,Music
528511,Gregory Alan Isakov and the Colorado Symphony - Master and a Hound..... https://www.youtube.com/watch?v=UHIAQPsiR4g,Music
529295,Nah it's fine,Music
531284,[removed],Music
532088,Dopest video to date. Kinda a mind fuck ,Music
535289,The Museum of Science Planetarium in Seattle also does laser shows of The Wall and Dark Side! I\u2019ve been to both of them and they are quite amazing.,Music
536291,To me this song is important. It says everything.,Music
537531,It really gives a great point of view from both sides,Music
537573,"\""Come to Mama baby! Let me hold you in my arms!\""\n\n",Music
538958,"Agreed! The way the leitmotif of the album comes in with the full ensemble after the first \""there'll be nobody home\"" really hammers in the desperation and loneliness Pink (and the audience for that matter) is feeling.",Music
539289,Best song of the Bon Scott era.,Music
539483,[deleted],Music
541715,My all time favorite album. There's so many little details and callbacks hidden throughout the album that you can listen to it several times over and still find something new every time. Every song is great (although Young Lust gets skipped the most).\n\nAnd seeing Waters do it live was one of the highlights of my life.,Music
543812,Lock him up for 10 years.  He stole from ALL OF US ,Music
544922,https://i.imgur.com/XkT4sRU.png,Music
546626,it's just another dick in the hole...,Music
548786,They stretched it out to give the crew a little more time to place some bricks,Music
549424,That moment when the strings come in halfway through the song sends shivers down my spine. Love that song.,Music
551350,What do Pink Floyd and Princess Diana have in common?  The wall was their last big hit.,Music
551522,Don't. She's not worth it. None of them are.,Music
552274,Him and Chester. Still tear up everytime a song by either is on the radio. ,Music
552429,You don\u2019t have to understand a damn thing about music to admire Stevie Wonder.,Music
553872,Animals is where it's at tho.,Music
554181,Where the hell did that come from? Do ANY of us know the circumstances of a recording 38 years ago?,Music
556858,[deleted],Music
557797,Guess it\u2019s time to update http://isdmxinjail.com,Music
559906,[removed],Music
560601,Greatest album of all time imo,Music
562135,&gt; That's a weird way to spell Brain Damage/Eclipse.\n\nFTFY. \n\n,Music
563289,\u201c\u2018Money get back I\u2019m alright Jack keep your hands off my stack?\u2019  Rubbish!\u201d,Music
563693,Always upvote Ralph Records,Music
564133,[removed],Music
565290,2017 - 1979 = ??? Screw it. We don't need no education. ,Music
567108,That album's old enough for Roy Moore to hit on its youngest daughter.,Music
567598,[deleted],Music
569076,He's already made restitution by releasing a cover of [Rudolph the Rednosed Reindeer](https://www.youtube.com/watch?v=XUYtIpqB7t0).,Music
576990,I've got a little black book with my poems in!,Music
578043,BERNADETTE NERR,Music
579083,Really?,Music
579614,In the flesh? Is still my favorite intro to any album ever. ,Music
580139,so good. so over rated. so over played,Music
582770,Just listened to it yesterday. Its not that good. Just joking. ,Music
583586,THOUGHT YA,Music
584065,Yep. My dubbed cassettes with The Wall were constantly playing in my car throughout high school. ,Music
584505,[deleted],Music
585470,Somewhat tangential question but this is probably a good place to ask - is there a \u201cbest\u201d version to listen to as far as the original and reissues go quality-wise?,Music
586056,Nope. You might be thinking that Dark Side of the Moon by Pink Floyd is the third most,Music
587044,And the other song only on the movie \u201cWhat Shall We Do Now?\u201d was Also amazing.,Music
587546,lmfao!!!,Music
587930,Nutshell by Alice In Chains,Music
588499,Echoes is the greatest piece Floyd has done. The last 10 minutes will never fail to hurt me.,Music
591528,They've fallen off the radar since Kristen May left and Lacey released her solo album. Right now they're just kind of in limbo.,Music
593785,Animals turned 40 earlier this year. Animals is my favourite Pink Floyd record,Music
594591,Sorry you\u2019re right! It\u2019s the best selling album of a band. Even beating out greatest hits albums.,Music
595387,[deleted],Music
596175,Really\n\nhttps://en.wikipedia.org/wiki/Mother_%28Pink_Floyd_song%29,Music
596581,[deleted],Music
600312,[deleted],Music
602112,Love Leo. Love this song. I don\u2019t get the hate itt.,Music
605580,Pigs is super vicious on its own imo ,Music
607978,literally the same songs i was about to recommend ,Music
611440,Love LNA. Wish they would go back to their older sound though.,Music
617643,the music of this song is too good.... it can express the feel of love ... too good,Music
620093,ME TOO!!!! Empty Streets and OBBB are perfect all the way through. Then it's so hit or miss for me. Haunted I can't even find the will to give it another chance ,Music
621197,The Trial and What Shall We Do now? (Not on original album) are my faves! Tingles just thinking about them!,Music
626010,Nobody Home is so overlooked as one of those small yet amazing songs.,Music
626738,Leave them alone,Music
629069,"I always thought it was \""Hey mom! Look at that plane!\""",Music
631797,Never heard of killer mike and el-p smh\n\nI kid. First I listened to the Wall was after I visited the rock n roll hall of fame and was wondering what the whole exhibit was about. I\u2019ll prob give it a play through tomorrow as an homage as well. Will be s great way to spend my day at work.,Music
635198,K.,Music
636318,Only one of 'em aged well.,Music
638228,YEH CANT EAT YEH PUDDIN IF YEH DONT EAT YEH GREENS,Music
643746,Albums don't have birthdays ,Music
644002,Echoes alone makes Meddle an essential Floyd album and I would argue it's also the best reason to check out Live at Pompeii.,Music
644109,Fuck I hate this guys theatrics.,Music
645672,yacht rock ruled,Music
646500,Cool. Happy birthday to the album I have way too many copies of.,Music
646580,How so,Music
646607,Remember how she said that [we will meet again](https://www.youtube.com/watch?v=cHcunREYzNY)?,Music
648242,Song always puts me in my feels.,Music
648603,[deleted],Music
649359,I think that's just a really long mushroom trip,Music
650888,I\u2019ll take one off you,Music
652470,I wish kids my age could appreciate real music\ufeff,Music
654348,Awesome choice :),Music
664342,This was such a taboo topic for a song especially from a rap group. ,Music
665272,This is an album I have a relationship with.  Not many I can say that about.  One of the absolute best things on planet Earth.,Music
669498,A Day In The Life is such a spectacular end to Sgt Pepper's Lonely Hearts Club Band.\n\nOne of the most brilliant things the Beatles did. ,Music
670372,Quit making me feel bad,Music
674364,He doesn't like Trump so he must hate capitalism,Music
675535,pop evolved way more from 79 to 88 than 08 to now,Music
676951,You can hear the Prince-esque sound in a lot of their stuff. The Minneapolis funk sound. ,Music
683900,Drive by Incubus,Music
684516,[removed],Music
686486,Prom Night by Chance the Rapper. Listened to that song a lot in preparation for my senior prom. Got dumped by my girlfriend a week before and didn\u2019t go. That\u2019s the one song I honestly can\u2019t listen to or else I\u2019ll tear up ,Music
689653,Beautiful song. One of my favs by him. ,Music
693909,Definitely worth checking out a live performance. These guys know what they\u2019re doing ,Music
696466,I'm also pretentious,Music
696988,bad and fake,Music
697073,[deleted],Music
698296,http://study.com/academy/lesson/what-is-regrouping-in-math-definition-subtraction-addition.html,Music
698342,You\u2019ve got to be crazy ,Music
698449,In The Flesh? is still the best opening track to an album I've ever heard.,Music
700697,The end of St. Anger... it's good because the album is finally fucking over,Music
700758,Anthony Fantano says it's good but he was talking about Dark Side of the Moon,Music
701173,Great great grandmother probably didn't flow right lol.,Music
703674,You Americans are obsessed with the birthdays of things. Calm down.,Music
705043,Mike Oldfield's *Amarok* has a set of endings building up on top of each other in a very satisfying way.\n\nGenerally a number of his albums/tracks end with a loud orgasmic bang. :),Music
709033,Ooohhh aaaahhh Mother should I build the wall?,Music
709168,Just another kick in the balls.,Music
712388,Be Lakor's The smoke of many fires. Blew my mind the first time I heard it and it still is one of my favorite songs by these guys. It's the story of how a guy and his community get picked up by slavers and their village gets sacked. Heavy subject matter but it really paints a vivid image in my mind. It's long but I can't recommend it enough.\n\nhttps://youtu.be/ARI0XyTiips\n,Music
715458,The Tourist - OK Computer \n\nDING ,Music
717108,There's no need for the jury to retire!,Music
718521,Saw them live when the first CD released. It's all dark and quiet as she's singing the intro....then BRREEEEAAAAAAAKKK!!! and lights cut on and she's leaping off the drumstand screaming mid-air straight War Boy style (witness her). One of the most epic live moments I've witnessed.,Music
724994,So...so good.,Music
727494,Veraaaa....Veraaaa....what has become of you? (Swelling strings) ,Music
730643,Gorillaz - Don't Get Lost in Heaven/Demon Days,Music
731956,[deleted],Music
738477,THIS IS JUST A PASSING PHASE\nONE OF MY BAD DAYS!,Music
743931,For sure,Music
745389,I love that song so much,Music
745952,This is also the song that plays when we learn who is Inspector 5 and who gave Bender a chance at life ,Music
746193,Whaaaaat! ,Music
746404,LAAAAAANA! ,Music
746948,I can't believe this is real ,Music
747658,I loved that song as kid not fully aware of what it was about. I was a strange kid ,Music
748075,HOW CAN YOU EAT YOUR PUDDING IF YOU DONT HAVE ANY MEAT?!?!?! ,Music
750108,[removed],Music
750144,Sheep is mine. The guitar riff in the last 2 minutes of the song give me chills every time.,Music
750639,Its better than just a comment of a line in a song,Music
752015,Top ten greatest lyricist of all time,Music
761045,That's okay.,Music
761570,The guitar and vocals morphing into animal sounds! That shit blew my brain into to tiny pieces! Harmlessly passing your time in the grassland away,Music
763940,Perfect,Music
765185,[removed],Music
767620,I'll see you in the dark side of the Moon\n\nWoah ah oh oh oh waaaaaaaah!!,Music
770104,[Here is a YouTube playlist of the album](https://www.youtube.com/playlist?list=PLAOUtW_bke2bahD1EWGDlBkW9dRkOW1wf),Music
772876,Does anybody here remember Vera Lin ,Music
773401,Thin ice is my fave ,Music
777564,[Holy shit you're not kidding](https://www.youtube.com/watch?v=Ae3PyMWK8QA),Music
781008,"\""Fucking death lasers...\""",Music
787996,And as testament to time the lyrics should be changed to 'students leave those teachers alone''. \nTeacher here :) assaulted 4 times this year. Seems channels encouraging kids to be independent and revolt against the system offer little in the way of constructive alternatives we could all work towards together. ,Music
795864,Didn't he just get released from prison? This fucking guy is something else. His rap is timeless though and the soundtrack to every 2004 high school party. ,Music
796021,Tool - [Wings for Marie Pts 1 and 2](https://youtu.be/pltgaBtcPHg)\n\n,Music
796356,di di di did you hear the frightened ones?,Music
796696,Tool - Third Eye,Music
799999,[removed],Music
800126,[deleted],Music
800971,\ngonna get me a pair of those shades !\ufeff ,Music
801078,Surprise! Surprise!! Surprise!!,Music
801604,King of the compound bend,Music
803851,How to Disappear Completely by Radiohead off of Kid A ,Music
813194,Thanks OP thanks made me tear up a bit. Such an  amazing song and an even more amazing artist! You will be missed \ud83d\ude22 RIP Chris Cornell  ,Music
