,body,subreddit
813851,This is one of my favorites.  Such a powerful message for such a short song.,Music
814425,It had to happen one of these days.,Music
819180,I got chills just remembering it !,Music
820842,I laughed too hard at this ,Music
824432,Overrated Album,Music
824562,Im confused... the genesis song?,Music
826717,Not if you\u2019re Uncle Sam,Music
828631,Animals is fantastic!\n,Music
829073,The whole album!,Music
830047,Ugh nobody home. Should be mentioned higher up in the thread,Music
831915,[removed],Music
833360,I make it a point to sit down and listen to this album at least once a year. I wonder if anyone thought it would still be relevant nearly 40 years later.\n\n,Music
833491,I tried looking it up? I'm not familiar and am only finding the track? Help,Music
836678,I saw Roger Waters do the album in full in Columbus a few years ago.  Solid show but I had nosebleed seats and they were still expensive.,Music
838158,[deleted],Music
838250,Your right bro like a greastest hits but you get my drift lol,Music
839323,Wu tang,Music
840341,No love for Piper at the Gates of Dawn?  ,Music
841834,The End by The Doors on their self titled album. Such an amazing song. ,Music
844615,Life changer! ,Music
844921,I think it shows how strong that album is that that\u2019s my least favourite song on there. ,Music
847896,Damn right man. He's always been the coolest of cats.,Music
852332,How bout crossfade? ,Music
858251,[deleted],Music
859724,or street skating is illegal LOL or at least in alot of downtowns \nSource : street skater ,Music
863354,Can someone please mix the last few seconds of outside the wall and the OTW part of In the Flesh? so it lines up as continuous,Music
863657,Anyone know thw reason behind his suicide?,Music
863993,Is it the exact amount of stones?,Music
865142,Damn straight.,Music
868304,Poor sad talented SOB.  Why Chris?,Music
869019,"the slow fade-out meditation of \""Cop Shoot Cop\"". the last track on Spiritualized's 'Ladies and Gentleman We are Floating in Space'.",Music
876485,Screamo ,Music
877635,And I thought we were talking about the wall from GoT,Music
880676,Screamo ,Music
881853,Lacey regularly blew out her vocal chords from the screaming.  They had to cancel a tour because of it.,Music
881930,Man I would've paid pink floyd to let me sing backup on the wall...... ,Music
882753,Yes.  It was called Screamo back in the day.  Don\u2019t know why you\u2019re getting downvoted.,Music
885654,Right.  She always rhetorically asked if you\u2019d call a plumber who was a Christian a \u201cChristian Plumber.\u201d,Music
886070,Just wanted to let you know I bought a copy...thanks for turning me onto it!,Music
889420,Yeah that was kinda nice.,Music
893856,Still no time machine to stop this obnoxious song.,Music
895163,My favorite album of all time. My favorite song of all time linked. I think I love you. ,Music
896021,so were they payed in pudding or meat?,Music
901010,Hell no,Music
904270,When The Levee Breaks is the greatest closer of any album,Music
914698,Kept it to one per artist.\n\n1. Kanye - Dark Fantasy\n\n2. Wu-Tang - 36 Chambers\n\n3. Kendrick - Good Kid Maad City\n\n4. Jay-Z - Blueprint\n\n5. GZA - Liquid Swords\n\n6. Dr. Dre - Chronic\n\n7. Outkast - Aquemini\n\n8.  Roots - Game Theory\n\n9. Nas - Illmatic\n\n10. Notorious B.I.G. - Life After Death,Music
916957,Electric Ladyland -Jimi Hendrix\n\nTrack 3 is Voodoo Chile.  It's 15min of slow blues.\n\nThe closing track Voodoo Child (Slight Return).  Its similar lyrically but is way more up tempo.,Music
917745,Perfect time to make this known to anyone who hasn't already heard it:\nhttps://www.youtube.com/watch?v=-9toFP9jdqI\n(Doom Side of the Moon - Money)\n\nhttps://www.youtube.com/watch?v=sMoO8FNbRJA\n(Doom Side of the Moon - Full Album)\n\nEnjoy.,Music
925881,Aaw sweet! I hope your relationship is still going well.,Music
930702,I needed something to get finish off no nut november,Music
932404,One of the best jams ever. ,Music
933326,Thank goodness Steve Tucker is back for the new album!\ufeff,Music
941021,[deleted],Music
943272,[deleted],Music
943649,[deleted],Music
945943,Street Spirit and Road trippin are both pretty neat.\n\nLeviathans Jospeph Merrick is also good.,Music
946801,Getting high and listenening to the Wall about sums up my youth..,Music
947890,Dope list bro I like how you kept it to one album per person. My favorite pick off of your list has to be Nas Illmatic that album was sick. He was so ahead of his time then.,Music
953918,[The Inner Light](https://www.google.co.jp/url?sa=t&amp;source=web&amp;rct=j&amp;url=https://m.youtube.com/watch%3Fv%3DLHo2ZJ2vzM0&amp;ved=0ahUKEwism9yaxejXAhULJ5QKHUKLCNYQ3ywIMzAB&amp;usg=AOvVaw1QBbbemmPHgAxdPFY63afg),Music
958541,Ministry - Jesus Built my Hotrod,Music
960700,Cotton eyed joe.  Rednex,Music
961665,That's too hard of a question. It's highly likely they wouldn't appreciate any kind of music if they had never experienced any. ,Music
962028,hey do you know this song https://clyp.it/1kctmrqm?\n,Music
963369,And people were still living in fear of nuclear destruction due to the cold war.,Music
963486,[Relevant scene from the film.](https://youtu.be/E_5DRKZI1Ow)\n\nRoger Waters' father was killed in the war.,Music
964067,i need to know what song is this https://clyp.it/1kctmrqm\n,Music
966578,[deleted],Music
969725,[deleted],Music
970319,One of the greatest rock albums of all time,Music
970766,[removed],Music
971416,Thanks for your advice!,Music
973085,Fun fact: that\u2019s Waters\u2019 son ,Music
973384,^^^Dangaa ^^^Zooone,Music
975000,Jamie Starr wrote Jungle Love.\nJamie Starr was better known as Prince.,Music
975375,Add Chris De Burgh - Spanish Train. \n https://open.spotify.com/track/2cDfenT4K8hX8WUvXgrwDE\n,Music
976835,Hey man! not sure if you got a chance to read this but I would love to hear from you.,Music
978385,Man I can only dream of seeing them live!!! Amazing. Its weird to see that other people feel the same way ,Music
978946,know this one? https://clyp.it/1kctmrqm\n,Music
982975,Genre?,Music
985700,idk the homophobia is pretty dated,Music
988072,Man. That is such a solid album. I think I know what I'm listening to tonight before bed.,Music
989460,Only in the USA does wanting the government to have less power make you 'right' leaning..,Music
990566,So like Gojira?,Music
992523,I wonder if this means they'll release a 38th box set. Its about time we had another box set with all the same songs from the last box set in a different order.,Music
993299,I think that\u2019s exactly what they were going for.,Music
993578,"\""WHO WAS BORN IN A HOUSE FULL OF PAIN\""",Music
994293,Awesome i've really connected with this album and also the movie just recently. Might even watch it tonight. ,Music
994661,This album and the movie have meant a lot to me for several years now. I've struggled with depression and other mental health issues since my early teens and for some reason The Wall has always helped me stabilize whenever I'm feeling extremely down. If I'm having a bad day I just put it on and it helps me not feel as hopeless. I actually got a tattoo of the flowers from the beginning of the Empty Spaces segment in honor of how much it has helped me over the years.\n\n Before I decided that I didn't want kids I always liked the idea of naming a girl Vera after the song. ,Music
995169,Hush now baby baby don\u2019t you cry!,Music
995690,I've never heard of them but if there anything like the Architects then yes :) ,Music
1003738,Get shwifty ,Music
1011058,Add the book of flavor flave to the Bible,Music
1012081,Bad bot,Music
1017858,About Face did have some cringey materail...But god damn it was it a lot of fun. His latest two albums were both phenomenal.,Music
1024213,/r/toosoon\n,Music
1025986,'Pink Floyd\u2019s \u201cThe Wall\u201d turns 38 years young today'\n\n/Fixed,Music
1029817,No it\u2019s r/shitpost ,Music
1029953,It's environmentalist death/progressive metal,Music
1034555,The way he plays the same note for the first ten seconds of the solo... but it still sounds perfect,Music
1035538,"I wonder if anyone has counted how many times the word \""stone\"" repeats in that song. ",Music
1042720,I know what it\u2019s like to be dead ,Music
1044607,Oh and don\u2019t forget to check up on your boy [www.isdmxinjail.com],Music
1044841,Agreed,Music
1046771,He actually owns the rights to name of the band. He was bet controlling about what they performed and who was in the band etc. I\u2019m not sure the whole extent of it all but I know Morris ended up forming a new band over it. ,Music
1046968,[removed],Music
1047848,My close friend is a jazz musician and I've played some improvisational music before as well... oddly enough the best advice is that improv is something that needs to be constantly practiced in order to get good at it.,Music
1048191,You behind the bin sheds!,Music
1054386,Remember grits?,Music
1058603,It's the best isn't it? Lol,Music
1058616,Every single ACDC song sounds the same.,Music
1063689,Mine is Is There Anybody Out There?,Music
1072867,Knights Of Cydonia on BHAR (Muse). Raining Blood on Reign In Blood (Slayer).,Music
1081127,What is that snippet at the end?? I didnt know what the quote was until just now. Does it connect to the beginning?,Music
1082232,https://open.spotify.com/track/7FQecpVzqWSiqISQS3GAyQ?si=etlYAKvvSI-PS3-NASrqxQ,Music
1082771,https://open.spotify.com/track/2GD4cJ6VXW6G8CETuc4tnv?si=ZguKxZmkT9OnvDMyUZzBuQ,Music
1084019,Still my favorite album of all time,Music
1085197,Hauntingly beautiful song ,Music
1086183,X gonna hide it from ya.,Music
1097511,So looking forward to this! Pre-ordered! Cannot wait to blast this beast!\ufeff,Music
1099824,why did you do TDIL? today is just one word.,Music
1103193,Started singing Hey You in my head after I read the first half of your post and pretty much ended up teary eyed upon finishing your post. \n\nInsanely moving song,Music
1104134,SO YA \nTHOUGHTCHYA \nMIGHT LIKE TO\nGO TO THE SHOW,Music
1107323,WHAT?!,Music
1112025,Avenged sevenfold\u2019s album Waking the Fallen has my personal favorite ending.,Music
1114974,I'm old as shit. I was 29 when it came out and we went to the live performance at Earls Court in London. Amazing show.,Music
1115511,Many people around the world enjoyed the Album without seen the video part.,Music
1115933,This is what real music sounds like,Music
1116050,am i the only one who was scarred by the film adaptation of The Wall?? i\u2019ve never really talked about it except to close friends but the movie completely freaked me out when a child and my older brother was obsessed with it. something about nazis and a woman being assaulted and a wall that was eating people??? terrifying. i\u2019ve still never been able to watch it as an adult because the thought repulses me.,Music
1122073,And he plays in the band now,Music
1129460,Nooooooooo\n\nCome to mama baby,Music
1138193,WHAT?! *runs off to listen*,Music
1138987,Oooops. Apparently one glass of red wine erases all of my mathematical ability.,Music
1145800,I spent a good hour looking at that subreddit...Lifted my mood a good deal. Thanks for what you do!,Music
1148475,This day I learned?,Music
1150129,That isn't used as an acronym ,Music
1150696,2002ish?,Music
1152308,Daddy what else did you leave for me? ,Music
1159872,https://www.youtube.com/watch?v=W0thQXcwB8E&amp;feature=youtu.be,Music
1160213,https://www.youtube.com/watch?v=W0thQXcwB8E&amp;feature=youtu.be,Music
1162223,5 hours by Deorro,Music
1173462,Not as old as I would have thought,Music
1173465,Best part is they put that in The Wall too,Music
1177609,Nobody Home is definitely my favorite on here. The way Waters can adapt his vocals to the feeling of a song always amazes me.,Music
1178441,Dude. Relax. Was guessing at his usage. Geez. ,Music
1179038,The Rock n Roll singer cover is heartbreaking. ,Music
1179460,A bunch of kids who were probably elated just to be a part of it and who put in probably an hour of work on a massive production aren\u2019t exactly suffering artists.,Music
1184934,Read that in his voice exactly as he sings it without even thinking about it. Fantastic album. ,Music
1186217,This song came up on Pandora for me. It's been on my liked playlist for 4 years.,Music
1186842,They have dvds available of the live show as well as a netflix documentary of it. ,Music
1194895,My Conscience Weights a Ton is so damn catchy. Love the bassline.,Music
1200012,We don't need no education... ,Music
1203062,hahaha ,Music
1208265,You have your own desert?,Music
1209335,They paid the school but not the kids,Music
1211346,[deleted],Music
1212201,If you truly immerse yourself in Floyd you\u2019ll feel like you\u2019re high without having to get stoned ,Music
1212984,For real dude. Same!,Music
1216767,Drunken nostalgic love.,Music
1220229,I am not a huge electronic music fan but Animus Vox by The Glitch Mob is amazing.,Music
1235044,The most interesting thing about this fact is that Michael Jackson\u2019s Thriller was released three years later. \n\nI had no idea The Wall was only three year\u2019s older. ,Music
1243066,David Bowie - Rock and Roll Suicide\n\nPolvo - When Will You Die for the Last Time in My Dreams,Music
1251096,/r/music upvotes songs based on recognition alone.,Music
1259016,And you\u2019re making me feel like...\n,Music
1260773,I want some specs on those laser projectors.,Music
1264732,"I guess we can rule out \""I'll be home for Christmas\"" as his next single.",Music
1269012,[deleted],Music
1271657,I didn\u2019t see it Zooropa on my phone. ,Music
1283234,hey whys you delete those songs was gonna listen to it now ,Music
1288868,[The Darkness?](https://youtu.be/VQhuoY5h2kE). ,Music
1291039,Bailey &gt; Jennifer \nMary Ann &gt; Ginger\n,Music
1293117,Bibleland 6 is my favorite. \n\nI'm so fucking happy they're back. ,Music
1296164,"\""(D  - M  - X !!!) Well if you want it I got it come and get it oh wait I hid it nevermind don't come and get it babayyyy!\""\nI'll get my coat...",Music
1297115,I've got some flame let's chill Sunday,Music
1298604,"Yep. Very end of the album: \""Isn't this where...\"" and then at the very beginning: \""...we came in?\""",Music
1299587,Has anything been released about *when* today it's supposed to go live?,Music
1301610,Something about how the mic is setup here makes it sound like he's singing in an empty hall. Almost makes his voice sound peacefully haunting.,Music
1310004,Space-Dye Vest. \n\nLast song of the album Awake by Dream Theater. An amazing song that concludes a superb album. ,Music
1310440,Mariah Carey: all I want for Christmas is you.,Music
1322512,It's as old as ME!,Music
1323323,Be Here Now by Oasis. ,Music
1324953,38 yr old brothers !!!!  I'm the same gae.  great story bro,Music
1335123,Thirty eight years ago who would have thought The Wall could be a suitable backdrop to the Trump Administration. ,Music
1342458,Ok,Music
1344025,i dug a little bit and couldnt find a better answer than this.  sort of weird that its been since 1994.,Music
1350443,I hated this ending the first time I heard it but over the years its definitely grown on me ,Music
1353610,i hate this so much.,Music
1358072,Sheep is *so* good as well. That is no doubt one of the best albums of all time. It\u2019s so immaculately made. Every track is an absolute jam,Music
1362024,Pink Floyd,Music
1365006,The ending to The Stage is pretty damn good too.,Music
1369301,Your username reminded me that there's a recording i used to have of one of Claypool's side project (the frog brigade) covering Animals from beginning to end. Looked for it on spotify but no luck. Maybe there's something on youtube though. ,Music
1370297,You can fuck with the government or literally anyone except the IRS.,Music
1370372,Lock yourself up for 10 more years. ,Music
1370476,[deleted],Music
1370529,Bob and Doug McKenzie,Music
1373037,Firestarter,Music
1373080,The Diablo Swing Orchestra. They're pretty cool.,Music
1373207,Have you heard the with Rage did with the Lingua Mortis orchestra? \n\nThe first 6 tracks of the 2006 album 'Speak of the Dead' were recorded with Lingua Mortis and they performed together again on an hour long set at Wacken in 2013. \n\nThe live recording is [here](https://youtu.be/U-E3xxCE4kk?t=44) and the album exists as a number of uploaded copies on Youtube.,Music
1373626,Pond - Man it Feels Like Space Again,Music
1373890,Great fucking musician though!,Music
1374181,Thanks for the input,Music
1374453,Yaay they play a show on dezember 15th and i cant wait to see them live! Never thought they would come to austria. I am a fan since my teens so i am really looking forward to the party! ,Music
1375581,"also check out \""All Mixed Up\"" (cover of the Cars by RHP)",Music
1380182,"Dark Side of the Moon -- \""...but the sun is eclipsed by the mooooon\""",Music
1385904,More a band that is an orchestra than an album with an orchestra but they're still pretty great. Loved Exit Strategy of a Wrecking Ball &amp; A Tap Dancer's Dilemma.,Music
1391243,"They just released a new album over the summer without Deron Miller. It sounds way different than their old stuff and in my opinion is a giant pile of shit. Deron has a new band \""96 Bitter Beings\"" that sounds a lot more like CKY.",Music
1393985,classic for sure,Music
1398924,I got a little black book with me poems in it,Music
1399693,WHERE ARE ALL THE GOOD TIMES? WHO'S GONNA SHOW THIS STRANGER AROUND?,Music
1402375,His \u201cRudolph the Red Nosed Reindeer\u201d wasnt good enough,Music
1403547,it\u2019s fine. not really anything terrible or fantastic. I did think the Kendrick feature was well done.,Music
1404481,I'm only assuming this studio Rudolph version was to help pay the gov't back so he can serve less time? Not sure exactly how tax law and sentencing works.,Music
1414716,I have used [Blind Guardian - Bright Eyes](https://www.youtube.com/watch?v=pP6qMKW8jHo) as personal theme music for a job before.\n\nI guess I'd go with that or the Sanford &amp; Son theme song.\n,Music
1415764,The evidence before the court is incontrovertible; there's no need for the jury to retire.,Music
1415839,Nice!,Music
1418105,I don't advise watching it on mushrooms tho lol,Music
1420511,He stole from ALL us honest tax payers,Music
1421698,One of the best bands of all time!,Music
1425060,Yaaa I've heard it.  Very solid cover,Music
1432947,But what will people do when they find out it's true?,Music
1436333,So your solution is to waste more of our tax dollars on locking him up?  ,Music
1438434,Username definitely checks out!,Music
1441839,*Show ,Music
1442119,"Many memories from the Movie. Took mushrooms and watched the Wall - both firsts for me. Shrooms kicked in during \""Goodbye Blue Sky\"" - right as the bird explodes. Had to turn it off 30 minutes later. Sat outside. Watched a tree for the next hour. Good Times!",Music
1446302,I have always enjoyed the cover of [Last Christmas](https://www.youtube.com/watch?v=naiYu9KtA4I) by James Dean Bradfield of the Manic Street Preachers,Music
1446554,Thank you so much!,Music
1447280,Let me hold you in my arms.,Music
1458263,Ah Yeah! Sweet!,Music
1463168,Bad Religion put out a Christmas cover album and it's great,Music
1465541,THE ROAD SO FAR,Music
1467269,[deleted],Music
1468048,Funny how I was listening to it on the radio as I came across this post...,Music
1470304,[Aphex Twin - Windowlicker](https://www.youtube.com/watch?v=UBS4Gi1y_nc)\n\nEdit - skip to about 4 minutes to miss all the intro bullshit. ,Music
1470569,The IRS shut em' down and opened up shop on his ass.,Music
1473276,I'll definitely give it a listen because hollowhead has pretty much made it into my playlist.Good luck for your shows man! ,Music
1476601,Yes! Thanks! OMg! Loved It!   ,Music
1477395,https://www.youtube.com/watch?v=cckwla7NqmY&amp;feature=youtu.be,Music
1477432,[deleted],Music
1481399,v different- i vibe w it.\n\nu might want to put it in r/makinghiphop and r/hiphopheads for feedback ,Music
1481959,Rock and Roll for Christmas! Thanks! ,Music
1485702,Radiohead album The King of Limbs sparingly utilizes the London Philharmonic to create some great moments,Music
1486577,FILLS ME WITH THE URGE...,Music
1487631,Same .. I know exactly the feel of the couch I was laying on the day this was released.\nFirst time listening to the Wall was like watching the moon landing on TV. unforgettable.\n,Music
1488337,He says while his newest album is straight garbage.\n\nNice.,Music
1490171,I basically listened to this on repeat in high school. I loved this song and the girl it made me think of.,Music
1492800,Sounds best on a pono... /s,Music
1496055,LOVE TMV! I was kinda surprised to see that your favorite was from Omar. Dude is just incredible. ,Music
1496432,Eldorado by ELO is a pretty old album but uses the Orchestra theme well...actually most of their albums do.,Music
1497401,"No way It's just a sleeping Giant and \""Rock will Never Die  I Won't Let!\""  ",Music
1505042,I like how he appears in two songs,Music
1510786,Cage the elephant recently did Unpeeled. It's very good. ,Music
1511945,thank you so much! Would love to know which you like more!,Music
1516513,[deleted],Music
1516788,Such a great album one of my all time favorites ,Music
1519831,No,Music
1521245,No what?,Music
1522264,They do absolutely nothing new,Music
1523410,Ouch lol. Neil really got screwed by debuting that right as streaming was taking over. ,Music
1523810,I think that\u2019s a solid album. \u2018Cirrus Minor\u2019 and \u2018The Nile Song\u2019 stand out. You can also hear hints of later Floyd on this album.,Music
1524031,Deep Purple did one in 1969.  https://www.allmusic.com/album/concerto-for-group-and-orchestra-mw0000454192,Music
1526592,also empty spaces ,Music
1528127,Fuck Wait for them to find it on their own.,Music
1532992,IMO the first song is the worst Song they\u2019ve made. Like seriously worse than some of the stuff on POP. However the rest of the album is either great or growing on me. Especially summer of love. The edge and Adam Clayton are on fire this album. Bonos lyrics and voice are both a bit inconsistent in my opinion ,Music
1533801,The day it came out the local radio station said they would play the whole album without interruption. I was a stock boy at a grocery store and as soon as we got off work it started so imagine 5 guys crammed in a car passing around 3 joints and listening to it for the first time full volume...epic stoner moment!,Music
1535319,ITT: Archer comments ,Music
1539000,[Lykke Li] (https://www.youtube.com/watch?v=jGP3VSNlwzg)\n\nor \n\n[Ane Brun] (https://www.youtube.com/watch?v=8s5ihWIywzg),Music
1539849,Who gives a shit lol bring them downvotes\n,Music
1539916,Came here for the Archer jokes. :),Music
1545900,He\u2019ll go down in history COME ON COME ON\nHe\u2019ll go down in history YEAH YEAH ,Music
1552422,[deleted],Music
1553215,New day in the morning by Roger Whitaker should do the trick!,Music
1560961,I think so. We based the list on a review of artists submitted the most before we finalized it. ,Music
1561209,"I think we gave it the old \""reddit hug o' death\"" the page shows up and nothing is clickable for me. ",Music
1562469,Jamie Starr's a thief. ,Music
1564333,Morris Day and the motha fuckin Time!,Music
1569648,You gotta be crazy.,Music
1573283,[removed],Music
1579044,Session workers don't really get royalties.,Music
1580066,This is the third thread this week I've seen reference it. It's so heart warming.,Music
1581255,I remember my brother getting the soundtrack to the movie as a bootleg. Very different versions of Mother and an extended version of Happiest days... also includes when the Tiger Broke Free. Geldof even does the vocals of a bunch of the songs. \nNever noticed how the album and movie differed. ,Music
1583775,I AM JUST A NEW BOY!!!,Music
1589710,10 children!!!,Music
1592281,Bohemian Rhapsody,Music
1593449,TIL that DMX has 10 children.,Music
1593477,I guess Trump took it a little literally.,Music
1596253,What!,Music
1596926,x gonna conceal it from ya,Music
1597865,DUN DUN!!!!,Music
1598620,It's a bit all over the place.\n\n\nIt's a really odd start to the album.\n\n\nWould have loved for The Blackout to be track one. ,Music
1599619,Y'all gon make me lose my house.\nUp in here? Up in here!,Music
1604655,Aphex Twin - [Rhubarb](https://www.youtube.com/watch?v=_AWIqXzvX-U) or [Aisatsana](https://www.youtube.com/watch?v=3_MRe3JwFc8). Their simple and really gentle sound gets me every time.,Music
1605030,Same here,Music
1606188,Postmodern Jukebox has several classics.\n\nChannel: https://www.youtube.com/channel/UCORIeT1hk6tYBuntEXsguLg\n\n,Music
1608399,yeah it\u2019s a super smooth transition.,Music
1611824,"The Contortionist's new record \""Clairvoyant\"" has an incredibly emotional climax on the final track.  The album is about the singer's friend losing his mother and slowly killing himself through addiction and depression.  ",Music
1613194,Fun fact: Roger Waters plays the acoustic guitar in that song.,Music
1613889,Has he talked about any plans to release any archived stuff to spotify? Love Neil Young and it would be awesome if it was on Spotify ,Music
1615424,Neil has such an heart of gold !\n\nEdit: Spelling,Music
1618076,Finally someone said it! The Trial is my favourite track on the entire record. ,Music
1618990,"\""Where are you Christmas?\"" From the Grinch with Jim Carrey?",Music
1621183,And he's going back to jail ,Music
1622894,DMX actin\u2019 a fool ,Music
1628556,Link to the thread?,Music
1634745,Try Last Shadow Puppets,Music
1637871,[removed],Music
1638276,Samuel barber's adagio for strings.\n\nThe planet's\n\nClassical gas .,Music
1640275,Planning any tours?,Music
1640479,And I turn 23 ,Music
1650684,"Find out on next weeks episode of \""What in the world is DMX up to?\""",Music
1654156,Was not disappointed. ,Music
1655186,That's [Vera Lynn](https://www.youtube.com/watch?v=cHcunREYzNY) singing just before the opening MC. ,Music
1656109,https://www.youtube.com/watch?v=J4iWC0BKCmk,Music
