,body,subreddit
1659164,Covers are pretty cool. I like how artists can change the original song and put their own spin on it. Here\u2019s some of my favorites:\n\nJohnny Cash - [Hurt](https://youtu.be/vt1Pwfnh5pc)\n\nTool - [No Quarter](https://youtu.be/_ZKIfCJZvZo)\n\nLeviathan - [Nothing Changes](https://youtu.be/3cAUsPqFmqE)\n\nMot\u00f6rhead - [Enter Sandman](https://youtu.be/hF9Gr5waAJg)\n\nOpeth - [Circle of the Tyrants](https://youtu.be/iCSFrP8P6QE),Music
1659922,i came here to say mariah carey too but for me personally its \u201cchristmas wrapping\u201d by the waitresses.,Music
1660585,X gon admit it to ya,Music
1662285,[deleted],Music
1663327,You think Lemon is better than Love is All We Have Left?,Music
1663403,Duct tape.,Music
1664527,[New episode of U Talkin U2 To Me](http://www.earwolf.com/show/u-talkin-u2-to-me/),Music
1668195,"And the judge asked in court \""Do you think this is a game?\"" ",Music
1668634,r/punchablefaces,Music
1669670,"... and before that it was probably Paul McCartney's \""Wonderful Christmastime\""",Music
1671478,X gon' give it to....  the IRS,Music
1672787,Loving it so far keep up the good work! Followed you guys on Spotify!,Music
1672915,Do I See Color- Adventure Club,Music
1674152,[deleted],Music
1677325,If you ever come to Canada PM me. I can help you west coast. You guys sound awesome. ,Music
1685617,On every morning coffee playlist. But for awhile there i would go to coffee shops and this would be playing.,Music
1685660,My pleasure!\n\nMakes me feel good &lt;3,Music
1687498,Did you enjoy his acting debut? :),Music
1688391,How are you in life now?\n\nMet the girl of your dreams?,Music
1688531,Wow that\u2019d be so dope- thank you! I will also keep that in mind. \nDo you like PUP? My favorite Canadian band right now. \n\nThanks a lot for your kind words!,Music
1689133,Great song! It\u2019s always nice to see under appreciated bands getting love.,Music
1689283,Well lets make it another year ;),Music
1689375,The mother fucking time!,Music
1689391,Yess! I\u2019m so happy. Do you have a favorite song? Really appreciate it. ,Music
1689993,What genre were they?,Music
1690552,Exactly how I felt! I am glad you liked it :),Music
1692422,I finished his autobiography a few months ago. He spent like a quarter of the book talking about that and his huge expectations for it. Poor guy...,Music
1693250,Fiiiiive goooooldeeen... toques? ,Music
1694088,NPR interview with the duo:\n\nhttps://www.npr.org/sections/allsongs/2017/12/01/567256661/glassjaw-guides-us-through-the-apocalyptic-material-control,Music
1694856,Heavy metal/alternative hard rock,Music
1698933,There has to be a penalty or everyone would stop paying taxes,Music
1700355,Single and happy. ,Music
1702248,"Don't know why you're being downvoted. I enjoy DMX but I'm not about to pick \""Up In Here\"" at karaoke anytime soon.",Music
1702411,I did! I know he was on parenthood but am\nSurprised he never really \u201chit it big\u201d,Music
1705198,Knock knock open up the door it\u2019s the \n\n##IRS,Music
1706609,Any specific songs or just check out the whole thing?,Music
1708314,RemindMe!\n\n[Click here to PM /u/RemindMeBot for a reminder in 1 day](https://np.reddit.com/message/compose/?to=RemindMeBot&amp;subject=Reminder&amp;message=%5Bhttps://www.reddit.com/r/Music/comments/7gv1ti/neil_young_archives_goes_live_today/%5D%0A%0ARemindMe!),Music
1711832,Hallowhead I'd have to say is my favorite so far ,Music
1716687,Being used in memes just means you're a joke. ,Music
1717011,KNOCK KNOCK! OPEN UP THE DOOR! IT\u2019S FRAUD!,Music
1717538,Agreed. ,Music
1718072,You could maybe say that tonight's the night,Music
1721517,I hope this one by [Big Big Train](https://www.youtube.com/watch?v=DINVlwX9aZM) can gain traction!  Merry Christmas,Music
1721760,Coheed and Cambria?,Music
1722380,When did they change that last line?,Music
1726194,http://www.thepeterboroughexaminer.com/2017/11/30/neil-young-concert-to-close-highway-7-in-omemee\n\nApparently it will be streamed on ctv.ca and on Facebook,Music
1729092,Neil Young - Cortez The Killer: is my favorite N.Young song\n\nhttps://www.youtube.com/watch?v=c93-UdPz1BI,Music
1730424,He remembered!,Music
1731978,[Home Free - Hillbilly Bone](https://www.youtube.com/watch?v=y_7_RTogRBw) acapella cover (and other covers by the same band)\n\n[Boppin' B - Sternenhimmel](https://www.youtube.com/watch?v=AUizYDLjb-Y) (origina: [Huber Kah](https://www.youtube.com/watch?v=4Y2oVvj3clI))\n\n[Boppin' B - Boulevard of Broken Dreams](https://www.youtube.com/watch?v=u3p9828GLLc) (original by Green Day)\n\n[Brian Setzer Orchestra - Americano](https://www.youtube.com/watch?v=AVXj0n0xNv4) (original by [Renato Carosone](https://www.youtube.com/watch?v=BqlJwMFtMCs))\n\n,Music
1732188,I really like these two instrumental covers played on non-traditional instruments:\n\n[Adele - Rolling in the Deep played on a guzheng](https://www.youtube.com/watch?v=qDjeY72KaSo)\n\n[Miley Cyrus - Wrecking Ball played on a chapman stick](https://www.youtube.com/watch?v=ILpx6OmBh-I),Music
1733738,YES! thank you guys.. I appreciate it so much ,Music
1739957,Reel Big Fish - Take On Me (A-ha)\n,Music
1744670,There's a [shot-for-shot Archer video recreation and it's glorious](https://www.youtube.com/watch?v=kyAn3fSs8_A),Music
1744790,At least lemon doesn\u2019t use auto tune. \nHell get on your sexy boots was better ,Music
1748747,"cause people like being hipsters and bringing attention to \""underrated\"" albums they like better. even tho Animals is an extremely popular album and one of the most critically acclaimed prog rock albums of all time lol",Music
1752769,6th-grade me is thriving. ,Music
1752781,[deleted],Music
1753536,This live cover of [I Am The Walrus](https://www.youtube.com/watch?v=98Z2vQDqpVw) by Oasis\n\n[The Byrds - Mr. Tambourine Man](https://www.youtube.com/watch?v=NyOzGPbn2tg) (Bob Dylan)\n\n[The Clash - I Fought The Law](https://www.youtube.com/watch?v=AL8chWFuM-s)\n\n[Led Zeppelin - Dazed and Confused](https://www.youtube.com/watch?v=-rmtJ6-EY1E)\n\n[Saint Etienne - Only Love Can Break Your Heart](https://www.youtube.com/watch?v=vZAajrxvDs4),Music
1753603,Thanks for the mention. So far I only found it on YouTube and it sounds great! ,Music
1755060,K-Log !,Music
1757002,Thats good. The wording on mykawartha.com wasn't clear and mentioned only the viewing parties at the curling club and a screen outside.,Music
1757613,Panic! at the Disco - Pretty. Odd.,Music
1757683,So that's why hes doing christmas songs...,Music
1758108,[deleted],Music
1763199,he rented it just for the show anyway.,Music
1766321,We shouldn't be paying taxes to a private corporation that is above the american constitution anyways with their greedy old ass muppet lookin potato heads. ,Music
1767765,Porcupine Tree - Collapse the Light into Earth,Music
1768542,It's sad when you come expecting top gun references and you get archer ones instead. =(,Music
1771886,It\u2019s also iconic where I live. But Im Irish so that\u2019s no suprise,Music
1773474,\nhttps://i.imgur.com/2UPXfp9.png\n\nhttps://i.imgur.com/Xc1OcSQ.png\n\nhttps://i.imgur.com/saoMW8V.png\n\nhttps://i.imgur.com/kIL369O.png\n\nhttps://i.imgur.com/Ud0uS95.png\n\nhttps://i.imgur.com/71WPYYb.png\n\nhttps://i.imgur.com/P1rfOyf.png\n\nhttps://i.imgur.com/fWEIJ0R.png\n\nhttps://i.imgur.com/ftWK279.png\n\nhttps://i.imgur.com/8RQGck3.png\n\ncheck these out for answers\n\n,Music
1781318,I think that your best bet would be printing on paper large enough to fold and staple in the center like a magazine.  A thicker sheet of paper for the cover would help prevent tearing.,Music
1782376,I like Keller Williams version of Pepper originally by The Butthole Surfers,Music
1782450,Opeth also did a great cover of [Would by Alice in Chains](https://www.youtube.com/watch?v=TefH4QuCVqA),Music
1785503,Blue Monday ,Music
1785564,Should have bought BTC ...,Music
1788430,Can you still stand her voice nowadays? I remember loving them in the 2005 days and now I can't even finish this song. What is wrong with me,Music
1790144,It's still relevance.,Music
1791600,[Dinosaur Jr - Just Like Heaven](https://www.youtube.com/watch?v=I3eQGBYEFhE)\n\n\n,Music
1793759,"\""I Shot the Sheriff\"" by Clapton is a pretty good cover of Bob Marley. \n\n\""Blinded By the Light\"" - Manfred Mann's Earth Band covering Bruce Springsteen\n\nLots of covers of Leonard Cohen's \""Hallelujah\"" (notably KD Lang and Jeff Buckley versions).\n\nCarl Perkins' \""Blue Suede Shoes\"" by Elvis Presley (and a lesser known version by Buddy Holly).\n\n",Music
1796012,I just tried to go to the site on mobile and it said use a god damn computer hippy!!! ,Music
1796688,T - Thirteenth Step by A Perfect Circle: H - Hullabaloo by Muse: E - Enjoy It While It Lasts by Spector: R - Redline by Lazerhawk: E - Empire by Queensr\u00ffche: A - Aenima by Tool: L - Language &amp; Perspective by Bad Suns: W - We Are Not Alone by Breaking Benjamin: I - In Decay by Com Truise: N - Self Titled by Nevermen: G - Good America by Electric Guest: E - Era Extra\u00f1a by Neon Indian: R - Rio by Duran Duran,Music
1805194,Good thing he managed to release Rudolph the Red-Nosed Reindeer before this happened. ,Music
1806072,Forevuh,Music
1811907,What happened?,Music
1812584,They also want some Lil Wayne album? What value would that even have?,Music
1813539,Hallowed be thy name- Number of the beast- Iron Maiden\n\nDidn\u2019t expect to like a 9 minute song to finish a album but this one blew me away on the first listen. One of the best rock/metal songs ever imo. ,Music
1829798,It\u2019s probably just a change in preference. It\u2019s not awful to me buttttt I\u2019m not obsessed like I was back then :/,Music
1829862,I liked Drift and Stay Awake songs.,Music
1830451,Ooooooh excellent pick. Can I throw in Breathe too? Cuz that bass line is fucking SICK. Actually i have to go listen to it right now. ,Music
1831494,[Archer - Cherlene - Danger Zone - Duet With Kenny Loggins](https://youtu.be/LJ2RmFcxoDs),Music
1831751,Jimi Hendrix All Along the Watchtower. MUCH better than Dylan's original. ,Music
1832859,You should check out Dave Rawlings  Machine. He has a song that goes into a cover of Cortez the Killer. It's  called Method Acting.,Music
1837434,That final note at the end always gives me chills....It's the perfect ending.,Music
1839387,[deleted],Music
1840660,The built to spill version rocks so much. ,Music
1841652,Happy Birthday! She is a great actress!,Music
1847460,DSOTM should only be experienced as a whole. It's far greater than the sum of its parts. ,Music
1847650,[Massive Attack - Unfinished Sympathy](https://www.youtube.com/watch?v=ZWmrfgj0MZI)\n\n[Massive Attack - Teardrop](https://www.youtube.com/watch?v=u7K72X4eo_s)\n\n[Underworld - Born Slippy](https://www.youtube.com/watch?v=iTFrCbQGyvM)\n\n[Primal Scream - Swastika Eyes](https://www.youtube.com/watch?v=tK0Fm76op14)\n\n[Primal Scream - If They Move Kill 'Em](https://www.youtube.com/watch?v=iGwi15p0YmE)\n\n[Leftfield - Open Up ft. John Lydon](https://www.youtube.com/watch?v=WMDQ7_lnfZA)\n\n[808 State - Pacific State](https://www.youtube.com/watch?v=W9R-2Hwcw-0),Music
1848533,Thanks! That\u2019s what I was looking for. I\u2019m definitely going to look into that.,Music
1848600,https://en.wikipedia.org/wiki/Pono_(digital_music_service)#Reception,Music
1849144,I\u2019ll look into this!,Music
1850607,I didn't see it HOW TO DISMANTLE AND ATOMIC BOMB on my phone.,Music
1852362,hell yeah! Thank you for giving us a listen. If you give us a follow on Spotify it'll help a lot! \n\nStay awake is a fun one live- hope you can see us one day!,Music
1853477,[deleted],Music
1854187,It's two covers. Method Acting is a Bright Eyes song.,Music
1854791,Phish - Roses are Free (Ween song)\n\n,Music
1855332,That live album is amazing.,Music
1862755,IRX gonna give it to him,Music
1863487,Visions of Johanna by Grateful Dead. It was a rare bust out and played in the last year of jerry's life at a time when his singing and playing were in the dumpster but for whatever reason the stars aligned and he performed what is probably my favorite cover ever.\nhttps://www.youtube.com/watch?v=JKhM-Ed8R8k,Music
1865847,I thought he sold it (or put it on eBay at the least),Music
1866303,Talk to me Goose!,Music
1867588,thank you for bringing this to my attention,Music
1867961,I expect my metal to be harder....,Music
1871206,This is Awesome!!  Right now I'm listening to Time Fades Away.  ,Music
1872645,My Chemical Romance- [Desolation Row](https://www.youtube.com/watch?v=FOuSxal8pf4) is one of my favorites. Also Motorhead does a great live cover of [Heroes](https://www.youtube.com/watch?v=J06yQb4lbPk) by David Bowie ,Music
1873780,Trans Europe Express by Kraftwerk,Music
1875672,i read a story that said that was a fake,Music
1877824,[deleted],Music
1878119,Also check out the whole album. It's amazing\nhttps://www.youtube.com/watch?v=sZaBGeARS6k&amp;list=PLy3Eml1H1Si2RUo4aUPOpQY_NJxFsJUSs,Music
1879209,That cover is pretty badass. Thanks,Music
1879442,[deleted],Music
1879645,where is the shuffle button? i dont click through 50 years of his music. just play anything really.,Music
1880088,Is this note for me?,Music
1880889,The site tells me it's not available on mobile??,Music
1883140,Haven't  heard the bright eyes version. I'll  have to check it out.,Music
1885965,Hell yes. Doug Martsch is an unsung guitar hero. \n\n[Link for the uninitiated](https://youtu.be/TNOvqFISxIc)\n\n,Music
1886782,Be Here Now? That's like in the middle of the album.,Music
1887307,God I was thinking CKY2K and now I feel old,Music
1890265,I literally just learned this existed yesterday. I was happy to see he was not.,Music
1892451,"\""Fairytale Of New York\"" comes to my mind:\nhttps://www.youtube.com/watch?v=j9jbdgZidu8",Music
1905966,This needs to be higher. It looks like most of his studio albums are now on Spotify ,Music
1910605,http://www.okayplayer.com/news/martin-shkreli-says-he-bought-lil-waynes-carter-v-through-a-legal-sale.html,Music
1911171,[deleted],Music
1912907,Contrary to popular belief I actually enjoy Sketches of Brunswick East a fuck load.,Music
1912910,and a beer. in a tree.,Music
1914019,Seether - Careless Whisper,Music
1914489,Be Here Now is the name of the album.,Music
1915894,Lol what?  ,Music
1917736,Electric or acoustic version ? I love them both. ,Music
1920562,This is freaking great.  Listening to Time Fades Away now and then I'm gonna watch some of the videos I found.  I'm not gonna get any work done this afternoon. ,Music
1921339,[deleted],Music
1929352,Oddly hasn't changed in 37 years.  Autobahn by Kraftwerk.,Music
1932894,Most of these are metal covers of more well known groups.  I've purposely omitted extreme metal bands covering other extreme metal bands because I wanted this to be more accessible.\n\nShadows Fall - [Welcome to the Machine](https://www.youtube.com/watch?v=0z6SpiwEhQQ) (Pink Floyd)\n\nThe Number Twelve Looks Like You - [My Sharona](https://www.youtube.com/watch?v=InGpue11vQ0) (The Kinks)\n\nEvergreen Terrace - [Maniac](https://www.youtube.com/watch?v=9otihZr4Whw) (Michael Sembello)\n\nMidnight Odyssey - [Your Silent Face](https://www.youtube.com/watch?v=4as94hAVQo4) (New Order)\n\nUlver - [Solitude](https://www.youtube.com/watch?v=ZPOrRl5wxR4) (Black Sabbath)\n\nSoundgarden - [Into the Void](https://www.youtube.com/watch?v=h9wF2DDyz2g) (Black Sabbath)\n\nNorther - [Smash](https://www.youtube.com/watch?v=Hm3DzHOmSDs) (The Offspring)\n\nAs I Lay Dying - [Electric Eye](https://www.youtube.com/watch?v=j2L8QzWG8Ro) (Judas Priest)\n\nAllegaeon - [Subdivisions](https://www.youtube.com/watch?v=cWnyNjQVEZ4) (Rush)\n\nPantera - [Planet Caravan](https://www.youtube.com/watch?v=kWChhdIgT6Q) (Black Sabbath)\n\nThe Black Dahlia Murder - [Paint it Black](https://www.youtube.com/watch?v=IJrzKbN0ubU) (The Rolling Stones)\n\nNovembre - [Cloudbusting](https://www.youtube.com/watch?v=CLFKkSkX9js) (Kate Bush)\n\nDeath - [Painkiller](https://www.youtube.com/watch?v=qPnB8LAneok) (Judas Priest)\n\nIced Earth - [Cities on Flame](https://www.youtube.com/watch?v=iQ5knVaFnCg) (Blue Oyster Cult)\n\nKatatonia - [Nightmares By the Sea](https://www.youtube.com/watch?v=2UK-jayhx0g) (Jeff Buckley)\n\nSlayer - [Dissident Aggressor](https://www.youtube.com/watch?v=Z2kldCMDIPk) (Judas Priest)\n\nDevin Townsend/James Murphy/Matt Guillory/Stuart Hamm/Deen Castronovo/David Townson - [Natural Science](https://www.youtube.com/watch?v=TSaP1Iq0KM4) (Rush),Music
1943923,It sounds exactly like a white stripes song\n,Music
1947026,[removed],Music
1959195,Love Is All We Have Left   \nAmerican Soul  \nSummer Of Love  \nRed Flag Day  \nThe Showman  \nBlackout  \n\nThose are the standout tracks that are as good as anything else.  The bass and drums in Blackout during the verse... please.  If this was Jack White everyone would be jizzing their pants.  That song is as good as anything U2 has done.  ,Music
1959640,"The album \""What Time Is It?\"" is their best I would say. It's super groovy from the first note to the last.",Music
1961874,It makes you wonder if artists like him who used homophobic remarks in older work still have those feelings now. IIRMC Eminem has some homophobic lyrics in older work but rescended them. He has worked with Elton John in the past.  ,Music
1969755,Wow.\n\nWas not expecting 50 years of music.\n\nMeter says I'm listening at ~5000 kbps.\n\nLove the crunchy harmonica on Hello Lonely Woman.,Music
1972321,He thought 192kbps was high resolution? I thought 320 was optimal,Music
1972923,I would expect that the algo\u2019s are much more efficient at curating playlists which users are \u2018satisfied\u2019 with. \n\nI wonder if it spoils the experience a bit..  it\u2019s possible that we will end up listening to a less diverse spectrum of music,Music
1975662,I agree about Midnight Train to Memphis; you just can't top his Steeldrivers version. Still great though. ,Music
1977220,You could also say I'm gonna ride my llama,Music
1977600,Fuckin decent. The master quality is unreal.,Music
1978226,Sublime.,Music
1982015,I can't wait to listen to it on my Pono!,Music
1991604,Legendary track.,Music
1995119,Maybe in the US. In the UK there's a shitload of 80s songs in the Xmas canon.,Music
1996140,"I dig this! Love the dirty guitar sound for the solo on \""Drift.\"" Definitely going to listen to this some more.",Music
1996200,Queen\n\nThe Stranglers,Music
1996849,Tag,Music
2005625,CunninLynguists - The Light from A Piece of Strange.\n\nUplifting end to a serious story album.,Music
2007474,The Wiggles.,Music
2007482,[removed],Music
2012448,&gt; If this was Jack White everyone would be jizzing their pants.\n\nThis made me lol. It's so true too.,Music
2013057,At All -Kaytranada ,Music
2015081,Thanks pal. \nThese people do know that in 2011 Ntrepid was contracted to shadow puppet accounts for central command to disseminate leftist propaganda right? \nProbably not. So I'm never really concerned about my downvotes. ,Music
2015154,"Martin Shkreli: \""My Wu-Tang album is nothing to f*ck with!\""\n\nFeds: \""Oh yeah...?!\""\n\nEdit clean up",Music
2016966,Fantastic LP. Loved it upon first listen.,Music
2021294,This is awesome to have high-rez stuff available for free to stream.,Music
2024862,SO happy about this\n,Music
2024896,track is super sick. props.,Music
2025822,Southern man don't need him around.,Music
2028451,Oh you got downvoted too. You must say things that are worth our time once in awhile ,Music
2030106,[removed],Music
2031427,How the fuck are you going to group Eminem in with vanilla ice.  One of the greatest rappers of all time.  ,Music
2031830,Listened to one of your songs and to be honest you got me hooked! You guys sound awesome and I am definitely going to listen to more songs.,Music
2033295,you are the bomb! i love this song! haven't heard it in forever!!!,Music
2037104,YES YES YES!!! SOLID GOLD!,Music
2037105,I was so happy when I bought it on vinyl and found out the weird ending is the runout in the center of the vinyl and will keep playing on loop until you take it off ,Music
2040489,Plastic's real when you're real sick! ,Music
2043243,[removed],Music
2045935,STP,Music
2049786,Oh wow so glad you got to hear it! \n,Music
2053827,really appreciate that so much! Thanks for taking the time to give us a listen. \nYes that tone was so dope to make- we had the compression turned all the way up. Let me know if you like the others!,Music
2054833,thank you so much MaxKenwell! What song did you check out? Really appreciate your support!,Music
2055663,I've given it a few listens the past few days and I'm impressed.   Always dicey when a band like that doesn't release material for 15 years but they pulled it off.  Also saw them a few weeks ago and they are crushing live.,Music
2059311,Stone Temple Pilots ,Music
2060531,This is fantastic. What a creative artist. Long may you run Mr Young.,Music
2060663,I love [GWAR's cover](https://www.youtube.com/watch?v=o7EVersJ6ts) of this song.,Music
2068615,well...  he's an old man now.\n,Music
2072287,"My favorite version of \""Old Man\"" sounds so much better as a master than the shitty rips on youtube.\nhttp://www.neilyoungarchives.com/#/info-card?track=t1971_0119_06&amp;_k=31pjm1",Music
2072940,I would like to add Riders on the Storm. Knowing that the whispered vocals were the last thing he recorded for The Doors is especially poignant.,Music
2074837,Such Sound. Much Wow!,Music
2080299,Sketches is probably my favorite as well ,Music
2085122,M- Mariana's Trench - August Burns Red\n\nO - One - Metallica\n\nO - Omen - The Prodigy\n\nN - Needle in the Hay - Eliott Smith\n\nD - Dreamscape - In Flames\n\nO - Other Worlds - Break of Reality\n\nG - Get Up - James Brown\n\nG - Garden Grove - Sublime\n\nI - I Think We're Alone Now - Tommy James and the Shondells\n\nE - Eleanor Rigby - Letters From the Fire\n\n\n\n\n\n,Music
2087500,That sounds about right ,Music
2091926,I clicked the first one on Spotify which was Hollowhead. Now I am listening to the entire album :),Music
2092721,[deleted],Music
2092722,Honestly one of the most helpful sites on the internet.,Music
2092812,[deleted],Music
2099065,Not available on mobile:-(,Music
2103199,I don't listen to electronic music much but I freaking love Kraftwerk's Computer Love.,Music
2103720,Yaz - Situation,Music
2108503,"I saw some kid call it \""gay\"" and others say it wasn't quite their speed.",Music
2109786,"\""Where the Hood At\"" is practical unlistenable due to the homophobia on it. Sucks. I loved that song when I was younger and I wasn't really paying attention to all the hate in it.",Music
2111791,Damn it right after he released a Rudolf cover too....,Music
2112553,Freaking amazing. The entire future of the music industry is somewhere in here. ,Music
2113184,I'd love to hear your thoughts on the whole album!,Music
2119935,I personally prefer Sammy,Music
2121893,[Portishead - Roseland NYC](https://youtu.be/ZFwnlCudeC0) is a good one,Music
2134292,Wish I could download and not load the server up,Music
2136236,AC/DC\n\nJust kidding. ,Music
2146796,How has no one said Genesis yet?,Music
2151197,I was in my work truck the other day when I Am the Highway from Audioslave came on. I sang my heart out to that song while trying not to tear up. People probably thought I was out of my mind,Music
2151282,Queensr\u00ffche. Geoff Tate was the best it was ever going to get.,Music
2154814,Purity Ring- Stranger than Earth ,Music
2156533,Yaaaas... Love this guy. His concerts are awesome too. ,Music
2157796,For some reason music didn't start:(\nNice design btw,Music
2158414,The Dave Matthews cover of it featuring guest Warren Haynes Live at Central Park is great as well.,Music
2170467,I can't go back to Young's version after listening to the Cash/Frusciante cover,Music
2180703,[deleted],Music
2191427,[The Chemical Brothers - Sunshine Undergound](https://www.youtube.com/watch?v=IykWbUVDWL8),Music
2195346,Time to post this again\n\nhttps://people.xiph.org/~xiphmont/demo/neil-young.html,Music
2196611,Thank you!!,Music
2206835,That's not fair to say\u2014 he's a lot like you are.,Music
2207985,something something Fourth Amendment something,Music
2208187,Literally how they got Al Capone.  Not the crimes but tax evasion ,Music
2208595,[deleted],Music
2212073,You're thinking of Paul Rogers.,Music
2213546,There aint nobody alive who could do it justice other than Adam. ,Music
2214283,[deleted],Music
2215644,Faith No More. Mike Patton is much better than Chuck Mosely.,Music
2216462,[deleted],Music
2229574,"Everyone should listen to [this](https://www.youtube.com/watch?v=gxPTQDP2bRQ)\n\n\""Dave Rawlings &amp; Gillian Welch - Method Acting + Cortez The Killer\""",Music
2235909,The only thing that can make this better is a mobile app. ,Music
2239001,I'm going to stretch 'all time' to give you something you haven't listened to yet.\n\nhttps://soundcloud.com/fennecsound/no-equal,Music
2249791,Anyone else going to Omeme tonight?  \n\nI don't have a ticket but I hear they are setting up some screens for the people outside. It's crazy to think that Neil Young is going to be playing a concert 15 minutes down the road from my house,Music
2253693, &gt;implying anyone actually bought a Pono,Music
2254972,I really like the cover by The Killers (mainly because of Flowers' great vocals) but nothing will compare to Knopfler's version. Knopfler produces a very distinct sound with his National guitar that just gives so much feeling to that song. Add to that his heavy voice and it feels like there's a guy in front of you serenading someone. ,Music
2256831,[removed],Music
2260105,Deafheaven earlier this year at a club with a couple hundred people.  Awesome show.,Music
2261968,streaming Time Fades Away at 1928kbps! \n... Now skipping :( \nswitched to 320\n now froze up :(,Music
