id,comments,subreddits50663,"im smfc, but I remember in the silver ranks playing a smurf was basically like playing a cheater, they are unkillable",GlobalOffensive
50676,"Well yeah, he's considered the potential GOAT for a reason.

This guy is incredible, will go down in history as one of the best.",GlobalOffensive
50721,"I love fatality, such a nice person. Professional gamer and a founder of esports. Good old times without crybabies on twitter starting witch hunts against each other.
",GlobalOffensive
50722,"&gt;but playing with mouse accel isn't an option.

Meaning it's not a option because it degrades muscle memory for accurate shots, not because he can't actually select it.",GlobalOffensive
50751,They took the i7 from the streaming PC to give to Shroud FeelsBadMan,GlobalOffensive
50763,"You actually have to send a smoke signal to Gabon directly. Must have the cheater's blood type, mothers maiden name, valid email address, and first pets name or the name of their favorite teacher ",GlobalOffensive
50798,"Valve are also fucking losers lmao. Look at the shitty ass gameplay updates they put into this game.. R8, when the AUG was insanely OP, talk about being out of touch with the community. Unban the poor kid it's a fucking video game for Christ sake.",GlobalOffensive
50799,"So don't watch Starladder if you don't like their CEO? 

Even if I don't agree that he respresents the views of his whole company by his every move, if you believe so just don't support them? Still don't understand why it's wrong of a CEO to say ""fuck you"" to someone, if that's what they feel is right. Especially not when done in such an obviously comedic way.",GlobalOffensive
50803,Every league needs a villain. There should always be someone talking shit and shooting bodies.,GlobalOffensive
50807,Haha true that ill edit i suppose to please the masses,GlobalOffensive
50821,Old CSGO didn't have stuttering when going to the pause menu though (you can test it with the 2013 demo_viewer release),GlobalOffensive
50826,"I am very well on the side of not using the bug, as it clearly is a big advantage, but I have yet to see why it is unethical or unfair. 
Ethical behaviour is to my knowledge derived from the public opinion, in the various threads that have been up on reddit we see that the public opinion on this is all but clear so I don't see how you can say it is unethical.

Arguably every team but BIG does not want to use it because BIG probably knows best how to abuse it, giving the rest of the teams a big disatvantage. I can only speak for myself but I would already try to make them not use it because of that.

So yes I know it's not intended behaviour, I know it's for the better of everyone that it won't be used anymore, but what is happening on reddit is that people are crying about BIG scamming, cheating, unfair play and unethical behaviour, which is simply incorrect.",GlobalOffensive
50840,just like it was ridiculous to single out fnatic in olofpass?,GlobalOffensive
50887,Damn....no one has said anything about steel right now.  Feels???Man,GlobalOffensive
50899,sex has 3 letters and Dosia is the god of all 3,GlobalOffensive
50913,"Your whole reasoning for only caring about majors is bs and in your head. 

""I'm excited for Eleague because Eleague is just incredible. And I'm excited to see how teams I like like FaZe, NiP, Optic Gaming will do and perform. But I won't really be watching these events. They don't have that magical feeling of ""I'm so involved I wanna watch!"" that Majors do""

You never actually explain why. Why is the major any better? Because you have bet on the teams with $2 stickers? 

Let yourself enjoy the other tournaments and your problem has vanished. The last two majors were crap anyway compared to alot of other tournaments in the last 18 months. 

There is already an issue with too many tournaments per year and players not practicing as much as travelling. 
If majors are as important as you make out then there definitely shouldn't be more than two per year...",GlobalOffensive
50915,By optional I think they should just add it into Prime.,GlobalOffensive
50933,"Thats the ""LoL eSports"" culture, cant be passionate because thats ""disrespectful""",GlobalOffensive
50943,"I think matchmaking is just bugged sometimes, games like [these](https://steamuserimages-a.akamaihd.net/ugc/356148425669499184/8C2172A540B1CD0003EE144E56BE2EC92F93B0C9/) come to mind",GlobalOffensive
50987,You play a game catered for young people with kids all the time and you are mad because kids come to spectator events geared towards adolescents/young adults and scream? LMAO,GlobalOffensive
50989,"Yeah I do agree with the B shit, seized fucked up tons. But NaVi yesterday definitely looked better than the past 3 months. Not terrible at all, but definitely not amazing.",GlobalOffensive
51003,"It's kinda the same for gaming.youtube

Edit: the downvoters probably didn't even try gaming.youtube.com",GlobalOffensive
51008,"I was joking with the way i put it, but basically what im getting at, is that these players put a lot of time and passion into the game, so when they lose in heart breaking fashion then its natural for them to be angry and or upset, my original comment wasnt really an argument just a joke. This is my real point :D",GlobalOffensive
51023,"Oh, I wish machine would cast again here and there.",GlobalOffensive
51031,I hope half the people here dont be judges. They sound like they would give lifetime imprisonment to someone that stole from a shop. ,GlobalOffensive
51032,"Still, if you compare to 4 NA spots c9, liquid, CLG and optic are on par with four best CIS teams",GlobalOffensive
51070,Lol no it was from the Fnatic game where Kenny lost the clutch vs Dennis iirc.,GlobalOffensive
51118,"Well, surprisingly, there's actually other regions than NA, like EU.",GlobalOffensive
51156,"Because it's a real letter in Norwegian and Danish, and it's exactly the same letter as the swedish ""ö"", pronounced the same way and used in the same way. ""o"" cannot be substituted with ""ö"", they might look similar but they're quite different and pronounced very differently. While ""ø"" is not in the swedish language it makes much more sense using it opposed to using ""o"" if you were to write Malmö without the ""ö"".",GlobalOffensive
51159,"Only needed to watch four rounds. Your justification of losing based on facing smurfs is incorrect. Its a clear case of shifting blame to not accept responsibility. Round 3 alone i can reduce you to tears with how harsh i can critique it.

Im a bit pissed off at the moment. For youve misled people here with an invalid justification.",GlobalOffensive
51174,"Who is shit talking? I am stating facts. He is a lurk, and that is all he was good at. He would bait his teammates and get frags. Occasionally he would have god clutches. But he is washed up now. He can't carry any team, not Liquid, not Optic, no one. He is still a good player, he is just not top 20 anymore, which is what it will take to win a major. Him being ""accomplished"" has nothing to do with his *current* skill level. Besides, he still has no major under his belt.",GlobalOffensive
51177,Well obviously because else I'd have to throw myself out...,GlobalOffensive
51189,dazed is a fucking genius he can fuck me in the ass with no condom anyday ,GlobalOffensive
51236,You live in Brazil. You got fucked by God by being born there.,GlobalOffensive
51253,"&gt; indicates against Miami Flamingo's too :/ Just lost a couple really big rounds like this and we couldn't overcome 

wtf was that jump tho ",GlobalOffensive
51259,"if u are doing dumb shit like this then na 1 spot sa 1 spot asia 1 spot eu 3 spot cis 2 spot

but overall it doesnt matter

if nv lose to dignitas in minor they are not going to qualify for major anyways so who cares",GlobalOffensive
51295,"To be fair it suggests continued decline of everyone who isnt SK or C9. Its interesting, but its value is questionable.",GlobalOffensive
51306,I think it's pointless to mention players origin when talking about best players in a region. If they compete in that region they also compete for best player of that region.,GlobalOffensive
51323,"the sloppiness, jesus fuck, it's going to bite c9 so hard in round 4",GlobalOffensive
51356,Yeah they were at the time of the last major at least,GlobalOffensive
51366,"Well he's is partly French according to his liquidpedia page, so I guess it makes sense.",GlobalOffensive
51371,And this is a perfect example of of someone clogging up Overwatch.,GlobalOffensive
51378,"not really crucified. Just makes him unlikable for some people, but its all fine. Both wanna win so its fine in the end. Some people find this emotional style entertaining and some dont. But that'S fine, nothing will result out of it.",GlobalOffensive
51393,Anybody wants to explain to me why people think dennis is gonna get cut? i think he's pretty good ... ,GlobalOffensive
51421,"SK is making a lot of mistakes, they didn't lost this map faster because they managed to win several clutches.",GlobalOffensive
51439,"You need to have more [interaction](https://www.reddit.com/wiki/commenting#wiki_commenting) with the /r/GlobalOffensive community before posting video or stream links. Unfortunately, this has become necessary to combat video spam &amp; people who only use the subreddit to blatantly advertise their content. Please do not contact the moderators asking about the participation level required for submitting content - we do not reveal it but it is quite low and any reasonably active commenter should reach it easily. You can find our rules regarding advertising and self-promotion [here](https://www.reddit.com/r/GlobalOffensive/about/rules/).

*I am a bot, and this action was performed automatically. Please [contact the moderators of this subreddit](/message/compose/?to=/r/GlobalOffensive) if you have any questions or concerns.*",GlobalOffensive
51452,"Machine does this frequently at ESL events. Mainly, because ESL produced events are just shit shows.",GlobalOffensive
51469,I could be wrong too! But Adam is at least very high up in MLG,GlobalOffensive
51477,I miss being able to remove it and put in on fast. :(,GlobalOffensive
51491,"Disclaimer: Zeus doesn't actually play 15 hours of CSGO a day.

The real number is about 130-150 hours/2 weeks. (That's how much he tries to put in every bootcamp)",GlobalOffensive
51511,"Yes, it's investing, but not all investing works out, if the orgs imagined that the game would grow at the rate that it grew during 2015, invested accordingly and it suddenly plateaued we could see another esport go down the shitter.

I'm faaar from an expert in any of the topics that are being discussed, but that podcast and the latest tournaments viewerships had me worried.",GlobalOffensive
51522,Highly high unlikely. They've never used the DLC list for those types of updates. This is something new.,GlobalOffensive
51535,-Removed shift walk for CT to compensate for ninja jumping CT's.,GlobalOffensive
51550,I don't know my exact rank I'd have to check but i have about 8 hours and am in the us ,GlobalOffensive
51571,"It's almost like you saw those things on a scripted broadcast that is meant to entertain people, (not you specifically) and pretty much nothing more. ",GlobalOffensive
51576,"Well put.  I was going to type exactly what you said about karma in my last post but ended up leaving it out.  I am relieved to see that others like yourself have been aware of a lot of the negativity he constantly emanated, and the act of taking his internal issues out on everyone around him.  Hopefully what he is going through will help shape him into a better man.  Struggling and hardship can really help a lot of people in the long-term.  Thanks for your response!",GlobalOffensive
51627,"uhhhhh no he wasn't? He has been on Mythic for a while, the team he made with a few other guys, before that for a long time he had no team, before that he was on Noble, and the last ""real"" team he was on was the LG team (before they picked up the current SK lineup) that changed orgs a few times. He was never on CoL.",GlobalOffensive
51640,Yeah because they'd throw a match that would qualify them for playoffs without having to play one more game in a high risk situation. That makes sense.,GlobalOffensive
51641,"The silent jump and the bug jump is the same jump, but people have been using it for silent jumping for a long time",GlobalOffensive
51746,And we get to see how good he is still with how good he is at the clutch situations.,GlobalOffensive
51773,The fact that KNG (secondary awper) had a higher HS % than Adren is sort of surprising.,GlobalOffensive
51807,"ESL is, and always has been, such shit. Machine is probably just sick of dealing with it considering how many good events he's been hosting lately. ",GlobalOffensive
51827,"I think he cheated but I don't really bother trying to discuss it on here cause you'll just get downvoted

Everyone seems to forget the complete and utter witch hunt that used to be on here and his borderline blatant clips that have suddenly just screeched to a halt (I've not seen a flusha clip in over a year) But ah well, /r/GO is like that",GlobalOffensive
51877,"Writing flairs/tags in the submission title should be avoided. We ask that you submit your post again after removing the tag/flair, then [select the appropriate flair](https://i.imgur.com/31QFe2a.png) for your post.

*I am a bot, and this action was performed automatically. Please [contact the moderators of this subreddit](/message/compose/?to=/r/GlobalOffensive) if you have any questions or concerns.*",GlobalOffensive
51924,"That is not the point. I just made some half random shit up to illustrate. I am obviously not a part of that expert panel, making those seedings. ",GlobalOffensive
51962,"Sorry but this is something you can't control. Even at the pro level, back seat driving and hindsight ""should have, would have, could have"" is still a thing. That will never change for any competitive game.",GlobalOffensive
51984,"Thats not how pickems work. You bet on the better team, not your favourite.",GlobalOffensive
52023,"I had this discussion countless times... I dont like pbp casters in general, but i tolerate them if they provide me with tacticaly necessary information and keep a basic understanding of the matchflow. Pansy is certainly capable of that, but she does not read  the radar nearly as often as she should, thats her main weakness. She misses important points of the round because of that. I remember her casting a g2 match on train where she completely destroys g2s efforts in that round, g2 lost every duel and didnt get a single kill, she shoutcasted that like its a normal gunround... What she didnt read was that g2 had glocks only, 2 smokes and 1 flash. 

G2 got the plant with that equipment.

It was a full eco. A successfull one.

How someone can miscast an entire round like that is beyond my understanding and those things happen over and over again...",GlobalOffensive
52033,"But on the other hand, the team that gets to play 2 in a row is warmer than the other one that wasn't playing. I don't know about you guys, but my performance ingame is so much worse in the first game that I play, even if I death match for some minutes.

",GlobalOffensive
52093,feels rlly bad brushing after drinking coke you're a legend,GlobalOffensive
52107,"To be fair, to ask these teams that have practiced and put in crazy amounts of hours into strats for the maps, telling them to adapt just during the tournament is a real slap in the face to the teams.

""Ey guys let's go banana""

""nope we have to 'adapt' to the bug""

They're mocking valve because of Valve's response to the bug, what I think is honestly a really shitty response, sarcastic or not. ",GlobalOffensive
52109,"jesus christ already trying to belittle their possible major win.

isn't Gambit on a perfect record? didn't Gambit beat Astralis? Didn't BIG destroy 3 top 5 teams? 

holy crap, they're playing great CS and they wholeheartedly deserve it. ",GlobalOffensive
52137,"People make smurfs to play with friends or just to do something different. I have 5 accounts myself, a couple of them bought for smurfs, one because I wanted to see how long it took me to soloQ to Global and a couple storage accounts I play on so rarely they're somewhere in Nova so I use those to play with beginner friends.

The thing is with these kind of accounts at high ranks is that people who make a smurf and have it at Supreme or something are usually decent at the game which raises even more suspicion of them being a cheater (low hours, new account, doing good in-game).",GlobalOffensive
52151,My user name is vAdei and i would like some kind of fox with or without my name :) ty ,GlobalOffensive
52165,"Oh that's amazing! We used to have a house snake, can't remember what breed she was, but she passed away early this year sadly :( 

It's not terrible, it looks very clean which is what you want really! Yeah the colours on it are amazing, makes me want a phase 4 hahaha",GlobalOffensive
52183,"We have quite a few players with potential, Gratisfaction comes to mind as well as ofnu",GlobalOffensive
52200,post a picture of your self holding your reddit name before anyone can take u seriously so we can find you if your lying,GlobalOffensive
52239,"i literally cheered at that gambit one, these are great...the G2 samurai looks like victor vran lol

the virtus pro one is going to be my background at my new job on monday",GlobalOffensive
52251,It's either that or he needs a new prescription for his glasses. I honestly don't know how a caster can miss so much.,GlobalOffensive
52282,"if f3 roster is confirmed then you can remove electronic
HR: -Ange1 -styko +seized +electronic",GlobalOffensive
52350,"The play was great, don't get me wrong and hats off to Dosia for thinking about it in that high pressure intense situation but they were up by 7 rounds. So it wasn't really a deciding factor. All the other graffitis were give for plays where the scoreline was significantly closer.",GlobalOffensive
52392,"the one they made for xyp9x was dreadful

'I like to go out here and eat icecream with my girlfirend and just talk'

Wow, how interesting!",GlobalOffensive
52452,Nastiest kill of the major is a tk by the bottom fragger of the showmatch,GlobalOffensive
52457,"If Elige gets that kill from underpass to window in 14-14, that's GG right there. FeelsBadMan

GGWP to both teams",GlobalOffensive
52491,"fer said in a interview that they'll try to hide some tactics, but if they need to use them in the grand finals they're going to and they'll have to create new things for the major",GlobalOffensive
52498,"Oh yeah of course. I usually stay quiet anyway but if I do notice my teammate kind of making panicked decisions I'll do the hearing for him and he can focus on finishing the round with a W. 

I just wanted to know what you personally thought if it was considered shitty back seat gaming or a justified back seat gaming. Cause your opinion matters to me lol. (I take it as feedback)",GlobalOffensive
52508,"That run by Ownage was hilarious, started out with them doing it cuz they had nothing else to do and then they almost qualified lmao ",GlobalOffensive
52509,It doesn't matter they have got this popularity since the beginning. Seriously what a dumb logic you got there.,GlobalOffensive
52519,"Something like this happened to me after I had my 144hz monitor for a while. Desktop running at 144hz but game would launch at 60hz. Adding the ""-freq 144"" launch option fixed my issue. The ""lag"" I was noticing was actually just the feel of going back to 60hz by accident which is why my fps was still 300+.",GlobalOffensive
52520,"I read this fuckng story about Maikelele, I remember, u liar",GlobalOffensive
52556,"I'm not saying we can ban all of them, but even a small fraction is better than nothing.",GlobalOffensive
52562,"FYI: The ""strats"" on the board: Vacuum cleaning, tidy up kitchen+dining table and room cleaning,makes it even funnier
",GlobalOffensive
52582,"I'm sure you also still have ""k"" as push to talk. Why did you configure your controls the way you did instead of using ""skill"" by using default controls?",GlobalOffensive
52583,"I don't understand why anything you said is relevant to what I said. I'm not saying these issues are event ruining, but if all these issues occur in the first 2 games of the tournament, that is certainly not a good sign.  I'm sure ESL will only improve this tourney over time, but if they continue to have this many mistakes occur that is unforgivable when other tournament hosters have only a fraction of the issues occur.  ",GlobalOffensive
52595,Except when they didn't change the channel to the event they sponsored.,GlobalOffensive
52596,"Dont get me wrong, I love all of them, lucas is one of my favorite players in terms of personality, but as a long time IMT I have to say

When he ""wants"", he can throw reaaaaally hard",GlobalOffensive
52607,I've had complete freezes in my framerate at least once per match since the update. I'm talking about the game being stuck on the same frame for as much as a full second. Absolutely unplayable,GlobalOffensive
52616,"NBK plays every shit role imaginable and plays them well; get rid of him and you'll have new drama and a new shuffle about how apex, shox &amp; body couldn't agree on who was supposed to play drop on cobble. And apex is arguably still a top 5 entry fragger. Y'all smoke pipes on this subreddit...",GlobalOffensive
52622,I want my grenades the size of a small atomic bomb so that when they drop on the ground i can use them as cover to block bullets. ,GlobalOffensive
52648,"Without internet the workshop tab doesn't load, it'll say that it can't connect to streamor something. I can't see any of my workshop maps from the workshop tab, which is why I'm doing it from console. 

Is there any way to change gamemode to custom when you're not in the workshop tab? ",GlobalOffensive
52707,"lol, no someone suggested in one of my other threads and I thought it would be interesting to see.",GlobalOffensive
52723,"LOL that gif, where's that from? looks like something from Joe Dirt, honestly.",GlobalOffensive
52740,"The straight A Rush from EnVyUs is the telltale sign that they realised that KPI aren't a threat to them aim-wise. They're definitely sick players, but they're not winning this series when NV have so much confidence and momentum.

edit: NV stumbling a bit? I'm rooting for the comeback now!",GlobalOffensive
52744,"New HLTV rating shows so, I'm sure he has gone up to a 1.2 HLTV rating this event alone. ",GlobalOffensive
52760,"Really it's just Optic and CLG struggling, not so much Liquid, they put up a pretty good fight against F3 (who have also prepared for the qualifier more than other teams) even Optic signed a new Coach so at this point everything is really a toss up.  ",GlobalOffensive
52789,"No, each player is GIVEN a SSD, already installed and configured with their configs that they sent over prior to the event",GlobalOffensive
52818,i don't think blocking them in a video game will prevent you from making and physical/verbal contact in real life,GlobalOffensive
52842,"You need to have more [interaction](https://www.reddit.com/wiki/commenting#wiki_commenting) with the /r/GlobalOffensive community before posting video or stream links. Unfortunately, this has become necessary to combat video spam &amp; people who only use the subreddit to blatantly advertise their content. Please do not contact the moderators asking about the participation level required for submitting content - we do not reveal it but it is quite low and any reasonably active commenter should reach it easily. You can find our rules regarding advertising and self-promotion [here](https://www.reddit.com/r/GlobalOffensive/about/rules/).

*I am a bot, and this action was performed automatically. Please [contact the moderators of this subreddit](/message/compose/?to=/r/GlobalOffensive) if you have any questions or concerns.*",GlobalOffensive
52845,It's not even an excuse. They were completely outplayed 100%... but the fact is that they were the only team from quarterfinals to play twice on the same day. ,GlobalOffensive
52850,"prob should read posts, get informed, etc. before you talk",GlobalOffensive
52872,"That was fucking pathetic from Navi. Though you can't do much when Immortals are hitting every awp shot and no scope. Seized, your time is up. FeelsSimpleMan",GlobalOffensive
52894,"+1 to that. It's a real shame they didn't make the executive decision to swap out Friberg sooner. Awesome guy, but it's been made way too clear that he weighed the team down",GlobalOffensive
52930,I can definitely ignore it. Online is a terrible platform to judge teams. Ownage beats CLG online. Astralis/FaZe don't make it to EPL playoffs online. Flipside finishes at the bottom of Premier online. LDLC 2-0s Na`Vi and VP online.,GlobalOffensive
52942,its pointless for him to keep rebuying knives after his account gets vacced everytime,GlobalOffensive
52982,"With teams able to pick which tournament they want to play at, HLTV ratings are getting really screwed up. SK having double the points of everyone else is a bit stupid.",GlobalOffensive
