id,comments,subreddits34010,Every once in a while I still get compliments on my low steam ID.,GlobalOffensive
34098,Yea some of the most experienced and battle-tested players of counter-strike have adopted a scrub mentality,GlobalOffensive
34132,After two years without going to a major because of the traitors the absolute madman kRYSTAL actually did it. What a lad.,GlobalOffensive
34134,they got a Csgo update thats why they r doing the videos (if u didnt know already),GlobalOffensive
34135,"Was just about to post something accordingly. Not sure if, as speculated, if this is a spectator bug or not - anyhow, good on you for posting it and shedding light upon it. ",GlobalOffensive
34175,"If you keep seeing me everywhere, [doesn't that mean that you are everywhere aswell?](https://www.youtube.com/watch?v=HQoRXhS7vlU) 
",GlobalOffensive
34194,"Yeah even open teams do it, but this guy doesn't include main teams lol? Main teams def watch demos of their opponents. ",GlobalOffensive
34254,every single round in which lowel is allowed to play on the team instead of any other t2 german player is a round in which I suffer a pain that is entirely unnecessary and that i do not gain from,GlobalOffensive
34268,"Yes, 5 physical speakers with audio data sent via optical audio cable. I also tested with https://www2.iis.fraunhofer.de/AAC/multichannel.html and it functions perfectly.",GlobalOffensive
34289,"As a noob, why isn't that the bug? He crouches - jumps - uncrouches in the air",GlobalOffensive
34290,"Why tho

Both teams had literally one bad PR episode",GlobalOffensive
34294,"Uhhh, they weren't underdogs against NiP in any sense of the word.",GlobalOffensive
34314,"That doesnt even make sense.  
So what, we have another major at the end of the year, and another one at the start of the next? 1-2 months between then? Don't need to work at Valve to be logical.",GlobalOffensive
34332,"I like jdm and I think he was quite important today, despite his score. Won a couple rounds with some good kills.",GlobalOffensive
34353,"Who knows, but it's not an excuse for allowing it to happen. There's no reason to allow it outside of a technical timeout, and plenty of reasons to disallow it.",GlobalOffensive
34362,"I'm not a pro, but I would play it if I had the chance. I don't mind losing, it's good for your ego.",GlobalOffensive
34416,its been 10 games in a win row and still no rank up ,GlobalOffensive
34449,"depends since there are different levels of infantrymen with different ""jobs"" also ""grade"" of infantrymen. but pretty extensive.
",GlobalOffensive
34466,"Your submission has been temporarily removed because it appears to address Valve directly. We ask that you trim your title and submit your post again; adding ""Valve please"" or similar phrases only adds repetitive clutter. If your suggestion is golden, it will be upvoted for visibility and read by the developers regardless. If you have a message for Valve, you can email the CSGO Dev team at this address: CSGOTeamFeedback@valvesoftware.com

*I am a bot, and this action was performed automatically. Please [contact the moderators of this subreddit](/message/compose/?to=/r/GlobalOffensive) if you have any questions or concerns.*",GlobalOffensive
34475,"Rip NA Cs










That is all I have to say.",GlobalOffensive
34483,"I found something called Ratio  and changed it to original, but it still does not seem to work.",GlobalOffensive
34489,Same aha. They fucked up big time. I hope it doesn't cost them the match though.,GlobalOffensive
34518,"The first reasonable thing I've read from Thorin on Twitter in a while. That said the organiser is still the main ""throat to choke"", so they are ultimately responsible.",GlobalOffensive
34613,How did minikerr not kill him at the end there? Literally looking at the guy's back and doesn't do 1 point of damage. ,GlobalOffensive
34618,"**[YOUTUBE MIRROR: S1mple force buy pays off](https://www.youtube.com/watch?v=TWzCQbLFLYg)**

 ------

Credit to [twitch.tv/PGL](https://www.twitch.tv/PGL) for the content and /u/Laachy for sharing it.",GlobalOffensive
34692,"I think it's pretty normal to think a team is changing the roster based on bad results. I mean, it is certainly not uncommon.",GlobalOffensive
34698,"yup, thats what happens when they all play well, i hope they continue in the group stage",GlobalOffensive
34775,"feels like everytime Tyloo goes ANYWHERE than china, they miss a flight or they dont have a visa, glad they can make it tho",GlobalOffensive
34778,Second time Hiko to EG doesn't happen. Just seems like EG coming into CSGO will never happen.,GlobalOffensive
34802,"Pretty sure that is fake cus on my twitter there is never a 0 next to replies, retweets, or favorites.",GlobalOffensive
34827,"""lobster master"" 10/10 flair I always thought it was legendary chicken. This fits your name much better. ",GlobalOffensive
34833,"Found the under 16

Look at ypur attitude and tell me youre mature enough to attend these events. Youre not.",GlobalOffensive
34839,Why people even care? Faceit gave us 128 Tick MM with good ping ,GlobalOffensive
34846,"If I remember correctly, ESL had the audacity to play ads during tech pauses... ",GlobalOffensive
34866,"I mean it obviously isn't the ideal play by the CT but they had 5 seconds left and heard the smoke go down. It is a fair assumption the terrorist would go for the plant 99/100 times and the CT wanted that extra second to get that better positioning and do exactly what you said storm the CT which that extra second would help him a lot.

It wasn't the smart move and I doubt he put too much thought into it but I'd consider it more a smart move on the side of the terrorist rather than a huge misplay by the CT.",GlobalOffensive
34874,"Xizt must be the worst top level player going around.
Bloke couldnt hit the broadside of a barn.",GlobalOffensive
34956,"Your post was removed because a similar clip has already been submitted. 

If you believe this removal was made in error, feel free to send us a [modmail](https://www.reddit.com/message/compose?to=/r/GlobalOffensive&amp;subject=insert%20descriptive%20title&amp;message=Please%20make%20sure%20you%20have%20read%20and%20understood%20the%20rules%20before%20sending%20a%20message#mods#button).",GlobalOffensive
34964,These guys need better camera work. As soon as fer gets like 1 or 2 kills the camera should pan to him immediately.,GlobalOffensive
34992,Isn't it supposed to be like that?So it's higher since the less deaths the better?,GlobalOffensive
35010,Yeah but then they're adults so you can tell them off in a different way than if they were kids.,GlobalOffensive
35016,"It is not good. It just is a lot of blaming and excuses for bad players. Sure it is comedy, but still pretty lame.",GlobalOffensive
35054,"I mean, it goes even beyond that. It's incredible to see the energy in Immortals, and I'm very happy for steel especially (sorry, the twins have fucked us so much that I have to feel just a bit of rivalry), but when you compare the teams that IMT had to beat to get to the finals versus the teams that Gambit had to beat, the randomness of the Swiss system is really exposed. The same goes for C9/SK at Cologne. Obviously, both teams have performed where they've had to and done the best they can in their scenario, but it really takes away from the prestigiousness and quality of the major when one of the finalists (IMT) has beaten only one top 10 team to make it to the finals.",GlobalOffensive
35084,"A megathread has been made for bugs in the new patch - Please post this here - https://www.reddit.com/r/GlobalOffensive/comments/6lwkae/bugs_megathread_for_update_07072017/?ref=share&amp;ref_source=link

---

Please take a moment to visit the rule linked above; many rules contain details which may not be evident by the rule title. If you have any further questions or concerns, please send us a [ModMail!](https://www.reddit.com/message/compose?to=/r/GlobalOffensive&amp;subject=insert%20descriptive%20title&amp;message=Please%20make%20sure%20you%20have%20read%20and%20understood%20the%20rules%20before%20sending%20a%20message#mods#button) ",GlobalOffensive
35086,Maybe if they are not getting out strated that hard.... It put a lot of pressure in the IGL to make better reads.,GlobalOffensive
35099,"I'm just saying, there's nothing really that impressive about the shot, I'm guessing it's upvoted more-so for the comedic value.",GlobalOffensive
35108,"yep just like F3 does, such a power if you can combine both playstyles.",GlobalOffensive
35161,"You tell me.

This and setting prerendered frames to 3 instead of 1 just improved fps by roughly 100. Now i should consider overclocking ryzen to 4 ghz. Before OC was not changing fps at all ROFL.

Spagetti at its finest i assume:D",GlobalOffensive
35177,"This has got to be one of the worst majors ever,if not the worst.",GlobalOffensive
35180,i literally only care about brax and steels games lel,GlobalOffensive
35189,"https://youtu.be/Rs2mGSJY4CI?t=2m5s

See you on later when C9 goes home :) ",GlobalOffensive
35213,this would be the smartest play for a lot of players. don't think its an insult.,GlobalOffensive
35219,I'm so happy right now that I'm not sure how to feel. I guess I'm fine with the run so far :),GlobalOffensive
35231,another pro tip for g2: don't use a coin for vetos ,GlobalOffensive
35238,second time I screamt this game and second time it was suNny,GlobalOffensive
35243,But what does that matter? Fact is he is way worse than Magisk,GlobalOffensive
35295,"They are true winners, willing to do what is necessary to win and not let 2nd be good enough. That is why they were one of the greatest CSGO teams",GlobalOffensive
35355,"people thought it was because of the things he said in poland, but that was ages ago, and Hiko came out of brazil alive so thorin can too. Doubt he was asked otherwise he might be at the qualifier",GlobalOffensive
35406,I was about to reply to you saying you were literally proving their point until I realized that you put /s and it wasn't just a mark on my screen.,GlobalOffensive
35424,"""Perhaps its because faceit is free to play?""

As opposed to MM?

But yeah, faceit non premium is just as cancerous as MM, and 90% of the matches either dont even start or at least never finish 5on5.",GlobalOffensive
35467,"Worldedit is poor at the moment and that's coming from a fan. I don't know if its just the way the team practices is not working out and he might shine in a different org, but he has a LOT of potential that he is not putting down right now. ",GlobalOffensive
35485,"Yeah, I really have to learn to chill out. I just can't help it! When I'm last on the team my heart races and I can't focus like I should.",GlobalOffensive
35491,For the most notorious baiter/shitposter on the entire subreddit I'd think you'd be able to come up with something better than reusing this over and over again. Guess I'm giving you too much credit.,GlobalOffensive
35510,Astralis SK should NEVER be a Round of 8 matchup. What the fuck. ,GlobalOffensive
35559,Basically all of HLTV hates SK and Brazilians. It's always a salt mine whenever SK is playing.,GlobalOffensive
35589,Pretty much. The fact that their home region sucks shouldn't be some sort of vitiating factor but eh. This is the community that's pretty much exonerated m0e so I'm not surprised.,GlobalOffensive
35622,"He fucking cheats like shit it's not even fair.  I mean he literally just plays over and over doing the same shit hour after hour just to get this thing called ""muscle memory"" fucking loaded what is this bullshit and they don't even check this before majors??  I mean he even memorises routes and shit how is this allowed??!",GlobalOffensive
35624,"Because Valve can get away with anything. They made some good games a decade ago when they cared about games and their product. People still haven't realized that Valve doesn't give a fuck about games and is purely a $$$ machine like every other company. But you're right, as soon as an update that should have been done years ago all we will hear is ""see guys valve is the best and cares, so tired of all the hate they get"". ",GlobalOffensive
35669,"I know this is unpopular but I like the new format.

I don't like everyone being given a gold. It felt like with the old format gold was the default because it was so easy to get. 

At least with the new format gold is hard to get which I like. But I understand that people want a better chance at gold. 

Maybe make it so the top 1% get gold. Top 25% get silver, and top 75% get bronze? If you wanted more golds maybe top 5% get gold?",GlobalOffensive
35685,Rip pickems and rip NRG for not picking up BIG when they had the Chance ,GlobalOffensive
35716,"You cannot peek like that with the UMP, is it really so hard to understand that the new UMP is crap unless you are very close?",GlobalOffensive
35726,DaZeD squeezed the enemy SMFC's for all the ELO he was worth.,GlobalOffensive
35727,"SK most likely, but here's hoping for G2 or Fnatic ",GlobalOffensive
35735,"All of those things are very normal things in soccer (ie. happens during all games ""at random""). I am not talking about trying to injury people, none of the things I listed is something people will get injured by, but they might hurt for 30 seconds a couple times during the match. ",GlobalOffensive
35797,G2 is playing like it's too risky to throw away a major game with risky strats,GlobalOffensive
35818,Close all steam/csgo processes and then run steam as admin,GlobalOffensive
35825,"So the primary AWP of the team deciding that he doesn't want to AWP means nothing to you? Sure he hates the AWP but there is a reason he is the primary AWP on Optic.

As you said, he doesn't really want to AWP but he AWPs anyway so him not AWPing is him putting himself over the team, pretty much checking out.",GlobalOffensive
35847,he gets global every week since he deranks and has multiple smurfs that he uses too get too global but like he sais it is ez too get global when playing with friends.,GlobalOffensive
35923,"who tf cares?.... 

People get butthurt over the dumbest shit. ",GlobalOffensive
35936,"rest in pieces, but if that's any consolation, i have sk :D and we both know who they are playing in like 5m :) kill me plz",GlobalOffensive
36009,He is just a bad player imho. Dont understan the people that call him the star player of HR...,GlobalOffensive
36017,"glhf :)

If I didn't suck at the game and lived in philly I'd join :P",GlobalOffensive
36026,"Your Immortals logo isnt quite right, should be small gaps in the yellow circle

cool pics tho gj",GlobalOffensive
36029,"bczz respected kappa. But for real, if bczz had access to this info, one can only expect fnx coming back to Brazil.",GlobalOffensive
36063,"if epsilon was being shitty about it, then the only way for this other team to communicate with them is the join the ""wrong"" server which epsilon is in.  That could explain 2 being in there. ",GlobalOffensive
36079,"SK literally play defaults and loose mid round calls every game, Gambit wins games based on strict executes and timings. ",GlobalOffensive
36085,"Well, yes. Dota 2 wasn't even a thing back then when they had the first TI. ",GlobalOffensive
36091,"I was LEM when i stopped playing. But only thing i know, if you see someone with Turkish flag or Erdogan as their profile picture, they don't even friendly to fellow Turk. All they do swear and not communicate with team. Rushing or camping when its not necessary. I apologize for people like that, i am Turkish myself. We have a lot of good gamers in this country, but you can't know if they are Turk or not because they don't behave like uncivilized fellows. Have a good day.",GlobalOffensive
36109,"https://youtu.be/SZggcP1P1gU

https://youtu.be/rAvH8vW_KIM

https://youtu.be/yZPzWsFbGAQ

those videos might give you an idea",GlobalOffensive
36114,"Don't be 16-14 for a map thats not theirs, this good news. ",GlobalOffensive
36119,"It's another incentive for teams to do their best at your event, and it promotes a kind of exclusivity while still generally having the best teams there",GlobalOffensive
36144,"They don't have the strategic/hero depth and mind games of DotA either, Blizzard knows their game is not an esport, just some low skill ceiling game you can fuck around in and have some fun.",GlobalOffensive
36154,"Your thread was removed under **[Rule 5](https://www.reddit.com/r/GlobalOffensive/about/rules/)**.

---

Please take a moment to visit the rule linked above; many rules contain details which may not be evident by the rule title. 

If you have any further questions or concerns, please feel free to send us a [ModMail!](https://www.reddit.com/message/compose?to=/r/GlobalOffensive&amp;subject=Thread%20Removal)",GlobalOffensive
36157,I have the g502 and g403 and that has never happened,GlobalOffensive
36196,It depends if you are playing in 64 or 128 ticks. I noticed that in 128 tick competitive my i7 6700k usage almost doubled from 25% to 48% when compared to playing standard matchmaking. And if you play 128 ticks in 20 players FFA deathmatch it will go up a bit more. When I'm just browsing the internet my CPU usage is less than 10%. I monitor my hardware on a 2nd screen.,GlobalOffensive
36246,"&gt; British: Always memorable. Either they'll be really cool guys or they'll be toxic arrogant fuckwits.

Finally something I can agree with. Some of the best and worst experience comes from playing with my fellow countrymen. ",GlobalOffensive
36255,"lmao, must have been the off day that made they lose",GlobalOffensive
36279,Do you live in korea or something because their internet is godly,GlobalOffensive
36298,"...but ...but they didn't have their headsets on?

edit: im impressed how many people dont understand sarcasm without the /s",GlobalOffensive
36324,i tell my teammates the lasts 1hp and they go and throw a 2v1 so you'll have to teach the people I get queued with how to kill someone with such low hp,GlobalOffensive
36339,"That's an option too, though drivers nowadays recover pretty well too. Sounds like a cascade of issues.",GlobalOffensive
36344,I don't get why I love and still play this game even though I get abused and fucked by it every time I get on. Am I secretly a masochist? I think something's wrong with me.,GlobalOffensive
36356,i would personally argue against that. the less you've got to do the more it will hurt you at that time as you've got more free time to think about it. but everyone copes with such things differently so,GlobalOffensive
36390,I had the same problem and fixed it using Custom resolution utility,GlobalOffensive
36400,"god b the tactical genius, teams have to stop giving BIG inferno..",GlobalOffensive
36404,"Again clearly u haven’t been watching the games, kio is the one who has been getting all the important frags and cutting off a lot of the rotations making it easier for his team, didn’t really see much of that this tournament though.",GlobalOffensive
36417,"Your submission has been temporarily removed because it seems to be about scamming. Those posts are very commonplace and prohibited by [the subreddit rules here](https://www.reddit.com/r/GlobalOffensive/about/rules/). If you want a cheater/scammer to be punished, report him in-game, through [Steam](http://imgur.com/a/9nYXT), or on [SteamRep](http://steamrep.com). Some information on protecting yourself from scams [can be found here](http://www.reddit.com/r/Steam/wiki/scamtypes).

*I am a bot, and this action was performed automatically. Please [contact the moderators of this subreddit](/message/compose/?to=/r/GlobalOffensive) if you have any questions or concerns.*",GlobalOffensive
36440,https://www.twitch.tv/esl_csgo hit that shit and go full screen 1080 bro,GlobalOffensive
36448,"Who says the game is horrible !? Why some people always have to paint everythink in just black and white? The success of the game doesnt argue in any way agaisnt a better approach. ""bigger"" is 10mb+/things that actually matter. 99% of those are some sort of micro transaction stuff in skins etc. . I dont know how long youve been around but the fuck ups eg. in the revolver update were legendary not unly in the sense of an overpowered revolver but in breaking game mechanics alongside as well.",GlobalOffensive
36470,"I'm sure FaceIt was (at some point, maybe it still is) MR5 and we had a triple OT game in that. We just wanted to end but there is no vote like in ESEA so it just kept going. I think in the last OT we had a leaver on our team but somehow managed to edge it out :D",GlobalOffensive
36476,"People will literally complain about anything.

Waiting for people to complain about the color of Dust's shirt.",GlobalOffensive
36572,"Your thread was removed under **[Rule 2](https://www.reddit.com/r/GlobalOffensive/about/rules/)**.

---

Please take a moment to visit the rule linked above; many rules contain details which may not be evident by the rule title. 

If you have any further questions or concerns, please feel free to send us a [ModMail!](https://www.reddit.com/message/compose?to=/r/GlobalOffensive&amp;subject=Thread%20Removal)",GlobalOffensive
36574,CEVO wishes they were used for ELEAGUE. It was Faceit that was used. ,GlobalOffensive
36590,Gonna use my math and statistic powers and say that you have a 50% chance to be correct,GlobalOffensive
36614,"Yes. Shox was happy this entire match including the good old ""Let's double AWP and I awp over kenny""",GlobalOffensive
36701,"There's the TI happe... oh wait, our game is not good enough for the TI",GlobalOffensive
36751,"They would never get Navi, Optic and Immortals in a seeded groupstage",GlobalOffensive
36771,Never trust anyone... this should be common sense. Their is also plenty of websites around for trading (such as cs.money) and you can't be scammed. ,GlobalOffensive
36795,There was a round CT side where he was wandering around solo in the open in the middle between under balc and tetris where he was just a free kill to the first T that peeked ramp. WTF.,GlobalOffensive
36812,"ofc he is , but i dont know if you watched the game especially mirage he made some mistakes holding B site with strange calls.",GlobalOffensive
36831,"If they're as awesome as you say they are, why do you even buy rifles?",GlobalOffensive
36869,"Ok that's interesting, thanks for putting time into your reply!",GlobalOffensive
36879,Alright that makes sense if you have your facts straight.,GlobalOffensive
36900,"You need to have more [interaction](https://www.reddit.com/wiki/commenting#wiki_commenting) with the /r/GlobalOffensive community before posting video or stream links. Unfortunately, this has become necessary to combat video spam &amp; people who only use the subreddit to blatantly advertise their content. Please do not contact the moderators asking about the participation level required for submitting content - we do not reveal it but it is quite low and any reasonably active commenter should reach it easily. You can find our rules regarding advertising and self-promotion [here](https://www.reddit.com/r/GlobalOffensive/about/rules/).

*I am a bot, and this action was performed automatically. Please [contact the moderators of this subreddit](/message/compose/?to=/r/GlobalOffensive) if you have any questions or concerns.*",GlobalOffensive
36901,"for a while. in fact, I don't think he's ever used it at any lans. ",GlobalOffensive
36906,"if you didnt get why it is broken... 
 They have money to buy submachines/rifles.
 Decided to buy tecs instead.
Reason behind it is that it seems playing tec9 agaisnt force is stronger than playing rifles. Since you invest about 1k less and yet you are as strong as if you would have bought rifle, its broken.",GlobalOffensive
36920,"and why is that if I may ask?

Because I play with my friend?

or

Because it looks like I am cheating?

",GlobalOffensive
36923,"Again, shaders are compiled &amp; loaded during the *map load*, not in response to firing or an enemy coming on screen. It does not cause stutter as a result.

Loading shaders from disk will 99.999% of the time be faster than compiling them from scratch (compiling is a slow process, no matter how fast your CPU is).

Regardless, this will have zero, zilch, nada impact to your FPS since it all happens during load. This never happens during gameplay. It literally has no impact on FPS ever under any conditions in any game. That's just fundamentally not how this works. This setting does exactly what it says it does - it ""optimizes 3D application load times"".

By all means turn it off, just know that doing so makes your load times worse and doesn't help your FPS at all. But placebos and confirmation bias are powerful drugs, and sometimes you just need that sugar pill even though you know it's a sugar pill.

&gt;it wears out the SSD.

lol, no, it doesn't. Reading from an SSD does not ""wear out"" the SSD. SSD wear happens during *writes*, and this is only going to write the shader to disk very rarely. There's no increase in SSD wear.",GlobalOffensive
36937,"he should quit trying to play pro again and just try to become a full time analyst.

volvo might not approve his hiring for majors but he can definitely find work for the different tourny orgs outside of majors.

some of the stuff he's said before has been pretty spot on. and of course his few times as an analyst were pretty well received.

obviously this video was kinda him just guessing but watch vods of his actual analyst work.",GlobalOffensive
