id,comments,subreddits
19,Afraid I'll get addicted and fail school or smthing lol,GlobalOffensive
28,"fuckin n0thing one taps him, stands up and takes his shirt off what a straight g",GlobalOffensive
58,"I mean maybe theres a point to playing a stretched resolution, but why is his donation notification also stretched af.",GlobalOffensive
67,"But to be fair, both the IGLs were doing there part. None of them was doing a pronax. ",GlobalOffensive
74,"HELL YEAH! Finals hype! 

I'm so proud of IMT. They wrecked VP in their home soil. 

They played so well.

Who would have thought, a week ago, that the Brazilian team in the finals would not be SK. 

Brazilian CS is a hell of a drug. ",GlobalOffensive
81,"Excepted IMT to go out in groups or quarters at best, Gambit I had some hope for considering the amount of time they prepped for the major. 

Read a few times that reseeding after each round with the swiss system should work fairly great with even matches.

With your system you could just be placed in a group with 5 really bad teams who all barely made it past the qualifier and reach playoffs - more teams = greater chance that a decent (not a good team) can beat a bad team to reach playoffs.",GlobalOffensive
82,That's literally every single operation. You get new maps and new chances to get skins.,GlobalOffensive
105,same lmao and i still want big to win but i love seeing the shit talk,GlobalOffensive
112,"You don't have to be the worst to make people laugh and be bad.

",GlobalOffensive
129,"I laughed so bad xD I wanted to post my clip here, but I  wasnt allowed to :( feelsbadman",GlobalOffensive
136,"&gt; numerous advantages

What other rounds did they gain an advantage other than the nex round in OP? C9 did it a lot more times at the banana wall during their CT side, as far as I'm aware.",GlobalOffensive
142,"I think that's because nobody realised that your model was not/was barely visible while pulling this jump, as we only ever saw the perspective of those jumping.",GlobalOffensive
167,"I see how you were confused as it seems as if the players know where the enemies are, even put their crosshairs on the enemies through the walls a few times in the clip. Just makes it that much more insane, these guys are truly pros at what they do.",GlobalOffensive
201,"I feel like you are comparing him to professional players as a standard for ""good"" pros are anomalies with 5000+ hours.",GlobalOffensive
207,didn't need to show several minutes of jason's clips. he didn't do that with anyone else. Very clear he's focusing on jason in particular in this video. ,GlobalOffensive
218,"I like the dirty air inside my room, thank you for your consideration",GlobalOffensive
230,"He spent the entire previous round (an eco for Gambit) sitting in T spawn and talking to the team, immediately called a timeout and continued talking ",GlobalOffensive
237,"it is not a matter of crying. it is a matter of randomness.
with pistol rounds being a strong influence in the final score, bo1 is not a correct measure of which teams are stronger. We are talking about the major here, so it is good that this filter is made correctly.

But you are right in some sense. the case of Faze is a good example.
it is hard to argue that for them it was just bad luck.
",GlobalOffensive
249,"Considering the games are yet to be played, I would say no. ",GlobalOffensive
284,"It used to be the case that 70% of players could not handle 128tick.. if that has changed since then its possible that valve will add it, its not like their bottom line wont allow it. ",GlobalOffensive
317,"They never met in the states, it was sk who went to Neymar's house in Brazil, and fnx never got to meet Neymar until last week in Villa Mix , a famous brazilian music festival",GlobalOffensive
358,"Your title is ""your naiv ... is gonna do anything..."" that implies heavily that you think there will be no chance at all!",GlobalOffensive
368,"&gt;7 DAMN MONTHS. can you believe it? i

it was so bad on global, if we played against turkish stacks we canceled the game because everytime someone of them was cheating",GlobalOffensive
395,"More proof that no one on reddit apparently knows what banter is. What do you think a football player would have done if you asked him to sign the shirt of a rival team? It's just a bit of fun, no harm done.

If someone well-liked like Pasha did this to a North mousepad or something, I'm sure you would find it funny.  ",GlobalOffensive
420,BIG has had more issues with the G403 in the first round of this Bo3 than I have since I purchased mine months ago,GlobalOffensive
519,"Thats why i no longer like them, they're garbage and disappointing ",GlobalOffensive
593,"lmao. TriggerBOT much yes? Even worse, you actually think supreme is something good. 

Dying over here tbh",GlobalOffensive
612,"You need to have more [interaction](https://www.reddit.com/wiki/commenting#wiki_commenting) with the /r/GlobalOffensive community before posting video or stream links. Unfortunately, this has become necessary to combat video spam &amp; people who only use the subreddit to blatantly advertise their content. Please do not contact the moderators asking about the participation level required for submitting content - we do not reveal it but it is quite low and any reasonably active commenter should reach it easily. You can find our rules regarding advertising and self-promotion [here](https://www.reddit.com/r/GlobalOffensive/about/rules/).

*I am a bot, and this action was performed automatically. Please [contact the moderators of this subreddit](/message/compose/?to=/r/GlobalOffensive) if you have any questions or concerns.*",GlobalOffensive
694,"But aim and movements alone will get you to LEM. You dont even need any nades, teamplay, communication or buy-etiquette...",GlobalOffensive
712,"""All pro players do is tweet and hope, nobody takes real action."" You yourself are saying they havent done anything. I've never blanket statement said ""THey've complained, yep PGL IS PROBLEMO"", not said that. I've always said given their line of work and the amount of people stating the issue, it's likely someone has and pgl simply havent done anything. It's likely this has happened. An org can't do anything, but be the voice for their players or player, it'd be no different. An org could only do the same as a player could say the problem and the believed oslution, boycotting a mjor or going on strike or whatever more drastic measure wouldn't be viable from a buissness perspective",GlobalOffensive
719,I know. I have mad respect for PGL tbh. They seem to be giving a shit they just forget to check something or something like having a shit ISP which is out of their power. We'll  see once they get to the arena though. ,GlobalOffensive
721,I would really like to see what the game would be like with no first shot inaccuracy and reworked damage falloff.,GlobalOffensive
747,"http://www.cs-manager.com/?l=en

I don't play so I don't know how good it is.",GlobalOffensive
812,my monitor supports 75 hz at lower res and 60 at higher maybe you have the same sorta thing,GlobalOffensive
838,Wow I didn't realise I was arguing with T_D I'm out of here,GlobalOffensive
856,"Not saying i know anything about Poland  (which I dont) and I still think Thooorin is an ass, but this does remind me of the discussion regarding the incarceration rate of African-Americans and how pointing out the high incarceration rate with African-Americans is a ""racist statement."" ",GlobalOffensive
857,"Who is this NeL guy? 
I keep seeing him ""exposing' what's gonna happen, is he like a pro usin an ALT twitter account?

dont^^^hate^^^^me",GlobalOffensive
865,Am I really the only one enjoying the system? Well it´s probably coz I got gold last time and until now every pick correct but with this system you have to really predict. I know it´s much harder but I like it.,GlobalOffensive
868,"If they tell us that they can guarantee it'll be streamed in 1080p then sure, if not then fuck ELeague too.",GlobalOffensive
874,"The reads and calls from Gobb - insane   
    
GG WP",GlobalOffensive
880,"I think VP looked more solid on the t-sides but Fnatic looked sharp on the clutches. On t-side, Fnatic rarely managed to come into those clutch situations...",GlobalOffensive
891,Yep just ask Brazilians what happened on the 8 of June 2014.,GlobalOffensive
911,What numbers lol he's just guessing it's not like someone got banned all those games so he actually knows ,GlobalOffensive
920,"I didnt even said this shit lol. its obv that he uses it cuz he liked it when he saw it on braxs stream, but the problem is that hes too lazy to try find something about the crosshair and hes calling it bug for no reason",GlobalOffensive
958,"Is that what you told your best friend and love for the last 16years, your dead wife?",GlobalOffensive
974,1.6 seemed to have the guns balanced when it had a silencer and 80 rounds. maybe we can go back to 1.6 and not have people ice skating around the map and  fast crab walking with 100% accuracy.,GlobalOffensive
978,It's not about fair. It's about what gets the most money. Honestly I think they're barking up the wrong tree trying to sell merchandise/mice/keyboards to female CSGO players since it's such a small demographic but perhaps they're anticipating growth...,GlobalOffensive
981,I would say drink something with small alcohol percentage but I don't drink anything that isn't clear/transparent and doesn't taste like I imagine piss tastes like.,GlobalOffensive
1000,"Man, that one hurts. C9 made a couple crucial misplays and threw the antieco, but they looked so good",GlobalOffensive
1034,"
&gt;It's pretty impressive that they won Velancia straight after the roster change, 

That is not true at all. They had been together for nearly two months and also had an extended bootcamp and played esl cologne before Valencia. ",GlobalOffensive
1066,"In the month of July, they are 3-7, and June 5-4. They are in a slump, still a great team but not top 3 or 5 right now. 

http://www.gosugamers.net/counterstrike/teams/14371-faze-clan ",GlobalOffensive
1085,"How do you know they wont upset sk/astralis. And if they do they could easily beat any team in the second bracket (north, big, imt, vp).",GlobalOffensive
1132,"That's some horse shit... Magisk is such a good players, but ever since Aizy came something just didn't work anymore",GlobalOffensive
1156,"I honestly don't think markeloff could become a top-class AWPer again, mou is best cis AWPer, then guardian",GlobalOffensive
1163,"you probably dont know him, hes called senor vac everyone thought hes cheating but hes just that good",GlobalOffensive
1167,"He played 2 games beforehand and didn’t complain about anything (correct me if I’m wrong). Now that he lost, it just seems like he’s trying to find excuses. Either way, complaining about shit on twitter never helped anyone. Fucking talk to the people in charge if you want to fix a problem. ",GlobalOffensive
1204,"*Bug that shits on competitive integrity of the game is brought to light during huge CSGO tournament*

*All teams decide it ruins the game and shouldn't be used*

&gt; WOw WhAT a BuNCh oF cRy BAbY sOre LoSErs. ADaPt BeCUz uR PRo!!!!",GlobalOffensive
1222,He wasn't going to be able to shoot until he was around the corner anyways so he used his knife to get there a tiny bit faster. Could have been the difference between being able to shoot cold before he went around the corner or not. Unfortunately for him it was not. ,GlobalOffensive
1230,"&gt;. If the PCs are running a bunch of shit in the background and it's causing them to struggle to run CSGO to the pro's standards then all of them will be running the same background stuff.

But that doesn't mean the background things are running properly / configured properly for everybody. Each player has their own SSD's meaning a certain players SSD might have not have been configured probably. Also just because everything is there doesn't mean it's running properly, look at Shroud with his NVIDIA. It crashed and it caused his PC to lag but it didn't happen of every other computer.

&gt;The hardware is not the problem

No it's probably not seeming as they're using high end i7s.

&gt;unless every single PC has been put together incorrectly

But what if 1 PC was put together incorrectly? Thus TACO could be on computer with a GPU not properly connected but BIG's are all fine, that would mean that taco would have it bad but BIG wouldn't.

&gt;It's software causing the problem

You see that isn't gonna help prove your point. Software crashes, it glitches and breaks. It happens, you can't do much about it as a consumer. Nothing works perfectly. Look at shroud when his NVIDIA broke, nobody elses did.",GlobalOffensive
1234,I guess all those finals and top 4 dont count anymore because of one bad tournament. Sick logic you got there,GlobalOffensive
1242,"Your thread was removed under **[Rule 2](https://www.reddit.com/r/GlobalOffensive/about/rules/)**.

Head on over to the [PGL Major Feedback thread](https://www.reddit.com/r/GlobalOffensive/comments/6onfpy/pgl_major_feedback_thread_friday/)!

---

Please take a moment to visit and review the rule. If you have any queries, do write to us through the [ModMail](https://www.reddit.com/message/compose?to=/r/GlobalOffensive&amp;subject=insert%20descriptive%20title&amp;message=Please%20make%20sure%20you%20have%20read%20and%20understood%20the%20rules%20before%20sending%20a%20message#mods#button)!",GlobalOffensive
1305,"I'm reminded of that soldier brain link shit from MGS4, holy shit what a 2v2",GlobalOffensive
1306,"&gt; provided ESL thinks the teams are of the same quality
",GlobalOffensive
1320,"Almost all pros get all or nearly all of prize money. So, Hobbit will probably get around $100,000",GlobalOffensive
1329,"Vox Eminor lost their guaranteed major spot so they became Renegades and attended Asia Minors for the guaranteed qualifier spot.

They only constant is that they're still not good enough to be competitive.",GlobalOffensive
1340,What happens when you lose your best player? You get better. Somehow.,GlobalOffensive
1343,I think in these moments people just see how far they got when they calm the nerves down,GlobalOffensive
1347,He's doing a better job putting people to sleep than Yanko,GlobalOffensive
1361,Considering almost everyone thoight vp would get annihilated 2-0 and that was vps first lan sice march it is a big achievement ,GlobalOffensive
1366,"That M0E is a genius video steel made is quality lol
",GlobalOffensive
1369,Wonder if a lot of orgs unban ibp if they would be allowed to do any valve events even if its just a minor,GlobalOffensive
1431,Feelsbadman. Hope they can make it next major. At least jkaem is playing better now top fragging 4/5 of the matches. ,GlobalOffensive
1446,"I don't know about everyone, but I want Gambit to win because of Zeus. ",GlobalOffensive
1497,Simple likes awping more doesn't he? I think if he actually trained for it he would be a god. He can already hit pretty much any shot.,GlobalOffensive
1529,Are you taking 50% of the Reddit community? wow that's a lot man,GlobalOffensive
1531,"They did peek one at a time? For the last three at least. One peeked and died, then the next peeked when he could shoot again and died, then the next peeked when he could shoot again and died.  ",GlobalOffensive
1539,"You missed the whole point. It's not about the spot, the spot is irrelevant.",GlobalOffensive
1571,I'd rather see a vote at the end of each operation to PERMANENTLY keep a map in the available map pool.,GlobalOffensive
1589,Should we call it chops like bhops but crouch and the next version?,GlobalOffensive
1631,"Well, also that he ""supports"" matchfixers :) Not good for rick fox business",GlobalOffensive
1638,As long as Felps plays drop room they can be the #1 Train team again but as soon as he diverges from that role their entire setup takes a hit. ,GlobalOffensive
1656,Pssht.. poor lad just needs some more makeup to cover up,GlobalOffensive
1689,"Put it in the shower, make it wet, put hair shampoo on it, scrub it with a sponge, wash shampoo off, let it dry and you have a new mousepad.",GlobalOffensive
1720,Seriously that observing was awful. I do not need the observer to highlight the scoreboard for fifteen uninterrupted seconds mid-round! ,GlobalOffensive
1726,"The thing is, who? Fox, Mut, mixwell, and who else",GlobalOffensive
1733,"i had north, gambit, vp, sk, astralis, g2, faze, navi on my top 8...",GlobalOffensive
1747,I can never get over how fucking funny ~~steel~~ zinc looks in this picture,GlobalOffensive
1772,"SK is ranked higher than Fnatic. Do you think its entertaining if SK wins that matchup every time they play? With how SK killed Fnatic in the BO1, would that really be more entertaining as a QF, than seeing an underdog in Optic play SK?

If you only want the 'best matchups' at events, why even invite 16 teams and have a group stage? Might as well just invite 4-8 teams and go straight to BO3 playoffs then. 

Remember when Optic won Eleague Season 2? C9 won ESL season 4? NIP won IEM Oakland? Dignitas won Epicenter? Na'Vi won ESL New York? VP won Dreamhack Vegas? All of those finals were exciting, and not because the ""best 2"" teams were in the finals, because good CS was played. 

Just like in my OP 
&gt; I think part of this problem people have is that CS is so competitive now. The #15 team actually has a chance against the #1 team.

There is a very high level of parity in professional CS right now. Anybody can beat anybody, and that's what leads to interesting matchups and entertaining CS. I'm okay with underdogs having deep runs into playoffs, with #1 teams getting upset. Part of the excitement going into tomorrow is wondering if Liquid has what it takes to continue a deeper run. 

Whats boring for me is seeing SK/Faze/G2/Na'Vi in the Semi's. ",GlobalOffensive
1814,"Just two rounds away from over-time, cmon Gambit you can do it",GlobalOffensive
1864,"He's just telling it like it is, not sure how what he said indicates he hates or loves either team.",GlobalOffensive
1869,"Didn't even get a bronze pickem trophy &lt;|:\^(

Sk let me down.",GlobalOffensive
1871,"""SK uninstalled OBS on his Krakow pc and he thinks it's bad fps"" 

ROFL, definitely the highest quality comment in a long time. Should be a post tbh",GlobalOffensive
1877,Watch old ts vods from the final of katosice 2015 against nip snd rethink that comment.,GlobalOffensive
1885,"Shroud at the end was like ""fuck i still have to play this game?""",GlobalOffensive
1906,"They can get anybody in the swedish scene with relative ease, except NIP. My guess is that they want an IGL, if not then they will get Twist/ Lekro / DD.  I didn't say NIP would be but if Fnatic threw enough money then they could get guys from NIP. They would most likely get Xizt if they wanted an IGL but I'm not sure what their thought process is.",GlobalOffensive
1910,"Mousesport, PENTA and BIG made it to the major? Someone pinch me please - what a year for German CS!",GlobalOffensive
1971,i swear every time i watch his stream and he plays i feel like he doesnt even think. he seriously looks braindead while playing,GlobalOffensive
2006,"I don't think he is good at events - that's specifically why I don't like him. He's incredibly unprofessional and so desperately edgy that I cringe, and if I'm watching a recorded event I will skip him 100% of the time. I don't have a problem with his voice or serious stuff, but his personality is pathetic.",GlobalOffensive
2007,Check your task manager if you have something like punkbuster service running.,GlobalOffensive
2029,Very bad compared to his old self and not even close to deserving of a spot on that lineup.,GlobalOffensive
2039," People under the age of 16 aren't allowed to buy the game

FTFY

",GlobalOffensive
2055,"Not what I meant, companies defying Valve and unbanning the IBP guys put them on their bad side, if all companies do it, who would Valve give the major to?",GlobalOffensive
2069,"Can someone explain to me how a tournament game works? So things like: when is a map won, how does picking the map work and maybe just some general knowledge? Came here from the frontpage video and was a casual CS:S player, so mostly my question is about the format. ",GlobalOffensive
2090,"I think it's almost unavoidable to stir up some established teams. Gonna be interesting for sure, lets hope for the best. (and not yet another french style russish roulette shuffle)",GlobalOffensive
2186,"A good old 16 teams double elimination tournament takes ages, if you dont use Bo1s. And you cant use Bo1 in a elimination bracket.

APM 1 used a 8 team double bracket with bo3s (and bo7 final kappa): What happend? The first days they played 4 Bo3s each day, which meant 13 or 14 hours per day of broadcast. The last day had one Bo3 and the Bo7. 

If you now add 16 teams, you have 8+4+2+1 (top half) 4+4+2+2+1+1 (bottom half) Bo3s + Grand Final. Impossible for events that are not going on for 2 weeks. And dont say ""make certain matches Bo1"", then teams are out after two Bo1s. ",GlobalOffensive
2203,didn't know they used it do you have a clip or anything of it? https://i.redd.it/y20fuyd1f6az.png,GlobalOffensive
2216,i don't recommend testing this any further with this specific medication...the risk for steven-johnson disease is too high.,GlobalOffensive
2225,"So many of you wasn't really believing this strat working in ESEA for example, so here is example from ESEA today. 
Enemy team had 2 x B+, 2x A+ &amp; A-. They had 1 inside site, 1 highway setup. Their highway guy gets killed by glock train, and another guy doesn't know how to react with the smoke, so he goes hiding inside it. We end up getting plant and killing 3 enemy's on eco with 1 smoke and few upgraded pistols.

I know it's just a single time, but this shows that people dont really know how to reach to this smoke, and gets you plant easily if your team works together and don't get stuck to each other.

Video: https://www.youtube.com/watch?v=CqapjMJkW6Q&amp;feature=youtu.be",GlobalOffensive
2249,nothing broken with this. it hit an incline so its gonna bounce off it,GlobalOffensive
2250,"Yea and Google should give out their search index, and facebook all the data of their users, NFL.com all the stats of all matches.

You know what, we pay a crew of more than 40 people, and anyone else is free to do the same if they want this data, what makes you think you should just have it for free?

How exactly do you expect us to keep paying people a salary to procure this data if we have to give it away for free? This is not a ""power play"", it is a ""we need visitors to pay the bills"" which I think is pretty reasonable to be honest.",GlobalOffensive
2259,"1. At level 2 I think you can start doing competitive. At level 21 you should be able to do Prime Matchmaking (Hard to explain, just google it) 
2. You get a random case drop every other game. You can get a skin/sticker/spray drop every once a week on leveling up.  
3. I don't really know, since I don't care. Sorry.   
4. It sure takes the amount of MVPs and points you have into account, however noone is really sure to which extent. It's best to go by wins as long as you play consistent.",GlobalOffensive
2274,"If a microwave is causing your ping to go up, you might have more problems than just your game. Good luck with that tumor!",GlobalOffensive
2279,But B05. SK will bring out those dope strats and I don't think C9 can keep up.,GlobalOffensive
2294,"It'll most likely be SK.

If not, it'll be FaZe or Astralis. G2 if their shit's together.

I hope it'll be G2, if not them, Cloud9.

Story of the year if VP win out of a slump at home. Maybe Na'Vi after their time away from the top 4.",GlobalOffensive
2309,"Saying ""stop repeating yourself"" is like saying ""shoot them in the head to win"", obviously they already know that. Providing advice like try to avoid using X phrase because you used it too much and it began to stick out is much more effective.",GlobalOffensive
2310,"

---

Please take a moment to visit the rule linked above; many rules contain details which may not be evident by the rule title. 

If you have any further questions or concerns, please send us a [ModMail!](https://www.reddit.com/message/compose?to=/r/GlobalOffensive&amp;subject=Thread%20Removal)",GlobalOffensive
2346,"Its the meme ironic/unironic ""12 btw haHAA"" mostly from r/livestreamfail i think.",GlobalOffensive
2350,"I think its unfair to condemn a solutions saying its only flaw is human nature, i say try it out if it gets abused, take it away.

Might as well try",GlobalOffensive
2363,Really? I feel like *most* one-way smokes are telegraphed pretty easily. (IE: why would a ct smoke that?),GlobalOffensive
2384,"""OHHHH! AND JOE NOSCOPES MUHAMMAD!""

""Yeah, he must be kicking himself down in Guantanamo Bay right now, can we have a replay on that?""",GlobalOffensive
2461,"yeah it is unfortunately, i read that you can use host_timescale to speed it up and then go back to normal and it fixes it, i only tried it once but cant confirm sorry. :( ",GlobalOffensive
2464,"AWESOME EDIT

I didnt like Clockwork 4 at all, so didnt expect much, but this one right here is art. Great choice of music btw!
",GlobalOffensive
2481,"They are totally capable of saying something as stupid as that, but they might have said ""You'll have to adapt to it, _for now_, but karrigan couldn't fit it in a tweet.",GlobalOffensive
2501,The servers haven't updated version yet. Wait an hour or so and you should be able to join,GlobalOffensive
