id,comments,subreddits16400,"i think a lot of people feel the same. for months you could tell the quality in his casting was getting worse. he'd force jokes, say weird phrases, and make a lot of mistakes in his theories as to why teams were playing a certain way. no one really 'turned' on him, it was more a natural reaction to months of hearing the same shit. sure there were the kid responses, but a lot of people just gave examples of mistakes and how he could improve. ",GlobalOffensive
16413,"true, but imo neither of them deserve a graffiti :-)",GlobalOffensive
16468,I think they were #1 at some point in 2016. Unsure though.,GlobalOffensive
16475,I like redeye as a floor host better and machine as a desk host,GlobalOffensive
16515,"If you play offline against bots, you should add `-tickrate 128` to your Launch Options.  
If the same issue occurs when playing online (on a dedicated server) you should definitely check your fps and your CPU and GPU (but most likely the CPU) temperatures.",GlobalOffensive
16531,800dpi 3 sens? Damn I play at 800 1 sens,GlobalOffensive
16536,I'm betting downvoted into oblivion below just for suggesting that valve should fix this bug.,GlobalOffensive
16547,"He was learning OOT right?

I stopped watching summit, duno but i just cant stand him anymore.

",GlobalOffensive
16549,Yes. You get lots of XP in a timely manner and it is a good way to find friends and cooperate with them. You also get a really cool badge on your icon :),GlobalOffensive
16555,"Your submission has been automatically removed because it lacks content or a link. If you intended this as a text post, you surely have more on your mind than what you have typed in the comment section. Please correct this and submit your post again. You can [view the subreddit rules here](https://www.reddit.com/r/GlobalOffensive/about/rules/).

*I am a bot, and this action was performed automatically. Please [contact the moderators of this subreddit](/message/compose/?to=/r/GlobalOffensive) if you have any questions or concerns.*",GlobalOffensive
16591,"i gained 50 fps by going from 1400x1050 + low settings to 1920x1080 + high settings + 8x aa. csgo will most of the time, be cpu bottlenecked. so if you offload more work to the gpu you get more frames.",GlobalOffensive
16638,"I've been using the ec2-a for a while now, but it's too small for me. Do you know if the ec1-a is significantly larger? Or any of their other mice. Thanks",GlobalOffensive
16643,"""I'm fine with the money I have - why be rich?""",GlobalOffensive
16673,"That's good, tho I don't care if they agree with him, just the blind hate as soon as RL is mentioned is beyond insane. ",GlobalOffensive
16682,"&gt; Richard has always stated that he doesn't dislike Reddit as a platform, but the way it is moderated by the mods and the admins.

Then maybe he should follow his own logic and stop coming here.",GlobalOffensive
16727,I put on 2 liquids (on the spots not near the astronaut) and they look good imo. NiP would prob work well with the astronaut if you wanted something more visible,GlobalOffensive
16748,"I'm asking if there's ba way to reduce the delay between the PGL stream (the one you sent) and GOTV.

I already know the stream's adress, but thanks anyway !",GlobalOffensive
16770,"I dont follow csgo, can anyone explain? did navi kick zeus out?",GlobalOffensive
16815,The windows install is on the players SSD. Not on the computer. Shrouds fault. ,GlobalOffensive
16832,"How much are we talking here? I have $16k in my savings.

e: the amount of people not understanding the premise of what I said is just astonishing.",GlobalOffensive
16842,"Doesn't matter if it was for being unranked. You're supreme now which is shameful for such a good player like yourself, if you're trying to teach a player who has been global for 4 years, rank 9/10 on faceit, I would be expecting a little bit more from you, but you can't even rank up to global, which is the basic of being an average player at this game rofl. 

Do you even know what egoistical is? Or are you throwing random words in the air? 

I'll repeat myself, since you're clearly dodging the issue here: ""I explained you why you would have no advantage and climbing the ladder was a stupid mistake, but you make no mention of it, you simply ignored. That's another way of saying you're wrong :)""

At this point you're just being humilliated tbh. People downvoted you to hell, clearly showing you you're wrong. Your lack of arguments is noticeable since you can't give me a proper explanation on how you would survive all these situations because lets admit it, you're not the best of players. Also, you already admited you're not even global, while I've been global for years and have a lot more experience than you, so its safe to say I'm a lot better than you and you should accept this as constructive criticism and not get mad like a little kid and keep on replying without proper argumentation. Cheer up kiddo, maybe someday you'll get to global and be an average player, till now you're shit.",GlobalOffensive
16848,"Jesus christ calm down people, it sucks but do you want to start the game without a player having working sound?",GlobalOffensive
16850,So I guess it is acceptable then since you choose to just insult instead of explaining.,GlobalOffensive
16852,"Yes, I've neglected hydra games. I've played it a couple of times and there are a lot of hackers. But in prime mm I've not seen a blatent hacker in a long time.",GlobalOffensive
16863,"Just go for it, the missions are painfully fun, the game modes are different and interesting, and weekly limit for xp can be caught up on.",GlobalOffensive
16866,"I'm salty today about PGL's stream and that's it. I don't think it's dumb to have a viewpoint on the bug though, it's okay to not like it or be fine with it. But I also don't think people should threaten BIG and blast them constantly on all social media platforms for it, that's where the problem is.",GlobalOffensive
16870,"Same here. Even if I wanted to play League again I cbf learning all the new masteries, reworked champions, newly released champions etc etc..

But if someone quit CS 2 years ago they will have no problems just starting it up and playing it again.",GlobalOffensive
16874,"So what? Its also a silent jump and he clearly didnt abuse it there. Its not banned either, teams agreed not to abuse it in Krakow, everyone still uses that jump time to time if not for its bug ability then for jumping silently.

nOOb!!",GlobalOffensive
16925,Or you can just remember how much XP you need and subtract from there?,GlobalOffensive
16937,That attitude reminds me of the guy in one of my last games who was only 'comfortable' using mp9 and mac10 the entire game. He finished 4-22. U him?,GlobalOffensive
16946,Check the date. Nuke took its place after it was added. ,GlobalOffensive
16956,"""we have reduced price of Negev to $1, to encourage experimentation of this new style of weapon.""",GlobalOffensive
16990,"Afaik LoL has really low prize pools.

But yeah, compared to Dota2 and their 3mil majors it's low ,especially since they have around the same profit from both games",GlobalOffensive
17015,"NO S1MPLE NO MAJORS LUL

GOD B IS BACK BOIS",GlobalOffensive
17022,"Not crying just stating a fact, if the cheating is blatant do I really need to watch 6 more rounds of a guy spinning in circles to the point of making me want to vomit while he sits at spawn getting head shots?",GlobalOffensive
17051,"i did read, and i confirmed that its not a lie, he was not sure about it being a bug and i proved that it is, whats wrong about it?",GlobalOffensive
17053,"Fnatic over SpaceSoldiers
North vs. Heroic is going to be an amazing brawl which everyone who are at least interested in CS:GO should watch. 
The same goes with Cloud9 vs. Immortals and SK vs. G2
Mousesports gonna win over Na'Vi
Faze wins over Optic Gaming.

I'm quite sad that while the danish derby is going on, I'm at work doing boring work stuff! :/ But no matter who wins, I  hope they will get to the playoffs too!",GlobalOffensive
17087,"So then why is everyone complaining about their picks, if they can just constantly change them to who is going to win?",GlobalOffensive
17132,Also depends pretty heavily on how many premier rosters die. If enough die that they can do the other promotions like mains top 4 etc then they likely will also promote the open winner ,GlobalOffensive
17146,I adore the simplicity of the Redline collection. Try to pick my skins accordingly!,GlobalOffensive
17172,"There is a some kind of ""sleep"" option which basically limits the fps to 30 if the game is not in focus AKA not fullscreen or TABed.
It's the only thing that comes into my mind. You can see the same cancerous fps when a streamer TABs the game to check something on Chrome, change a song or whatever. :)",GlobalOffensive
17260,Don't get how FaZe fuck up so many times..... after their previous games they should be on fire but they can't even win 5 rounds,GlobalOffensive
17271,What would it being a bad major have to do with whether it's PGL's fault or not? What a dumb post,GlobalOffensive
17313,no it doesn't but they're top 5 easily even before the major they had good form just people didn't realize because they never attended some big tournaments.,GlobalOffensive
17355,This. It would be interesting to see how often people cry wolf.,GlobalOffensive
17369,"For anyone who hasnt read the book or watched the movie.   Please actually do so, too many kids I see playing CSGO havent seen the classics.

Think of your meme game if nothing else

Heres a list, its at #1 
http://www.imdb.com/chart/top?ref_=ft_250",GlobalOffensive
17374,"My question is how this works with holos / foils, does it reduce the effect at all?",GlobalOffensive
17375,"&gt; Player animations/models and player perspective are intentionally not in sync to improve player experience. 

So you mean that your experience is better when you can see a player jumping behind a wall, then prefire you while running around the wall because he knows exactly where you are? Come on.. You can't possibly think that improves your experience with the game.

It is as simple as banning bugs, because they have done so before. Pixelwalking, boosting above textures to look through them etc etc. All bugs, all exploits of said bugs.. How is that any different from what's going on now?",GlobalOffensive
17444,not to mention the reason this Optic team succeed in the past was because of their ability to just swarm sites. Add to that the fact that almost every team was doubting them and you have a decent recipe for success.,GlobalOffensive
17452,"I don't know man, JW's kinda hot. (NO BIAS) (NO HOMO)",GlobalOffensive
17467,Idk. Someone in the youtube comments just pointed that out to me and my glow is almost always like that when I load up a demo. https://www.youtube.com/watch?v=u4nfbbxAM1g https://steamcommunity.com/groups/overwatch_official/discussions/0/630802344354372984/ http://steamcommunity.com/app/730/discussions/0/348293161790576762/ It's whatever this is,GlobalOffensive
17474,"Your post was removed because a similar clip has already been submitted. 

If you believe this removal was made in error, feel free to send us a [modmail](https://www.reddit.com/message/compose?to=/r/GlobalOffensive&amp;subject=insert%20descriptive%20title&amp;message=Please%20make%20sure%20you%20have%20read%20and%20understood%20the%20rules%20before%20sending%20a%20message#mods#button).",GlobalOffensive
17481,"Just a bit of constructive criticism, but your crosshair placement is far too low. Ideally you should be aiming at head height or perhaps chest height if your aim is poor, however you are aiming at the groin area.

Just a tip to help you maximise damage :)",GlobalOffensive
17485,Offer sent. I've already kicked our gold nova exit fragger.,GlobalOffensive
17493,"I mean, I would hate it equally, but it's funny how people don't realize that the hate platform is the same - Nazis by race and nationalism, Commies by class and nationalism.",GlobalOffensive
17500,It is. SK and VP put 50k each towards the prize.,GlobalOffensive
17501,did it change anything? i think its random seed right? so it wouldnt matter if big goes 3-0 or if sk goes 3-0. or am i wrong?,GlobalOffensive
17521,The fact you just replied with this tells me you defo need better aim.,GlobalOffensive
17541,oh my God! I shivered through the entire video. I love this. I love you! ,GlobalOffensive
17553,"Damn, the guy looks really young. Nice that Sweden actually has some young player with a lot of potential!",GlobalOffensive
17565,"Valve has a huge profit from cheaters. They will always improve their anticheat, but they will never make it perfect.

The reason is simple. By banning people in waves, it forces those that have been banned, to buy a new copy of the game (and possibly some skins). ",GlobalOffensive
17583,"That sure looks like it, thanks!

Why call it ""vod"" though? Is that a term I don't know?",GlobalOffensive
17595,Fallen won sk the game with all the retake kills. I wonder what his rating 2.0 is,GlobalOffensive
17601,So could you lay some of Cloud9's failures on the orgs bad job to recruit a coach?,GlobalOffensive
17605,"That's weird - I'm on Win 10 as well, and managed to get in two competitive matches yesterday, after the update?

Anyway, based on the GitHub thread, it sounds like an update was pushed that fixed it...",GlobalOffensive
17644,"Fat orange tabbies master fucking race!

Reminds me of my cat, but he had more white in his coat pattern. Don't take your time with him (her? I'm assuming it's a male based on the size) for granted. I'd give up my ST Howl just to have one more hour with my cat.

Play with him whenever he comes around bothering you! You'll be glad you did later.",GlobalOffensive
17728,"Nickname is PrO-bOy (those are O, not zeros, some people mix them up) and this is [my current avatar.](http://cdn1-www.wrestlezone.com/assets/uploads/2016/03/bullet-club-logo.jpg) (it's a wrestling thing)

I guess this is an easy one, edit the text on top and maybe change the skull part into something CSGO related (SAS gas mask, maybe? Or something T related).",GlobalOffensive
17762,"Thorin also isn't saying you can't or shouldn't celebrate qualifying for a major. He's essentially saying: If you celebrate, it must mean you did something hard and that you're proud of. If qualifying for the major was hard for you, then you're probably not going far in the major itself.

This statement is probably true.

However, the landscape of ""back in my day"" and now has vastly changed. The teams you have to play to even get into a major from the closed quals is, imo, stacked as shit compared to even a year ago. So I disagree with the assertion that qualifying is not something worth celebrating. Especially if it's the first major you've qualified for.",GlobalOffensive
17796,"never seen this actually.  afaik it isn't in more tournaments, but it may be being used at cologne as ESL own ESEA",GlobalOffensive
17797,"Ill see if I can find a good one here, any bad stuff to watch out for? some bad extra ingredients or some shit like that?",GlobalOffensive
17813,Well played by ska really. Shame it didn't work out.,GlobalOffensive
17821,"You're such a lucky man! She's the perfect one, you should marry her asap :D Good luck :)",GlobalOffensive
17944,2 cheaters in every match? Doesn't seem like a reasonable estimate at all to me.,GlobalOffensive
17964,Also because it's so fun to bash NA teams I'd guess :p,GlobalOffensive
17971,Lol it's just the India West (Mumbai servers). India East Valve servers and 3rd party servers have no issues.,GlobalOffensive
17994,"You tried to push the narrative that G2 could be more tired than NIP, but imo, that's bullshit. They looked more tired, because they got rekt. No one is going to look happy or energetic when you are getting plowed by Honeymoon NIP.

They waited the same hours to play. G2 was favored by everyone. They didn't perform. Shit happens. Especially when NIP is back bois.",GlobalOffensive
18052,if reddit had its way the maps would have more graffiti than the fucking nurburgring,GlobalOffensive
18057,"Both Optic and Liquid at Eleague Major......Stan leaves, now both teams aren't at the next Major.....🤔 And on Mirage of all maps.

Can't trump the Flipside major miracle.",GlobalOffensive
18070,"Idk, this logo looks a bit cheap. Would look better if the SK logo was smaller so it's completely visible.",GlobalOffensive
18176,Oh shit thanks! Didn't realize he posted on reddit. Kinda new to following CSGO in general haha.,GlobalOffensive
18186,"But it was. He was talking about how it's integrated into the tactics and there's that side of it but there's not. You had to gamble or risk dying to get the information you get for free now. It doesn't require you to integrate it into your tactics, it enables you to not use tactics because you have risk free information.

https://www.reddit.com/r/GlobalOffensive/comments/6nu3x7/nex_abusing_the_jump_bug/

There you go fucking greatest tactic in major.",GlobalOffensive
18199,"He's always been stubborn and overconfident. The most important round SK won on Cache as a CT was with a good play by Fallen with a FAMAS. He should just have played with rifles, he couldn't hit anything at all with the AWP except one clutch on cache.",GlobalOffensive
18211,"That, and it was only 1 song. If it gets into a full blown 30-45 minute set... Then it's a big ol' nope.",GlobalOffensive
18212,"You left out NBK, based off of Nathan Baguette K'Schmitt.",GlobalOffensive
18250,reminds me of another small thing ( ͡° ͜ʖ ͡°),GlobalOffensive
18252,"My fix to the panic spray issue is to practice 1 taps + bursts in FFA (not HS only). Reducing your panic sprays can be corrected with (lots of) practice. Doing this in warmup before a MM game helps reinforce this as well. 

Watch replays to understand why enemies are catching you off guard all the time. Is your knife out? Are they scrimming out on a site after bomb has been spotted at the other site and catching you while you're rotating? Are you picking bad spots? Are you not using utility to retake areas of the map?",GlobalOffensive
18264,I hope there will be pins at ESL One Cologne ,GlobalOffensive
18316,"lol like that actually matters it hasnt even made it to 3 yet you think 2 vs 1 makes a difference? LOL lifetime ban.

you guys even argue like children it's amazing. how old are ya kid?",GlobalOffensive
18318,"same problem I do not have color tab in display settings
Card: 7870
People on AMD reddit saying its due to W7 installer not having all features for somereason",GlobalOffensive
18321,"Dec 3rd 2016 - ELEAGUE Season 2 Finals

Looks like a heavy shroud.",GlobalOffensive
18393,"How is nothing cheating years ago any relevant to chatting in a tense situation, hoping you get away and losing money that equates to a drop in the ocean. (1%)

I am not berating, nor are the top commenters, as far as I can see.

If we brought up every mistake every person involved has ever made we would have to write fucking essays. They fucked up, they got punished.

You keep bringing up nothing's cheating YEARS ago. Are we allowed to bring up everything the SK players did ever? Even if it is not relevant?",GlobalOffensive
18395,Oh yeah I don't plan on using it! I was just curious as the numbers just confuse me haha!,GlobalOffensive
18409,"Your submission has been automatically removed because it lacks content or a link. If you intended this as a text post, you surely have more on your mind than what you have typed in the comment section. Please correct this and submit your post again. You can [view the subreddit rules here](https://www.reddit.com/r/GlobalOffensive/about/rules/).

*I am a bot, and this action was performed automatically. Please [contact the moderators of this subreddit](/message/compose/?to=/r/GlobalOffensive) if you have any questions or concerns.*",GlobalOffensive
18423,"There's no groups in swiss format. And to get 3-0 you will have to beat one of those 3 for sure. What I mean is navi is a much more risky pick than any of those 3, and it's not worth the risk imo. But I don't say it won't happen, it's just unlikely.",GlobalOffensive
18426,"&gt; But they're expensive af to make up for it.

they go on sale all the time tho at least here in germany.  
the wireless g403 costs 66€ on amazon right now which compared to other mice isn't particularaly expensive.",GlobalOffensive
18445,"You need to have more [interaction](https://www.reddit.com/wiki/commenting#wiki_commenting) with the /r/GlobalOffensive community before posting video or stream links. Unfortunately, this has become necessary to combat video spam &amp; people who only use the subreddit to blatantly advertise their content. Please do not contact the moderators asking about the participation level required for submitting content - we do not reveal it but it is quite low and any reasonably active commenter should reach it easily. You can find our rules regarding advertising and self-promotion [here](https://www.reddit.com/r/GlobalOffensive/about/rules/).

*I am a bot, and this action was performed automatically. Please [contact the moderators of this subreddit](/message/compose/?to=/r/GlobalOffensive) if you have any questions or concerns.*",GlobalOffensive
18479,"thats why i said last minute but okay maybe its not the best example. but still as long as its okay with the rules, every team can use it. ",GlobalOffensive
18490,I hope we get a lot of gifs we don't deserve from this match,GlobalOffensive
18516,A few months ago BIG were seen as a fodder T2 team who would barely qualify for stuff now they have a real chance at a major final. Insane,GlobalOffensive
18519,"btw there is any software that can monitor and save my hdd perfomance over time when im playing cs go ? i suspect my hdds dying (something like 1.5 year running in each hdd smart info) and cs go when playing read vpk files all the time (sounds files i think) 
i tried to make symlinks to vpk files and move them to pendrive but i have only usb2.0 pendrives so speed is too low",GlobalOffensive
18523,"D A M N

magisk replacing kio, kio replacing xms, xms replacing maniac ezpz lemon panini

thats a hard Kappa btw",GlobalOffensive
18525,"Wait, you want to say you don't stand with smoke in your hand on mirage T side for 50 seconds just to get pushed by single CT and die like everyone else? 

",GlobalOffensive
18529,"Well does it give VP wallhacks? No? Sure, North is mentally affected by it but that's how it always is.",GlobalOffensive
18549,"You're done BIG, go home and check your corners for once.",GlobalOffensive
18554,And yet you keep watching their events. They will never improve so long as you keep doing what they want.,GlobalOffensive
18558,"I actually refunded pubg after 10 minutes of playtime because it was so bad, and I used that money to buy h1z1. Of course I had to refund that too, I really need a new PC, mine is garbage",GlobalOffensive
18559,"&gt; People are acting like they only won because of the jumpbug

There are way more people saying this than people saying that BIG one because of the jump bug. But bug abuse definitely taints their success in the major imo. They could've won without it but chose to use the bug.

^(ignore flair pls)",GlobalOffensive
18590,lul C9 would have had a 10-5 CT half if coldzera hadn't done literally godlike plays on the first rounds,GlobalOffensive
18637,pleaseee... noooo I don't think it's worth it at all,GlobalOffensive
18638,"That like 13 second blitz through smoke on T side was fucking bonkers.

It was like Flipside were actually capable of the late round executions Fnatic seems to dream of",GlobalOffensive
18639,They're changing that next year though. Earn points by doing well at important tournaments so you can get an invite to the next TI. Done of course to prevent teams from coasting. ,GlobalOffensive
18651,"foda-se esse sub lixo, enquanto isso os troféu tá empilhando.",GlobalOffensive
18714,"I'm sad for immortals but so fucking happy for Zeus and Gambit. Truth be told they deserved it much more than IMT. Going 3-0, Defeating fnatic and astralis and on top of that being able to throw a big fuck you to Na'Vi.",GlobalOffensive
18733,"Even better, even if they suffer losses, Pro league is Pro league, he's playing his countries finest none the less",GlobalOffensive
18735,actually yes from what I know dazed is a big sports guy,GlobalOffensive
18794,"Do not reinstall steam. Take it from me, it does not help! I think all we can do now is wait on Valve.",GlobalOffensive
18817,"? Henry literally called vp out for only winning rounds because of huge plays.. how is that biased, lol.",GlobalOffensive
18818,OH YEAH YOU FUCKING LIKE THAT YOU MOTHER FUCKER GOD DAMN LAG AHHHH FUCK!,GlobalOffensive
18819,Game mode is supposed to allocate more resources to the game so it should improve your performance  but it may not be a large increase on better systems.,GlobalOffensive
18822,"Are you using a vac-ban tracker?

Use that for a couple of months, then come back to us.",GlobalOffensive
18828,"He means that back when Thorin was a 19 year old feeble looking nerd who attended CPL &amp; WCG, teams didn't celebrate for making it to these top-level LANS until they won the whole thing.

Though tbh, the prize money was shit unless you won and there was no sticker income or mass exposure gained like today, so qualifying teams like *Immortals* certainly have a better reason to celebrate than *Team9* or *Advanced Online Losers* did back in 2003.",GlobalOffensive
